"id_palabra","Palabra","id_cronista","id_texto","cita","pagina"
40414,"Ynga / Yngas",4,"T44406","Y esto ansí hecho, mandó que luego allí saliesen las mugeres señoras de los señores [testado: que] de la çiudad del Cuzco y que cantasen allí en presençia dél y de aquellos prisioneros un cantar que allí ordenó, el qual dezía: YNGA YUPANGUE YNDIN YOCASOLA YMALCA CHINBOLEISOLA Y MALCA AXCOLCY HAGUAYA GUAYA HAGUAYA GUAYA, que quiere dezir Ynga Yupangue, hijo del sol, vençió los soras e puso de borlas, con el sonsonete postrero de hayaguaya, ques como la tararara que nos dezimos.",207
40414,"Ynga / Yngas",4,"T44407","Y los capitanes que él enbió por la provinçia de Condesuyo conquistaron e sujetaron hasta Arequipa y de allí se subieron hazia el Cuzco, por donde vinieron sujetando los pueblos y provinçias de los collaguas, canas y los de Lurocache; y de allí se vinieron a la çiudad del Cuzco, dexando hechas las puentes de Quiquixana y otras muchas que ansí atrás avían dexado hechas por los ríos que ansí hallaron en las provinçias que ansí pasaron, donde como supiesen que el Ynga no hera entrado en la çiudad, no entraron en ella e pasaron por de fuera.",208
40414,"Ynga / Yngas",4,"T44408","E como llegasen junto a la çiudad del Cuzco, supieron que el Ynga no hera aún allí llegado, e no se osaron entrar en la çiudad e ansí pasaron por de fuera della en demanda del Ynga, donde como pasasen de la çiudad supieron que sus conpañeros los otros capitanes avían pasado por allí un día antes con muchos prisioneros e grandes despojos que ansí en su conquista avían avido, los quales ellos no llevaban menos.",208
40414,"Ynga / Yngas",4,"T44409","Holgose de ber a sus capitanes, los quales llegaron a él y hiziéronle gran reverençia y acatamiento cada uno dellos por sí. Y esto hecho todos los capitanes del esquadron que avía ydo por Condesuyo, por aver llegado allí antes que a el otro, hizieron ençender un gran fuego delante del Ynga, en el qual fuego le sacrificaron çiertas obejas y corderos y ropa fina e maíz y otros bastimentos que ansí trayan avidos en la guerra.",209
40414,"Ynga / Yngas",4,"T44410","Y esto ansí hecho, estos tales capitanes y sus prisioneros se apartaron a una parte y ansí llegaron los otros capitanes que avían sujetado la provinçia de los andes y ansí hizieron lo mismo que los otros hizieron delante del Ynga y el Ynga hizo ansimismo con ellos y sus prisioneros y holgose mucho de ber las fieras y animales que ansí le ponían delante, a los quales mandó que no diesen de comer aquel día ni otro.",209
40414,"Ynga / Yngas",4,"T44411","Y así entró el Ynga en el Cuzco, donde como llegase a la plaça halló en ella el bulto del sol y los demás bultos de las demas guacas e de los señores antiguos que él ansí avía hecho, a los quales como ansí llegase hizo su acatamiento y sacrifiçios.",209
40414,"Ynga / Yngas",4,"T44412","Y como ya avía dos días que no comían las fieras, dizen que comieron no se quántos dellos y los que ansí hallaron bivos en fin de los tres días hecháronlos fuera, los quales fueron deprivados luego de sus haziendas y señoríos e poderes y dados por moços y sirvientes a los bultos que allí estavan; e las ynsignias e cosas déstos que en la guerra trayan quando ansí fueron presos, mandó el Ynga que todo fuese puesto en una cassa que para que en ella fuese puestas las cosas semejantes que ansí en la guerra heran avidas por él fuese señalada, la qual cassa nombró e mandó que se nombrase Llaxaguaçi.",210
40414,"Ynga / Yngas",4,"T44413","Y esto hecho, mandó traer ante sí todo el despojo que ansí en la guerra se avía avido de ganados, ropa y joyas de oro y plata yndios e yndias, todo lo qual mandó a sus capitanes que lo repartiesen entre toda la gente de guerra que en la tal jornada ansí le avían servido, tomando él dello primero las cosas que bien le paresçieron; y ansimesmo dio a sus capitanes las partes que a él bien le estuvieron. Y esto hecho, luego allí en presençia del Ynga fue repartido todo el demás  entre la gente común, gente de guerra que ansí le avían servido.",210
40414,"Ynga / Yngas",4,"T44414","Y el Ynga les mandó que le dijesen qué tenían en sus tierras y qué posibilidad alcançava cada uno y que le dixesen la verdad porque él tenía hordenado de poner en cada provinçia de cada uno dellos un orejón señor natural de los del Cuzco, a quien ellos y cada uno dellos respectase en su tierra como a su persona, el qual sabría lo que ansí cada uno tenía e poseya y que como él supiese que la avía dicho mentira qualquier dellos, que entendiese que avía de morir por ello.",210
40414,"Ynga / Yngas",4,"T44415","Y esto hecho y proveydo, el Ynga nombró e señaló los orejones e señores que ansí avían de estar y resedir en los tales pueblos e provinçias, con los quales se uviese de tener quenta e razón en ellas de todo lo que en ellas pasase e agravios que entre la gente se hiziesen, los quales tuviesen cuidado cada año de dar e repartir las tierras a los tales naturales della e ansimismo hiziese juntar cada año los moços y moças que uviese solteros y que ansí juntos se lo hiziesen saber para que él proveyese señores que fuesen a casar los tales.",211
40414,"Ynga / Yngas",4,"T44416","E que ansimesmo tuviessen cuidado espeçial de hazer enbiar de cada quatro a quatro meses a la çiudad del Cuzco las comidas que ansí les hera mandado que truxesen para proveimiento de la çiudad; y que ansimismo tuviesen cuidado de mandar hazer traer la ropa e oro y plata y ganados y las demás cosas que avían de traer cada año de tributo, donde siendo proveído y hordenado por el Ynga lo que avéis oydo, los caçiques y naturales della avían perdido libertad y heran en subjeçión perpetua, en la qual bivieron hasta que los españoles entraron en la tierra.",211
40414,"Ynga / Yngas",4,"T44417","Y esto ansí hecho y mandado, los caçiques se fueron a sus tierras llevando cada uno dellos consigo un orejón de la çiudad del Cuzco para que con ellos viviese y residiese en sus tierras para lo ya dicho. Y ansí se fueron y el Ynga se quedó en su çiudad con los suyos.",211
40414,"Ynga / Yngas",4,"T44418","Y luego allí fueron llamados çiertos orejones mançebos, a los quales les fue mandado que luego se partiesen y fuesen a todos los pueblos y provinçias y llevasen el mando del Ynga que ya avéis oydo e sin les dar razón para qué fuese la tal gente que mandaron que luego se partiesen, la qual nueba mandó el Ynga allí en su consulta que fuese oculta y secreta y ansí los mensajeros se partieron y el Ynga y llos suyos salieron de su consulta.",214
40414,"Ynga / Yngas",4,"T44419","Y ya cumplidos los tres meses y en fin dellos, la gente de guerra fue llegada a la çiudad, donde el Ynga mandó hazer su reseña y halló que heran por todos çiento y çinquenta mil hombres sin la demás gente de serviçio que ansí trayan. Y como ya el Ynga estuviese adereçado y los suyos paresçiéndole que tenía gente bastante para hazer su jornada; y luego otro día hizo sus sacrifiçios a sus ydolos según que él tenía de uso y de costumbre y tomando su ydolo de batallas que él tenía, según ya os diximos, se partió en demanda de este señor de Atuncolla a la provinçia de Collasuyo, donde como ansí fuese conquistó y subjetó los pueblos y provinçias que ansí en el camino hallava.",216
40414,"Ynga / Yngas",4,"T44420","Y como el de Hatuncolla tuviese nueba que el tal poder de gente yva sobre él, hizo junta de los suyos, donde dizen que juntó más de doçientos mil hombres de guerra, con los quales esperó en el su pueblo Hatuncolla, donde como llegase el Ynga dio su batalla, la qual fue tan porfiada e reñida, que como la començasen por la mañana no pudieron conosçer della vitoria hasta ya hora de bísperas, en la qual batalla dizen aver muerto de una parte y de otra más de çien mil hombres y al fin della fue conoçida vitoria por el Ynga y los suyos.",215
40414,"Ynga / Yngas",4,"T44421","En la qual batalla fue preso y muerto aquel señor de Atuncolla, la cabeça del qual mandó el Ynga que fuese adereçada de manera que no se dañase; y a los demás señores que allí fueron avidos, mandó que fuesen presos y bien atados y puestos a recaudo y ansimesmo mandó que nadie fuese osado de enterrar ningún cuerpo de los de los [sic] enemigos; e ansimesmo mandó que todo el despojo de ganados y ropas y joyas de oro y plata y pieças de yndios e yndias de serviçio que allí heran avidas, a las quales ellos llaman piñas, que todo fuese recogido y puesto a recaudo porque hera mucho y en muy gran cantidad.",215
40414,"Ynga / Yngas",4,"T44422","E luego otro día de mañana tomaron los cuerpos de los amigos y pusiéronlos en sepulcros, no para pensar de dejallos allí sino para que estuviesen allí algún tanto de tienpo mientras el Ynga andava sujetando aquellas provinçias, porque una de las cosas que ellos avían pedido de merçed al Ynga fue que los cuerpos de los que ansí muriesen en la guerra mediante el tienpo que durase que sería traído a su tierra, lo qual le avía pedido un señor del Cuzco de merçed en nombre de todos los demás y de la demás gente y el Ynga se lo avía prometido porque estos yndios tienen y dizen en esta manera: CAYPACHA TUCOPTIN ATARIXUNXI LLAPANCHIC RUNA CAOçARISPA YUCHANTIN Y MANAMCUNA CANCHIC, que quiere dezir des que este mundo se acabe, des que nos emos de lebantar todas las gentes con vida y con esta carne bien ansí como agora somos y quien esto les hizo entender ellos se lo saben; y a este fin rogó aquel señor así por los del Cuzco como por los demás, que los cuerpos de los muertos fuesen bueltos ansí al Cuzco como los de los demás a sus tierras.",216
40414,"Ynga / Yngas",4,"T44423","Y ansimesmo mandó el Ynga que los cuerpos de los muertos fuesen por ellos cada e quando que entendiesen que estavan curados; a las mugeres y hijos de los tales muertos mandó que les fuese dada çierta parte del despojo que para las tales ansí avía mandado repartir por la suma que le fue dada de los que avían muerto.",216
40414,"Ynga / Yngas",4,"T44424","Y esto mandado y proveído los caçiques y señores se fueron y el Ynga se quedó en su tierra con los tuyos, en la qual çiudad y pueblo del Cuzco después que bolvió de Collao se estuvo otros veinte años que no entendió en cosas de la guerra sino en holgarse y recrearse en todas maneras de viçios, ydolatrías y en hazer algunas cosas de buen govierno, según que os contará la ystoria en el capítulo siguiente.",217
40414,"Ynga / Yngas",4,"T44425","Y que si la tal persona, por su caussa de ser hombre desperdiçiado y de mal exemplo y bibir perdiese la tal su hazienda, que este tal fuese hechado del pueblo en el serviçio de la guerra y que della no saliese si no uviese hecho tales serviçios al Ynga y a la çiudad del Cuzco que por los tales serviçios meresçiese bolver al Cuzco y a este tal ansí buelto le fuesen hechas merçedes; y avíase de ver con todo esto que en su persona avía enmienda y buen exemplo y que de los depósitos ya dichos fuese el tal proveydo y reparado.",220-221
40414,"Ynga / Yngas",4,"T44426","Y ansí estos tres repartamientos tenían a cargo de guardar e apaçentar los tales ganados que ansimesmo heran propios de la çiudad; y cada año heran obligados los caçiques que ansí este ganado guardavan de dar quenta a un señor de la çiudad que para esto hera señalado, el qual señor hera deudo muy çercano del Ynga y más prinçipal en la çiudad, al qual señor davan quenta los tales caçiques de los multiplicos y lana y del ganado que ansí se uviese muerto en aquel año, lo qual mortezino trayan seco delante dél y curado hasta las telas con que los corderos salían enbueltos quando naçían, todo lo qual trayan seco y curado; e ansí se dava quenta de todo trayéndolo allí presente.",221
40414,"Ynga / Yngas",4,"T44427","Y si caso fuese que del tal ganado no avía la quenta que hera razón y se hallase que de una sola obeja fuese en cargo el tal caçique que ansí la guardava, mandó el Ynga que este tal fuese ahorcado públicamente por honbre desperdiçiador de la hazienda y bien de la república.",221
40414,"Ynga / Yngas",4,"T44428","Y ansí este tal ni el que se pusiese en defensa de no dar lo que le tomasen por el tal caso, que nadie fuese osado, aunque fuese la señora prinçipal muger del Ynga, de rogar al Ynga por la vida de ninguno déstos, aunque fuese su hijo propio el que fuese condenado por el tal delito, que no quis[i]ese dar lo que ansí le fuese tomado.",222
40414,"Ynga / Yngas",4,"T44429","Y esta tal ropa y joyas que ansí heran tomadas, el año cunplido y postrer día del mes del tal año, saliese el Ynga a la plaça con todas sus mugeres y gente de su serviçio, desde el mayor hasta el menor, que no quedase en su casa ninguno y que lo mismo hiziesen todos los señores de la çiudad.",223
40414,"Ynga / Yngas",4,"T44430","[...] y siendo ya estos todos ansí venían aquellos señores ya dichos cada uno con su gente, entrando por su horden en la plaça bien ansí como avían començado en el año, y ponía el que primero entrava delante del Ynga y de aquellos quatro señores y sacavan pieça a pieça la ropa y joyas; y como las yban sacando ansíyvan trayendo delante del Ynga y de aquellos señores las perssonas cuyas heran.",223
40414,"Ynga / Yngas",4,"T44431","Y abrán de saber que a los que déstos más culpa davan y castigo hazían heran los que heran tomados en qualquier manera, quien hablando en palabras de amores, quier retoçando o verdaderamente durmiendo con muger cassada o con mamacona del sol o del Ynga o de cualquier bulto de los señores passados ya muertos, ansí que todos heran castigados en presençia de todos los que allí heran, conforme a los delitos que ansí avían hecho.",223
40414,"Ynga / Yngas",4,"T44432","Y si caso hera que allí se hallava culpante algún hijo del Ynga en delito que mereçiesse muerte, el mesmo Ynga por sus manos le matase allí  en presençia de todos, diziendo que quien avía de dar en exenplo que no avía [de] delinquir como fuesen los hijos del Ynga y los demás señores.",223-224
40414,"Ynga / Yngas",4,"T44433","Hordenó y mandó considerando dos cosas que hera la oçiosidad y gran presunçion con que los mançebos del Cuzco se criavan, que desde que el muchacho fuese de hedad de çinco años fuese por sus padres y deudos ynpuesto en los travajos y servidunbre de sus padres y deudos y que le enbiasen a traer leña y paja y a cojer caracoles y hongos y a tomar páxaros y a las tierras y a regar y deshatar y a cosas del canpo, mandando que los tales niños llevasen sus hondas y aillos y hachuelas en las manos, a fin que desde niños supiesen servir y estuviesen disçiplinados y exerçitados y usados en sus armas para las cosas de la guerra; y que desque fuesen de hedad los tales de quinze años los tales fuesen enbiados a la guerra en el tienpo que guerras uviese y guerras tuviesse el Ynga fuesse.",225
40414,"Ynga / Yngas",4,"T44434","Hordenó y mandó que quien dijese mentira al Ynga en qualquier cossa que con él hablase o nueba que le truxese, que muriese por ello.",226
40414,"Ynga / Yngas",4,"T44435","[...] y si el tal serviçio lo truxesen en la manera dicha y ellas lo estuviesen ansimismo, que allí luego delante de todo el pueblo fuese traydo un librillo de agua pequeño virqui que ellos llaman, en el qual delante de todos la tal muger, aunque fuese hija del Ynga, se labasen manos y braços y pies de manera que quedasse muy linpio y a esta agua que ansí suzia quedase, allí en presençia de todos fuese bevida por la tal muger que en su persona a serviçio fuese suzia. Y que este mando fuese publicado por los tales mandones porque no uviese escussa en las tales mugeres y mamaconas de serviçio diziendo que no fueron savidoras del [testado: a] tal mandado y ansimismo el tal serviçio y las tales sivientes de allí adelante fuese todo ello linpio.",226
40414,"Ynga / Yngas",4,"T44436","Hordenó y mandó que ningún caçique en toda la tierra, por señor que fuese, no pudiese vestir ni traer ropa fina, ni pluma, ni andas preçiadas, ni ataduras en los çapatos de lana ni de cabuya, si no fuese que la tal ropa o plumaje o andas le uviese dado el Ynga por sus serviçios; y el que ansí lo truxese, no le siendo hecha merçed dello, muriese por ello. Y qualquier orejón que le topase con ello por la tierra, allí donde le topase le hahorcase a fin de que no uviese ygualdad y fuesen conoçidos los vasallos y no quisiesen ser yguales a los señores del Cuzco.",227
40414,"Ynga / Yngas",4,"T44437","Hordenó y mandó que ninguno pudiese tener hermana propia por muger si no fuese el Ynga; y que nadie se pudiese casar de su autoridad si no fuese que el Ynga lo casase o por su mandato el tal fuese cassado. Y si el primer marido desta tal muger muriese y la tal muger se quisiese casar, fuese casado con el pariente más çercano del marido primero, porque si hijos que le quedasen del tal marido primero los criase como propios; y si no dejase hijos del primer marido, el segundo del mismo linaje los hiziese y el linaje fuese adelante y la sangre de los del Cuzco no se estragasse con diversa naçión ni se perdiese.",227
40414,"Ynga / Yngas",4,"T44438","Hordenó y mandó que el que capac fuese e Ynga señor, tuviese un su lugarteniente para que ante él viniesen con los negoçios de la tierra y ansimesmo de la çiudad, porque ante el Ynga y señor no avía de paresçer ninguno con ninguna ni cossa por su grandeza y señorío. Y que este tal señor le diesse razón al Ynga de los tales negoçios y nuebas que ante él viniesen para que el Ynga los despachase y fuesen proveydos con su paresçer y mando. Y a este tal señor mandó que se llamase Apo Ynga Randirimaric, que dize señor que habla en lugar y nombre del rey.",229
40414,"Ynga / Yngas",4,"T44439","Y que de cada provinçia fuese señalado un prinçipal que las tales postas pusiese y mudase y de diez a diez días visitassen; y si alguna posta faltase y se fuese sin mudalla, luego fuese ahorcado en el sitio do hera puesto y el caçique de la tal provinçia perdiese el señorío e mando della si por su descuido y mal proveimiento la tal posta ansí faltase, por las quales postas el Ynga fuese avisado de lo que ansí pasase y acaeçiese al tal capitán que en la guerra ansi andava. Y abrán de saber que hera tanta la brevedad destas postas y su caminar, que en ocho días sabía el Ynga en la çiudad del Cuzco lo que se hazía en el Quito y sus provinçias, que son más de treçientas leguas las que ay del Quito al Cuzco. ",229
40414,"Ynga / Yngas",4,"T44440","Y que el capitán que ansí conquistase, pusiese las ynsignias y traje de los de la tal provinçia en sus casas y cosas de su arreo como hombre que lo ganó, casi como armas que nos tenemos; y que tomase el sobrenombre y apellido dellos si quisiese. Es porque las provinçias heran de diferentes leguas, que los tales capitanes mandasen que los señores y naturales de las provinçias que ansí se juntasen deprendiesen la lengua general del Cuzco para que se pudiesen entender dudias [sic].",229
40414,"Ynga / Yngas",4,"T44441","Hordenó y mandó que cada capitán de gente de guerra tuviese [testado: n] cuidado de mandar en cada provinçia de las que ansí fuesen conquistando, luego que a ellas llegasen que hisiesen los de la tal provinçia un tanbo en el camino real; tanbo se llama aposento de gente de guerra. Y en los tales tanbos fuesen puestas çiertas mamaconas, las quales tuviesen cuidado de hazer y adereçar comida y chicha para los señores del Cuzco que por allí pasasen, ansí con gente de guerra como yendo por mandado del Ynga a alguna parte; y que en estos tales tanbos uviese depósitos de comida según la comida que en la tal provinçia se diese e cogiese.",230
40414,"Ynga / Yngas",4,"T44442","Y que los caçiques de la tal provinçia tuviesen cuidado de saber si algún señor orejón salía del Cuzco e yva por el tal camino de su tierra, para que sabido que fuese por el tal caçique o caçiques, le saliesen todos en sus tanbos y provinçias ha le hazer todo serviçio, y reverençia como a señores del Cuzco y ellos sus tales vasallos.",230
40414,"Ynga / Yngas",4,"T44443","Y si el capitán que ansí llevase esta tal gente de guerra no esecutase estos mandamientos en su gente de guerra por el caso y desobediençia al mandado del Ynga, buelto que fuese, aunque viniesse vitoriosso, públicamente fuese ahorcado y que al tal no le fuese dada sepoltura ni hecha ninguna honra.",231
40414,"Ynga / Yngas",4,"T44444","Y que este honbre ansí señalado tuviese espeçial cuidado de saber lo que cada uno cogía de sus tierras y el ganado que cada uno tenía y multiplico del; y que a cada uno tomase quenta de lo que ansí aumentava e adquería e grangeaba, porque no uviesse ningún oçioso y que cada uno diese tributo al Ynga y al Cuzco de lo quel tuviese. Y a este hombre que ansí tenía este cuidado, mandó que se llamase llactacamayo, que dize ofiçial del pueblo y en parte mayordomo, hombre que tiene cargo del pueblo; y estos tales que tuviesen cargo de cobrar los tributos de cada uno, mandando que no tributasse ninguno más de lo que buenamente pudiesse dar y de lo que ansí exerçitase y en su tierra se diesse. ",231
40414,"Ynga / Yngas",4,"T44445","Y que estos tales orejones tuviesen cuidado de ber los caminos y puentes que en su provinçia avía y que los hiziese adereçar si dello tuviese nesçesidad, porque si el Ynga quisiese yr a la tal provinçia no tuviese nesçesidad, porque si el Ynga quisiese yr a la tal provinçia no tuviese nesçesidad en los tales caminos de se apear de sus andas. Y que ansimesmo viese y bisitase los tanbos y depósitos dellos y biese lo que en cada cossa hera nesçesario, ansí para la gente de guerra como para lo que el Ynga mandase.",232
40414,"Ynga / Yngas",4,"T44446","Y que este tal señor orejón y cada uno déstos por sí hiziese hazer en los pueblos prinçipales do ellos abitasen y estuviesen muchos depóssitos de muchas comidas, según que se cogían en las tales provinçias, para que quando ansí pasase por ellas la gente de guerra tuviese comida y despensa y lo mismo el Ynga y su gente si por allí viniese; porque como esto fuese hecho y estuviese ansí en depósitos, los naturales de la tal provinçia no sintiesen molestia.",232
40414,"Ynga / Yngas",4,"T44447","Y que el Ynga que ansí estas tierras devidiese y diese y quitase, diose reconpensa al señor de las tales tierras, cosa que le fuese a él bien y a los suyos. Y que ansimismo los tales orejones que ansí tuviesen cargo de las tales provinçias, mirasen el espaçio que avía desde las provinçias do estava hasta el Cuzco y en los despoblados que en medio de las provinçias do estava hasta el Cuzco uviesen hiziesen hazer casas para en que se aposentasen, los quales tributo o tributos truxesen y estos tributos se truxesen de año [en] año.",232
40414,"Ynga / Yngas",4,"T44448","E ansimismo fuesen hechas otras cassas do fuesen puestas otras mamaconas, estas hijas de señores y donzellas, las quales se nombrasen mugeres del Ynga, e ansimismo les fuesen señaladas tierras y hechos depósitos de todos proveymientos, para el benefiçio de todo lo qual e soliçitadores dello fuesen señalados çiertos hombres del pueblo; y que los que ansí tratasen e contratasen con las tales mamaconas, las unas y las otras y las guardas que dellas tuviesen cuidado fuesen yndios capados, de todo lo qual tuviesen espeçial cuidado de mandar que ansí se hiziese y guardase aquel señor orejón que con ellos estava.",232
40414,"Ynga / Yngas",4,"T44449","Hordenó y mandó que cada año saliese un señor prinçipal de la çiudad del Cuzco, hijo del Ynga, a ver y visitar estas provinçias y el tratamiento que hera hecho a los naturales de las tales provinçias por los señores orejones que ansí tenían cuidado e cargo dellas como por los caçiques de las tales provinçias. Y que si el tal señor hallase culpado a qualquier destos orejones o caçiques, les diese el castigo que le paresçiese que mereçía e quitase estos tales y pusiese otros de su mano.",233
40414,"Ynga / Yngas",4,"T44450","Hordenó y mandó que los capitanes que fuesen a conquistar tierras y provinçias,que luego que la provinçia y tierra conquistasen, que hiziesen entender a los caçiques de las tales provinçias y pueblos cómo el Ynga los enbiava a conquistar e la çiudad del Cuzco y que ya heran basallos del Ynga y que ya no heran señores de las tales provinçias sino el Ynga, que hera solo señor, y que por su mano les avía de dar las mugeres y repartir las tierras; y que si él no viniese a esto, que bendría un hijo suyo a hazello u otro señor del Cuzco que lo hiziese por su mandado y en su lugar. Y que les dijesen cómo avían de servir y tributar al Ynga de allí adelante de todos los géneros de cosas que en sus tierras ansí tuviesen y benefiçiasen. ",233
40414,"Ynga / Yngas",4,"T44451","Y luego el Ynga dijo que los que avían de yr la tal jornada de sus hijos que hera Amaro Topa Ynga y Paucar Usno y los que dellos avían de ser seis señores y luego allí los señaló de los que allí en la junta heran. E ansimesmo nombró el número de la gente que avían de llevar, que fueron çien mil hombres de guerra, los çinquenta mil avían de ser de la provinçia de Collasuyo y los otros çinquenta de los demás pueblos e provinçias.",236
40414,"Ynga / Yngas",4,"T44452","E luego el Ynga como viese la gente de guerra allí, mandó a sus dos hijos Amaro Topa Ynga y a Paucar Usno que tomasen aquella gente y que fuesen y descubriesen y conquistasen hasta donde les paresçiese.",236
