"id_palabra","Palabra","id_cronista","id_texto","cita","pagina"
2018,"Apurima",2,"T20057","Los que leyeren este libro y ovieren estado en el <italic>Peru</italic> miren el camino que va desde <italic>Lima</italic> a <italic>Xauxa</italic> por las sierras tan asperas de <italic>Guayachire</italic> y por la montaña nevada de <italic>Pariacoca</italic> y entenderan, los que a ellos lo oyeren, si es mas lo que ellos vieron que no lo que yo escrivo; y sin esto, acuerdense de la ladera que avaxa al rio de <strong>Apurima</strong> y como viene el camino por las sierras de los <italic>Paltas</italic>, <italic>Caxas</italic> y <italic>Ayavaca</italic> y otras partes deste reyno...'.",41
2018,"Apurima",2,"T20058","Despues que los <italic>chancas</italic> ovieron hecho sacrifiçios en <strong>Apurima</strong> y Ilegasen a la çibdad del <italic>Cuzco</italic>, el capitan general que llevavan o señor dellos <italic>Astu Guaraca</italic> les dezia que mirasen la alta enpresa que tenian, que se mostrasen fuertes y no tuviesen pavor ni temor ninguno de aquellos que pensavan espantar las jentes con pararse las orejas tan grandes como ellos se ponian, y que si los vençian avria mucho despojo y mugeres hermosas con quien holgasen; los suyos le respondian alegremente que harian el dever.",132
2018,"Apurima",2,"T20059","...Llegado al rio de Apurima, paso por la puente que se avia hecho y anduvo hasta los aposentos de <italic>Curaguaxi</italic>. De la comarca salian muchos honbres y mugeres y algunos señores y prençipales; y quando lo vian, quedavan espantados y llamivanle ‘Gran señor, hijo del Sol, monarca de todos’ y otros nonbres grandes. En este aposento dizen que dio a un capitan de los <italic>chancas</italic>, llamado <italic>Tupa Vasco</italic>, por muger una <italic>palla</italic> del <italic>Cuzco</italic> y que la tuvo en mucho. Pasando adelante el <italic>Ynga</italic> por el rio de <strong>Apurima</strong> y <italic>Cochacaxa</italic>, como los naturales de aquella parte estuviesen en los <italic>pucaraes</italic> fuertes y no tuviesen pueblos juntos, les mando que biviesen hordenadamente sin tener costunbre mala ni darse la muerte los unos a los otros.",137
2019,"Arauca",2,"T20060","Y sigund se puede interpretar ‘<italic>Pacaritanbo</italic>’ quiere tanto dezir como casa de produçimiento'. Los nonbres de los que de alli salieron dizen ser ser <italic>Ayar Ocho</italic> el uno y el otro <italic>Ayar Hache</italic> <strong>Arauca</strong> y el otro dizen llamarse <italic>Ayar Mango</italic>.",13
2020,"Areyto",2,"T20061","Y besando la tierra, hizieron reverencia al Sol y hizieron un gran <italic>taqui</italic> y <strong>areyto</strong> con muchos sones: y los çaçerdotes, diciendo çiertas palabras llevaron el vaso a unos de sus vanos tenplos donde se ponian los semejantes juramentos que se hazian por los reyes y señores. Y aviendose holgado algunos dias <italic>Viracoche Ynga</italic> en <italic>Chuquito</italic> se bolvio al <italic>Cuzco</italic>, siendo por todas partes muy servido y bien recibido.",128
2020,"Areyto",2,"T20062","Como fuese muerto <italic>Guaynacapa</italic> y por el hechos los lloros y sentimiento dicho, aunque avia en el <italic>Cuzco</italic> mas de quarenta hijos suyos, ninguno yntento salir de la obediençia de <italic>Guascar</italic>, a quien savian perteneçia el reyno; y aunque se entendio lo que <italic>Guaynacapa</italic> mando, que su tio governase, no falto quien aconsejo a <italic>Guascar</italic> saliese con la borla en publico y mandase por todo el reyno como rey. Y como para las honras de <italic>Guaynacapa</italic> avian venido al <italic>Cuzco</italic> los mas de los señores naturales de las <italic>provinçias</italic>, pudo ser la fiesta de su coronaçion grande y de presto entendida y sabida y asi lo determino de hazer. Dexando el govierno de la misma çibdad a quien por su padre lo tenia, se entro a hazer el ayuno con la oservançia que su costunbre requeria. Salio con la borla muy galano y hizieronse grandes fiestas y pusieronse en la plaça la <italic>maroma</italic> de oro con los bultos de los <italic>Yngas</italic> y conforme a la costunbre dellos gastaron algunos dias en beber y en sus <strong>areytos</strong> ; y acabados, fue la nueva a todas las <italic>provinçias</italic> y mandado del nuevo rey de lo que avian de hazer, enbiando a <italic>Quito</italic> çiertos <italic>orejones</italic> a que truxesen las mujeres de su padre y su serviçio.",204
2021,"Arma",2,"T20063","Y aun tanbien tenemos por entendido que antiguamente, antes que los <italic>Yngas</italic> reynasen, en muchas <italic>provinçias</italic> andavanlos honbres como salvajes y los unos salian a se dar guerra a los otros y se comian como agora hazen los de la <italic>provinçia</italic> de <strong>Arma</strong> y otras de sus comarcas; y luego que reynaron los <italic>Yngas</italic>, como jente de gran razon y que tenian santas y justas costunbres y leyes, no solamente ellos no comian aquel manjar, que por otros muchos a sido y es tan estimado, pero pusieronse en quitar tal costunbre a los que con ellos tratavan, de tal manera que en poco tienpo se olvido y totalnente se tiro, que en todo su señorio, que era tan grande, no se comian ya de muchos años antes. Los que agora an çusedido muestran que en ello les vino venefiçio notable de los <italic>Yngas</italic> por no ymitar euos a sus pasados en comer aqueste manjar.",75
2022,"Açángaro",2,"T20064","[Y como se hobiesen holgado los] dias que le pareçio a <italic>Ynga Yupangue</italic> , les hablo; como queria que fuesen a los <italic>Guancas</italic> y a los <italic>Yayos</italic> e sus vezinos a procurar de los traer en su amistad y serviçio sin guerra, y quando no, que dandosela, se diesen malla de los vençer y forçar que lo hiziesen. Respondieron todos que harian lo que mandava con gran boluntad. Fueron señalados capitanes de cada naçion y sobre todos fuepor general <italic>Lloque Yupangue</italic> y con el, para consejo, <italic>Copa Yupangue</italic> ; y avisandoles de lo que avian de hazer, salieron del <italic>Cuzco</italic> y caminaron hasta la <italic>provinçia</italic> de <italic>Andaguailas</italic> , adonde fueron bien reçibidos por los <italic>chancas</italic> ; y salio con ellos un capitan, llamado <italic>Anco Allo</italic> , con copia de jente de aquella tierra para servir en la guerra del <italic>Ynga</italic>. De <italic>Andaguaylas</italic> fueron a <italic>Vilcas</italic> , adonde se estavan los aposentos y tenplo del Sol que<italic> Ynga Yupangue</italic> avia mandado hazer, y hablaron con todo amor a los que entendian en aquellas hobras. De <italic>Vilcas</italic> fueron por los pueblos de <italic>Guamanga</italic> , <strong>Açángaro</strong> , <italic>Parcos</italic> , <italic>Picoy</italic> , <italic>Acos</italic> y otros, los quales ya avian dado la obedençia al <italic>Ynga</italic> y proveian de bastimentos y de lo que mas tenian en sus pueblos y hazian el camino real que les hera mandado grande y muy ancho'.",143
2022,"Açángaro",2,"T20065","<italic>Ynga Yupangue</italic> tuvo gran notiçia que pasadas algunas jornadas, a la parte de Levante avia gran tierra y muy poblada. Con esta nueva, codiçioso de descubrirla, paso adelante; mas siendo avisado como en el <italic>Cuzco</italic> avia çusedido çierto alvoroto, aviendo ya allegado a un pueblo que llaman <italic>Marcapata</italic>, rebolvio con prieça grande al <italic>Cuzco</italic>, donde estuvo algunos dias. Pasado esto, dizen los yndios que, como la <italic>provinçia</italic> de <italic>Collao</italic> sea tan grande y en ella oviese en aquellos tienpos numero grande de jente y señores de los naturales muy poderoso, como supieron que <italic>Ynga Yupangue</italic> avia entrado en la montaña de los <italic>Andes</italic>,creyendo que por alli seria muerto o que bendria desvaratado, conçertaronse todos a una desde <italic>Vilcanota</italic> para adelante, a una parte, y a otra, con muy gran secreto, de se revelar y no estar debaxo del señorio de los <italic>Yngas</italic>, diziendo que hera poquedad grande de todos ellos, aviendo sido libres sus padres y no dexandolos en cativerio, sujetarse tantas tierras y tan grandes a un señor solo. Y como todos aborreçiesen el mando que sobre ellos el <italic>Ynga</italic> tenia, sin les aver el hecho molestia ni mal tratamiento ni hecho tiranias ni demasias, como sus governadores y delegados no lo pudieron entender, juntos en <italic>Hatuncollao</italic> y en <italic>Chuquito</italic>, adonde se hallaron <italic>Cari</italic> y <italic>Çapana</italic> y <italic>Umalla</italic> y el señor de <strong>Açángaro</strong> y otros muchos, hizieron su juramento conforme a su çeguedad de llevar adelante su yntençion y determinaçion;...",155
2023,"Asillo",2,"T20066","El <italic>Ynga</italic> salio de <italic>Ayavire</italic>, dizen que por el camino que llaman <italic>Omasuyo</italic>, el qual para su persona real fue hecho ancho y como lo vemos; y camino por los pueblos de <italic>Horuro</italic>, <strong>Asillo</strong> , <italic>Asangaro</italic>, en donde tuvo algunos requentros con los naturales; mas tales palabras les dixo que con ellas y con dones que les dio, los atraxo a su amistad y serviçio y dende en [a]delante usaron de la puliçia que usavan los demas que tenian amistad y aliança con los <italic>Yngas</italic> y hizieron sus pueblos conçertados en lo llano de las vegas.",151
2024,"Atagualpa",2,"T20067","segúnd la relaçión que yo tomé en el <italic>Cuzco</italic> y dan los <italic>orejones</italic>; porque dizen que luego que en la <italic>provinçia</italic> de <strong>Caxamalca</strong> fue preso <strong>Atabalipa</strong> por los españoles, aviendo avido entre los dos hermanos <italic>Guascar Ynga</italic>, único heredero del ynperio, y <strong>Atabalipa</strong> grandes guerras y dádose <italic>capitanes</italic> de uno contra <italic>capitanes</italic> de otro muchas batallas hasta que el río de <italic>Apurima</italic>, por el paso de <italic>Cotabanba</italic>, fue preso el rey <italic>Guascar</italic> y tratado cruelmente por <italic>Chalaquchima</italic>, sin lo qual el <italic>Quizquiz</italic> en el <italic>Cuzco</italic> hizo un gran daño y mató ¯sigúnd es público- treynta hermanos de <italic>Guascar</italic> e hizo otras crueldades en los que tenían su opinión y no se avían mostrado favorables [a] <strong>Atabalipa</strong> ; y como andando en estas pasiones tan grande oviese, como digo, sido preso <strong>Atabalipa</strong> y consertado con él Piçarro que le daría por su rescate una casa de oro y para traello fuesen al <italic>Cuzco</italic> Martín Bueno, Çárate y Moguer, porque la mayor parte estava en el solene tenplo de <italic>Curicanche</italic>; y como llegasen estos cristianos al <italic>Cuzco</italic> en tienpo y coyuntura que los de la parte de <italic>Guascar</italic> pasavan por la calamidad dicha e supiesen la prisión de <strong>Atabalipa</strong>, holgáronse tanto como se puede sinificar; y así luego, con grandes suplicaçiones, ynploravan su ayuda/contra <strong>Atabalipa</strong> su enemigo, diziendo ser enbiados por mano de su gran dios <italic>Tiçiviracocha</italic> y ser hijos suyos: y así luego les llamaron y pusieron por nonbre <italic>Viracocha</italic>. Y mandaron al gran sacerdote, como los más ministros del tenplo, que las mugeres sagradas se estuviesen en él, y el <italic>Quizquiz</italic> les entregó todo el oro y plata.",11
2024,"Atagualpa",2,"T20068","...dixeron luego que la tal jente no eran hijos de Dios sino peores que ‘<italic>sopays</italic>’, que es nonbre de diablo: aunque por cunplir con el mandato del señor <strong>Atabalipa</strong> los <italic>capitanes</italic> y delegados de la çibdad los despacharon sin les hazer enojo ninguno, enbiando luego el tesoro. Y el nonbre de <italic>Viracocha</italic> se quedó hasta oy; lo qual, segúnd tengo dicho, me ynformaron ponérselo por lo que tengo escrito y no por la sinificaçión que dan de espuma de la mar.",12
2024,"Atagualpa",2,"T20069","Y a las fiestas se hallavan los prencipales señores que avían más de cuatro leguas quellos mandaron y pareçía en el <italic>Cuzco</italic> grandísima riqueza de oro e plata y pedrería y plumaje çercándolo todo la gran maroma de oro y la admirable figura del Sol, que hera todo de tanta grandeza que pesava ¯a lo que afirman por çierto los yndios- más de quatro mill quintales de oro; y sinó no se dava la borla en el <italic>Cuzco</italic>, tenían al que se llamava <italic>Ynga</italic> por cosa de bulra sin tener su señorío por çierto ni firme: y así <strong>Atabalipa</strong> no es contado por rey.",20
2024,"Atagualpa",2,"T20070","Y por engrandeçer su señorio, pareçiendoles que lo mucho que digo era poco, mandavan por ley que ningund oro ni plata que entrase en la çibdad del <italic>Cuzco</italic> della pudiese salir so pena de muerte, lo qual se esecutava luego en quien lo quebrantava; y con esta ley, siendo lo que entrava al mucho y no saliendo nada, avía tanto que, si quando entraron los españoles se dieran otra maña y tan presto no eçecutaran su crueldad en dar la muerte [a] <strong>Atabalipa</strong> ...",38
2024,"Atagualpa",2,"T20071","Y es publico entre todos los yndios ser este tenplo tan antiguo como la misma çibdad del <italic>Cuzco</italic>, mas que <italic>Ynga Yupangue</italic>, hijo de <italic>Viracoche Ynga</italic>, lo acreçento en riquezas y paro tal como estava quando los cristianos entraron en el <italic>Peru</italic> y lo mas del tesoro fue llevado a <strong>Caxamalca</strong> por el rescate de <strong>Atavalipa</strong> , como en su lugar contaremos. Y dizen los <italic>orejones</italic> que despues de aver pasado la dudosa guerra que tuvieron los vezinos del <italic>Cuzco</italic> con los <italic>chancas</italic>, que agora son señores de la <italic>provinçia</italic> de <italic>Andaguaylas</italic>, que como de aquella vitoria que dellos tuvieron quedase <italic>Ynga Yupangue</italic> tan estimado y nonbrado, de todas partes acudian señores a le servir haziendole las <italic>provinçias</italic> grandes serviçios de metales de oro y plata,...",79
2024,"Atagualpa",2,"T20072","Otras muchas cosas pudiera dezir deste tenplo que dexo, porque me pareçe que vasta lo dicho para que se entienda quan gran cosa fue, porque no trato de la argenteria, <italic>chaquira</italic>, plumajes de oro y otras cosas, que si las escreviera no fueran creydas. Y lo que tengo dicho, aun biven cristianos que vieron la mayor parte dello, que se llevo a <strong>Caxamalca</strong> para el rescate de <strong>Atabalipa</strong> ; pero mucho escondieron los yndios y esta perdido y enterrado. Y aunque todos los <italic>Yngas</italic> avian adornado este tenplo, en tienpo de <italic>Ynga Yupangue</italic> se acreçento de tal manera que quando murio y <italic>Topa Ynga</italic>, su hijo, ovo el ynperio, quedo en esta perfiçion.",82
2024,"Atagualpa",2,"T20073","Bolvio al <italic>Cuzco</italic>, donde fue reçibido de la çibdad onradamente y los çaçerdotes del tenplo de <italic>Curicanche</italic> le dieron muchas vendiçiones y el alegro al pueblo con grandes fiestas que se hizieron. Y naçianle muchos hijos, los quales criavan sus madres, entre los quales naçio <strong>Atabalipa</strong>, segund la opinion de todos los yndios del <italic>Cuzco</italic> que dizen ser asi y llamarse su madre <italic>Tuto Palla</italic>, natural [de] <italic>Quilaco</italic>, aunque otros dizen ser del linaje de los <italic>Orencuzcos</italic>; y sienpre, desde que se crio, anduvo este <strong>Atabalipa</strong> con su padre y era de mas edad que <italic>Guascar</italic>",184
2024,"Atagualpa",2,"T20074","Pues, estando <italic>Guaynacapa</italic> en el <italic>Quito</italic> con grandes conpañas de jentes que tenia y los demas señores de su tierra, viendose tan poderoso pues mandava desde el rio de <italic>Angasmayo</italic> al de <italic>Maule</italic>, que ay mas de mill y dozientas leguas y estando y tan creçido en riquezas, tanto que afirman que avia hecho traer a <italic>Quito</italic> mas de quinientas cargas de oro y mas de dos mill de plata y mucha pedreria y ropa fina, siendo temido de todos los suyos porque no se le osavan desmandar quando luego hazia justiçia, quentan que vino una gran pestilençia de viruelas tan contajiosa que murieron mas de dozientas mill animas en todas las comarcas, porque fue general; y dandole a el el mal no fue parte todo lo dicho para librarlo de la muerte, porquel gran Dios no era dello servido. Y como se sintio tocado de la enfermedad, mando se hizieron grandes sacrifiçios por su salud en toda la tierra y por todas las <italic>guacas</italic> y tenplos del Sol; mas yendole agraviado, llamo a sus capitanes y parientes y les hablo algunas cosas, entre las quales les dixo, a lo que algunos dellos dizen, que el savia que la jente que avia visto en el navio bolveria con potençia grande y que ganaria la tierra. Esto podria ser fabula, o si lo dixo, que fuese por boca del demonio, como quien sabia que los españoles yvan para procurar de bolver a senorear. Dizen otros destos mismos que, conoçiendo la gran tierra que avia en los <italic>quillaçingas</italic> y <italic>popayaneses</italic> y que era mucho para mandarlo uno, que dixo que desde <italic>Quito</italic> para aquellas partes fuesen de <strong>Atabalipa</strong>, su hijo a quien queria mucho porque avia sienpre andado con el en la guerra; y que mando que lo demas governase y senorease <italic>Guascara</italic>, unico hered[er]o del imperio. Otros yndios dizen que no dividio el reyno, antes dizen que dixo a los que estavan presentes que bien sabian como ellos se avian holgado que fuese señor, despues de sus dias, su hijo <italic>Guascar</italic>, y de <italic>Chimbo Ocllo</italic>, su hermana, con quien todos los del <italic>Cuzco</italic> mostravan contento; y puesto que sin el tenia otros muchos hijos de gran valor, entre los quales estavan <italic>Nauque Yupangue</italic>, <italic>Topa Ynga</italic>, <italic>Guancauque</italic>, <italic>Topa Gualpa</italic>, <italic>Tito</italic>, <italic>Guama Gualpa</italic>, <italic>Mango Ynga</italic>, <italic>Guascar</italic>, <italic>Cuxi Gualpa</italic>, <italic>Paulo</italic>, <italic>Tilca Yupangue</italic>, <italic>Conono</italic>, <strong>Atabalipa</strong> , quiso no dalles nada de lo mucho que dexava, sino / que todo lo eredase del como el lo heredo de su padre y que confiava mucho guardaria su palabra y cunpliria lo que su coraçon queria, aunque era muchacho; y que les rogo lo amasen y mirasen como era justo y que hasta que tuviese edad perfeta que governase y fuese su ayo <italic>Colla Topa</italic>, su tio. Y como esto uvo dicho, murio.",200
2024,"Atagualpa",2,"T20075","Capitulo [LXX] del linaje y condiçiones de <italic>Guascar</italic> y de <strong>Atabalipa</strong> .",202
2024,"Atagualpa",2,"T20076","Bien te[r]nia que dezir en contar menudamente las diçinçiones destos tan poderosos señores, mas no saldre de mi brevedad por las causas tan justas que otras vezes e dicho tener. <italic>Guascar</italic> hera hijo de <italic>Guaynacapa</italic> y <strong>Atabalipa</strong> tanbien. <italic>Guascar</italic> de menos dias, <strong>Atabalipa</strong> de mas años; <italic>Guascar</italic> hijo de la <italic>Coya</italic>, hermana de su padre, señora prençipa1; <strong>Atabalipa</strong> hijo de una yndia <italic>quilaco</italic>, llamada <italic>Tutu Palla</italic>. El uno y el otro naçieron en el <italic>Cuzco</italic> y no en <italic>Quito</italic>, como algunos an dicho y an escrito para esto, sin lo aver entendido como ello es. La razon lo muestra porque <italic>Guaynacapa</italic> estava en la conquista de <italic>Quito</italic> y por aquellas tierras aun no doze años y era <strong>Atabalipa</strong> quando murio de mas de treynta años; y señora de <italic>Quito</italic>, para dezir lo que ynventan que era su madre, no avia ninguna porque los mismos <italic>Yngas</italic> eran reyes y señores del <italic>Quito</italic>; y <italic>Guascar</italic> naçio en el <italic>Cuzco</italic> y <strong>Atabalipa</strong> era quatro o çinco años de mas hedad que no el.",202
2024,"Atagualpa",2,"T20077","<italic>Guascar</italic> era querido en el <italic>Cuzco</italic> y en todo el reyno por los naturales por ser el heredero de derecho; <strong>Atabalipa</strong> hera bien quisto de los capitanes viejos de su padre y de los soldados, porque anduvo en la guerra en su niñez y porquel en bida le mostro tanto amor que no le dexava comer otra cosa que lo quelle dava de su plato. <italic>Guascar</italic> hera clemente y piadoso; Atabalipa cruel y vengativo; entranbos eran liberales y el <strong>Atabalipa</strong> honbre de mas animo y esfuerço y <italic>Guascar</italic> de mas presunçion y valor. El uno pretendio ser unico señor y mandar sin tener ygual; el otro se determino de reynar y por ello quebrantar las leyes que sobre ello a su usança estavan estableçidas por los <italic>Yngas</italic>, que hera que no podia ser rey sino hijo mayor del señor y de su hermana, aunque otros de mas hedad oviese avido en otras mujeres y mançebas. <italic>Guascar</italic> deseo / tener consigo el exerçito de su padre; <strong>Atabalipa</strong> se congoxo porque no estava çerca del <italic>Cuzco</italic> para en la misma çibdad hazer el ayuno y salir con la borla para por todos ser reçibido por rey.",203
2024,"Atagualpa",2,"T20078","Fue entendido por <strong>Atabalipa</strong> como <italic>Guascar</italic> avia salido con la borla y como queria que todos le diesen la ovedençia; y no se avian partido de <italic>Quito</italic> ni de sus comarcas los capitanes general[es] de <italic>Guaynacapa</italic> y avia entre todos platicas secretas sobre que hera bien procurar por las vias a ellos posible[s] quedarse con aquellas tierras de <italic>Quito</italic> sin yr al <italic>Cuzco</italic> al llamamiento de <italic>Guascar</italic>, pues era aquella tierra tan buena y adonde todos se hallavan tan bien como en el <italic>Cuzco</italic>.",204
2024,"Atagualpa",2,"T20079","Algunos avia entre ellos que les pesava y dezian que no hera liçito dexar de reconoçer al gran <italic>Ynga</italic>, pues hera señor de todos; mas <italic>Ylla Topa</italic> no fue leal a <italic>Guascar</italic> asi como <italic>Guaynacapa</italic> se lo rogo y el se lo prometio, porque dizen que / andava en tratos y secretas platicas con <strong>Atabalipa</strong> , que entre los hijos de <italic>Guaynacapa</italic> mostro mas animo [y] balor, causado por su atrevimiento y aparejo que hallo o con lo que su padre mando, si fue verdad, que governase lo de <italic>Quito</italic> y sus comarcas. Este hablo a los capitanes <italic>Chalaquchima</italic>, <italic>Ynclagualpa</italic>, <italic>Urimiñavi</italic>, el <italic>Quizquiz</italic>, <italic>Sopeçopagua</italic> y otros muchos, sobre que quisiesen faboreçerle y ayudarle para quel fuese <italic>Ynga</italic> de aquellas partes como su hermano lo hera del <italic>Cuzco</italic>. Y ellos y el <italic>Ylla Topa</italic>, traydor a su señor natural <italic>Guascar</italic>, pues que aviendole dexado por governador hasta quel tuviese edad cunplida le nego y se ofreçio de faboreçer [a] <strong>Atabalipa</strong>, que ya por todo el real era tenido por señor y le fueron entregadas las mugeres de su padre, a quien el reçibio por suyas, que hera autoridad mucha entre estas jentes;...",205
2024,"Atagualpa",2,"T20080","Quentan algunos que algunos de los hijos de <italic>Guaynacapa</italic>, hermanos de <italic>Guascara</italic> y de <strong>Atabalipa</strong> , con otros <italic>orejones</italic> se fueron huyendo al <italic>Cuzco</italic> y dieron dello aviso a <italic>Guascar</italic>; y asi el como los <italic>orejones</italic> ançianos del <italic>Cuzco</italic> sintieron lo que avia hecho <strong>Atabalipa</strong> , reprovandolo por caso feo y que avia ydo contra sus dioses y contra el mandamiento y ordenança de los reyes pasados. Dezian que no avian de sufrir ni consentir quel bastardo tuviese nonbre de <italic>Ynga</italic>, antes le avian de castigar por lo por el ynventado, con el fabor que tuvo de los capitanes y jente del exerçito de su padre. Y asi <italic>Guascar</italic> mando que se aper[çi]biesen en todas partes y se hiziesen armas y los depositos se proveyesen con las cosas neçesarias porque el avia de hazer guerra a los traydores sy juntos todos no le reconoçian por señor. Y a los <italic>cañares</italic> enbio enbaxadores, esforçandolos en su amistad y al mismo <strong>Atabalipa</strong> dizen que enbio un <italic>orejon</italic> a que le amonestase que no yntentase de llevar adelante su opinion, pues hera tan mala y a que hablase a <italic>Ylla Topa</italic>, su tio, para que le aconsejase se viniese para el. Y hecho estas cosas, nonbro por su capitan general a uno de los prençipales del <italic>Cuzco</italic> llamado <italic>Atoco</italic>.",205
2024,"Atagualpa",2,"T20081","Capitulo [LXXII] de como se comensaron las diferençias entre <italic>Guascar</italic> y <strong>Atabalipa</strong> y se dieron entre unos y otros grandes vatallas.",207
