id_palabra,"Palabra","id_cronista","id_texto","cita","pagina","lengua","propuesta","nota","enlace"
8027,"inga/ingas","8","T8044","Hasta que un hombre que, según dicen, salió de hacia una laguna muy grande que está en una <i>provincia</i> que dicen del <i>Collao</i> y fue juntando gente y señoreando mucha parte de la tierra y éste fue el primer <b>Inga</b> (que es como si dixéremos gran <i>Señor </i>) que en aquella tierra hubo y de allí descendieron los que toda aquella tierra sojuzgaron, el cual y los que de él descendieron hasta que los [e]spañoles en aquella tierra entraron, dicen que fueron seis o siete, cuyo apellido fue <i>Topa Inga</i>, porque debía ser el <i>Topa</i> el apellido de aquel primero Inga de la dignidad, aunque los indios de aquel primero llamaron <i>Viracocha</i>, que quiere decir hombre nacido de la [e]spuma del agua, imaginando que había sido engendrado de aquella laguna.","33","","","","sin datos"
8027,"inga/ingas","8","T8045","Estas mujeres en todas las <i>casas</i>, fuera de las supersticiones que en acatamiento del sol hacían, no entendían sino en hacer ropas y cosas para el <b>Inga</b>, que era el supremo <i>señor</i> de la tierra, como para hijo del sol, que como a tal lo veneraban.","36","","","","sin datos"
8027,"inga/ingas","8","T8046","Tenían grandes tierras y de lo más fértil dedicadas para coger <i>maíz</i>, que es el pan de aquella tierra, para el sol; y labrábanlas y cogíanlas de común con gran cuidado y tanta observancia, que cuando [interl: se; tach.:la] labraban, si se hallaba presente al empeçar a labrar alguna de aquellas tierras del <b>Inga</b>, había de ser él que el primer surco había de dar; y si él no se hallaba presente, dábale el más principal <i>señor</i> que allí se hallaba; y el <i>maíz</i> que de estas tierras se cogía se ponía en <i>casas</i> que para ello cerca de las tierras tenían hechas en el campo.","36-37","","","","sin datos"
8027,"inga/ingas","8","T8047","Estos <b>Ingas</b>, después que sujetaron la Sierra, procuraron sujetar  los llanos y, aunque con mucho trabajo y con gran muerte de gente, lo hicieron y mandaron a los de los llanos que tuviesen al sol por Dios y porque no lo querían hacer, hicieron en ellos muchos castigos; y afligidos los de los llanos, decíen [sic] que por sus sacerdotes consultaron a <i>Pachacama</i> sobre ello y respondió que, pues no podían hacer más, que adorasen al sol, pero que no dexasen a él; y así, los de los llanos tenían entrambas observancias, la del sol y <i>Pachacama</i>, pero más principal a <i>Pachacama</i>. ","38-39","","","","sin datos"
8028,"Las Charcas","8","T8048","Y allende de estas cosas ya dichas que hacen fuerte la tierra del <i>Perú</i>, hay otras dos que la hacen inexpugnable contra la voluntad de los [e]spañoles que en ella hay: la una es que, llegada cualquier gente a la costa, como por la larga navegación no pueda llevar qué coma, si no se lo quieren dar los que están en la tierra morirán de hambre; y, así, cuando yo llegué al puerto de <i>Túmbez</i>, con estar ya toda la comarca de aquel pueblo hasta <i>Lima</i>, que son ciento y noventa legus, prevenidos con los primeros navíos que envié y con los despachos que yo desde Puerto Viejo a todas partes envié para responder a la voz del del [sic] rey y juntarse conmigo y proveerme de mantenimientos y no se lo poder impedir Gonçalo Piçarro, porque era alejado hacia <b>Las Charcas</b>, y deseando todos proveerme, estuvimos diez o doce días sin comer sino sólo del <i>maíz</i> que yo había recogido de Puerto Viejo y de la isla de la <i>Puná</i> y de algunos porqueçuelos de los montes de aquella tierra y de pescado que con un chinchorro que hice llevar en el armada se pescaba.","51-52","","","","sin datos"
8029,"La Habana","8","T8049","Y la gente de la armada que conmigo de aquel puerto del Nombre de Dios salió, con ser ya toda hecha a Indias, salió tan enferma, que era cosa de gran lástima, con solo haberlos yo detenido allí poco tiempo aguardando a ver si venía la armada que se había de enviar para traer la hacienda de Su Magestad y a pasarla de <i>Panamá</i> al Nombre de Dios y poner a punto la armada que yo allí hice; y aunque fueron mejorando después de apartados de aquella tierra, pero salieron tan enfermos de ella, que desde aquel puerto hasta <b>La Habana</b> se hecharon XVI hombres a la mar y entre ellos, dos maestros de naos; y esto de estas enfermedades y muertos pasa con haber medicinas y refrigerio para los enfermos de la gente que allí hay, que son mercaderes y sus criados y gente de la mar que viene del <i>Perú</i> y va de España y pasajeros que de una parte a otra pasan [...]","42","","","","sin datos"
8030,"Lima","8","T8050","Y entra lo que dicen del Nuevo <i>Reino</i>, donde ahora se ha puesto Chancillería; y entra lo que al presente está subjeto a la Chancillería que reside, después del desbarato y castigo de Gonçalo Pizarro, en la ciudad de los Reyes, que por nombre antiguo de indios <b>Lima</b>, que son las ciudades con sus términos de <i>Quito</i>, <i>Loxa</i>, Puerto Viejo, <i>Guayaquil</i>, Jaén, <i>Piura</i>, <i>Chachapoyas</i>, Santiago de los Valles, Trujillo, <i>Guánuco</i>, la misma ciudad de los Reyes, <i>Guamanga</i>, el <i>Cuzco</i>, <i>Arequipa</i>, Nuestra Señora de la Paz, la Villa de la Plata [...]","6","","","","sin datos"
8030,"Lima","8","T8051","Y así en los dichos meses hace claros días ordinariamente en la Sierra y de noche, grandes yelos, al menos donde no se hacen valles baxos; y en las cordilleras altas donde las X horas del día adelante ordinariamente se cubre de niebla y, así, en la Sierra en aquel tiempo nunca llueve, sino yela y nieva algunos días aun en las faldas, porque en el <i>Cuzco</i> en mayo y junio nos nevó mucho; y en julio, viniendo a hacer el repartimiento de <i>Guaynarima</i>, había en el camino nieve, con que los españoles que venían en mi compañía se daban de pelladas; y en agosto y en septiembre, por el camino que desde <i>Guaynarima</i> por la Sierra hice para venir a la ciudad de <b>Lima</b>, pasamos por muchas partes nieve, con venir harto apartados de las cordilleras.","19","","","","sin datos"
8030,"Lima","8","T8052","Y sin embargo de esto llegó la primera armada tan necesitada de bastimentos, que hubo necesidad que el capitán Diego de Mora y otros vecinos de Trujillo la proveyesen de ellos cuando llegó a aquel paraje, que fue XVII a abril 1547; y con no haber desde allí a <b>Lima</b> sino ochenta leguas, tardó en andarlas hasta doce de julio, que llegó al <i>Callao</i> de la ciudad de <b>Lima</b>, con ser las naos que llevaban las más veleras y más bien despalmadas y a punto que desde <i>Panamá</i> pudimos enviar y en el mejor tiempo del año para aquel viaje. ","44-45","","","","sin datos"
8030,"Lima","8","T8053","La razón de esto debe ser por ser de mayor frialdad las constelaciones que están de la otra parte de la equinoccial hacia el Antártico que no las que están de esta otra hacia el Ártico; y eso parece no sólo por la mayor corriente de aguas que arguye mayor generación de ellas en aquella parte de [tach: a] donde corren, mas aun porque la experiencia lo muestra haber mayor frialdad de la otra parte de la equinoccial que no de ésta, porque <i>Panamá</i> está en nueve grados y el Nombre de Dios, en diez y Santa Marta, en once y Santo Domingo, en veinte y <i>Nicaragua</i> asimismo en los mismos y en todas estas partes que son de la equinoccial hacia el Artico hace mayores calores y más excesivos que no en <i>Piura</i> y Trujillo, que están en cinco y seis grados de la otra parte de la equinoccial y <b>Lima</b>, que está en XVI grados, en invierno hace fríos y grandes yelos.","48","","","","sin datos"
8030,"Lima","8","T8054","Y aun también me parece que esta mayor frialdad se experimenta en la frialdad que en la mar del Sur se halla de la otra parte de la equinoccial, donde por ser el agua de la mar más fría no se engendra aquel gusan[tach: ill]o  que llaman broma en los navíos en los puertos, al menos en el de <b>Lima</b> (dado que en él entre río de agua dulce), y en <i>Panamá</i> y en Nombre de Dios y en otros  de más altura de esta parte de la equinoccial se engendra mucha donde entra agua dulce, porque para que se engendre este gusanillo dicen que es menester que haya calor en el agua de la mar y se mezcle con ella agua de río.","49","","","","sin datos"
8030,"Lima","8","T8055","Y de esta manera, estando yo en <b>Lima</b>, iba de <i>Panamá</i> un galeón que se decía Calero y anduvo catorce mese por llegar a <b>Lima</b> y en bordes navegó, según dicen, más de cuatro mil leguas y nunca pudo llegar más de hasta el río de Santa, que es sesenta leguas antes de <b>Lima</b>; y, porfiando todavía, tornó a caer otras sesenta más atrás y tan perdido y lleno de vescosidad, la cual en aquella mar hay mucha, que quedó de muy poco provecho y hubo necesidad de enviar barcos por la mercancía que traía de <i>Paita</i>, donde había arribado.","51","","","","sin datos"
8030,"Lima","8","T8056","Y allende de estas cosas ya dichas que hacen fuerte la tierra del <i>Perú</i>, hay otras dos que la hacen inexpugnable contra la voluntad de los [e]spañoles que en ella hay: la una es que, llegada cualquier gente a la costa, como por la larga navegación no pueda llevar qué coma, si no se lo quieren dar los que están en la tierra morirán de hambre; y, así, cuando yo llegué al puerto de <i>Túmbez</i>, con estar ya toda la comarca de aquel pueblo hasta <b>Lima</b>, que son ciento y noventa legus, prevenidos con los primeros navíos que envié y con los despachos que yo desde Puerto Viejo a todas partes envié para responder a la voz del del [sic] rey y juntarse conmigo y proveerme de mantenimientos y no se lo poder impedir Gonçalo Piçarro, porque era alejado hacia <i>Las Charcas</i>, y deseando todos proveerme, estuvimos diez o doce días sin comer sino sólo del <i>maíz</i> que yo había recogido de Puerto Viejo y de la isla de la <i>Puná</i> y de algunos porqueçuelos de los montes de aquella tierra y de pescado que con un chinchorro que hice llevar en el armada se pescaba.","51-52","","","","sin datos"
8031,"Loxa","8","T8057","Y entra lo que dicen del Nuevo <i>Reino</i>, donde ahora se ha puesto Chancillería; y entra lo que al presente está subjeto a la Chancillería que reside, después del desbarato y castigo de Gonçalo Pizarro, en la ciudad de los Reyes, que por nombre antiguo de indios <i>Lima</i>, que son las ciudades con sus términos de <i>Quito</i>, <b>Loxa</b>, Puerto Viejo, <i>Guayaquil</i>, Jaén, <i>Piura</i>, <i>Chachapoyas</i>, Santiago de los Valles, Trujillo, <i>Guánuco</i>, la misma ciudad de los Reyes, <i>Guamanga</i>, el <i>Cuzco</i>, <i>Arequipa</i>, Nuestra Señora de la Paz, la Villa de la Plata [...]","6","","","","sin datos"
8031,"Loxa","8","T8058","[...] de las cuales hice poblar después del desbarato de Gonçalo Pizarro, a <b>Loxa</b> y Jaén y a Santiago de los Valles y a Nuestra Señora de la Paz, y dexé poblando más adelante de <b>Loxa</b>  al capitán Mercadillo otro pueblo, y al capitán Diego Palomino otro más adelante de Jaén, y al capitán Baçán otro en la <i>provincia</i> de <i>Çumaco</i> , que es a la parte de <i>Quito</i> , y al capitán Benavente dexé poblando otros dos en la <i>provincia</i> que dicen de <i>Macas</i>, y al capitán Juan Nuñez de Prado poblando otro en la <i>provincia</i> que dicen de  <i>Tucumán</i> , que es adelante de los <i>Charcas</i>, entre lo que dicen del Río de la Plata y la <i>provincia</i> de <i>Chile</i> [...]","7","","","","sin datos"
8032,"Macas","8","T8059","[...] de las cuales hice poblar después del desbarato de Gonçalo Pizarro, a <i>Loxa</i> y Jaén y a Santiago de los Valles y a Nuestra Señora de la Paz, y dexé poblando más adelante de <i>Loxa</i> al capitán Mercadillo otro pueblo, y al capitán Diego Palomino otro más adelante de Jaén, y al capitán Baçán otro en la <i>provincia</i> de <i>Çumaco</i>, que es a la parte de <i>Quito</i>, y al capitán Benavente dexé poblando otros dos en la <i>provincia</i> que dicen de <b>Macas</b>, y al capitán Juan Nuñez de Prado poblando otro en la <i>provincia</i> que dicen de  <i>Tucumán</i>, que es adelante de los <i>Charcas</i>, entre lo que dicen del Río de la Plata y la <i>provincia</i> de <i>Chile</i> [...]","7","","","","sin datos"
8033,"maíz/maíces","8","T8060","Y en algunas partes de esta tierra los indios, sin llover ni riego, cogen <b>maíz</b> porque tienen grandes pedaços de tierra ahondados, a la costa de la mar, tiro y medio o dos tiros de arcabuz de la legua del agua al peso de ella y con el frescor que aquella tierra, estando al peso del agua, recibe de la mar, tiene tanta humedad que se engendran <b>maíces</b>, que es el pan de aquella tierra, cuando los siembran y cuando no [tach.: los; interl.: están]siembrados [sic] aquellos pedaços se engendran en ellos mucha hierba de grama.","25","","","","sin datos"
8033,"maíz/maíces","8","T8061","Danse en estos llanos con la hierba de estos cabeços y los que hay en la ribera de los ríos que de la Sierra baxan y de la que nace de la tierra en que se cría el pan y <b>maíz</b>, que es lo que se riega, los ganados de España mucho y son tan fértiles en esta parte de la tierra [...]","26","","","","sin datos"
8033,"maíz/maíces","8","T8062","Tenían grandes tierras y de lo más fértil dedicadas para coger <b>maíz</b>, que es el pan de aquella tierra, para el sol; y labrábanlas y cogíanlas de común con gran cuidado y tanta observancia, que cuando [interl: se; tach.:la] labraban, si se hallaba presente al empeçar a labrar alguna de aquellas tierras del <i>Inga</i>, había de ser él que el primer surco había de dar; y si él no se hallaba presente, dábale el más principal <i>señor</i> que allí se hallaba; y el <b>maíz</b> que de estas tierras se cogía se ponía en <i>casas</i> que para ello cerca de las tierras tenían hechas en el campo.","36-37","","","","sin datos"
8033,"maíz/maíces","8","T8063","Y de él hacían <i>chicha</i>, que es cierta manera de vino que los indios hacen de <b>maíz</b>, que beben mucho y se embeodan con él para sacrificar al sol, echándolo en <i>guacas</i> que ellos llamaban, que eran unos <i>edificios</i> cuadrados, sin cobertura ninguna y en medio unos sumideros llenos de piedras menudas, adonde echaban la <i>chicha</i> y todo lo demás que sacrificaban, las cuales <i>guacas</i> siempre hacían en lo alto de los cerros.","37","","","","sin datos"
8033,"maíz/maíces","8","T8064","Y todo el <b>maíz</b> que sobraba del <b>maíz</b> que de aquellas tierras del sol cogían de un año, se quedabaen aquellas <i>casas</i>, como cosa del sol, para que él lo consumiese, sin que nadie osase tocar en un grano de ello, dado que aquellas casas estaban fuera de poblado.","37","","","","sin datos"
8033,"maíz/maíces","8","T8065","Porque no se coge en ella otro pan sino <b>maíz</b> y de esto no tanto que basten para sustentar a los que en aquellos pueblos residen, sino que de Santo Domingo y Cartagena y de otras islas llevan allí <b>maíz</b> y gallinas y puercos; y de España los navíos, alguna harina y bizcocho; sólo hay abundancia de carne de vaca en <i>Panamá</i>, que en el Nombre de Dios aún hay poca.","43","","","","sin datos"
8033,"maíz/maíces","8","T8066","Y, así, yendo número de gente, [por] poco que allí se detuviese, no sólo de pestilencia mas de hambre moría y por esto digo que Dios fortificó la tierra del <i>Perú</i> también con esterilidad, porque en Tierra Firme, que es la puerta, hay tanta como he dicho y, así, con haber yo tomado todo el bizcocho y harinas que en aquel tiempo vino de España y con haber traído <b>maíz</b> de <i>Nicaragua</i> y comprar todo cuanto en <i>Nata</i> y en los dichos dos pueblos pude haber, apenas pude [a]bastecer la primera armada, que fue en tres naos y una fragata, en que iban trescientos hombres de guerra que envié para correr la costa del <i>Perú</i> y dar cartas y provisiones y publicar la benignidad y perdón de que Su Magestad era servido usar para que, entendido aquello y cómo yo iba con otra armada más gente, se levantasen en su real servicio los pueblos y vecinos del <i>Perú</i> [...]","43-44","","","","sin datos"
8033,"maíz/maíces","8","T8067","Y allende de estas cosas ya dichas que hacen fuerte la tierra del <i>Perú</i>, hay otras dos que la hacen inexpugnable contra la voluntad de los [e]spañoles que en ella hay: la una es que, llegada cualquier gente a la costa, como por la larga navegación no pueda llevar qué coma, si no se lo quieren dar los que están en la tierra morirán de hambre; y, así, cuando yo llegué al puerto de <i>Túmbez</i>, con estar ya toda la comarca de aquel pueblo hasta <i>Lima</i>, que son ciento y noventa legus, prevenidos con los primeros navíos que envié y con los despachos que yo desde Puerto Viejo a todas partes envié para responder a la voz del del [sic] rey y juntarse conmigo y proveerme de mantenimientos y no se lo poder impedir Gonçalo Piçarro, porque era alejado hacia <i>Las Charcas</i>, y deseando todos proveerme, estuvimos diez o doce días sin comer sino sólo del <b>maíz</b> que yo había recogido de Puerto Viejo y de la isla de la <i>Puná</i> y de algunos porqueçuelos de los montes de aquella tierra y de pescado que con un chinchorro que hice llevar en el armada se pescaba.","51-52","","","","sin datos"
8034,"Maricavelica","8","T8068","Y porque para que haya lagartos, que son cocodrilos, se requieren las mismas dos cosas, se ve que de esta parte de la equinoccial se engendran en la boca de los ríos en <i>Panamá</i> y en toda <i>Nicaragua</i> y <i>Guatimala</i>, que es ya mucha altura; y de la otra parta [sic] de la equinoccial en la mar del Sur no se hallan sino hasta el río que se dice <b>Maricavelica</b>, que no será cinco grados de la otra parte de la equinoccial.","49","","","","sin datos"
8035,"Nata","8","T8069","Y, así, yendo número de gente, [por] poco que allí se detuviese, no sólo de pestilencia mas de hambre moría y por esto digo que Dios fortificó la tierra del <i>Perú</i> también con esterilidad, porque en Tierra Firme, que es la puerta, hay tanta como he dicho y, así, con haber yo tomado todo el bizcocho y harinas que en aquel tiempo vino de España y con haber traído <i>maíz</i> de <i>Nicaragua</i> y comprar todo cuanto en <b>Nata</b> y en los dichos dos pueblos pude haber, apenas pude [a]bastecer la primera armada, que fue en tres naos y una fragata, en que iban trescientos hombres de guerra que envié para correr la costa del <i>Perú</i> y dar cartas y provisiones y publicar la benignidad y perdón de que Su Magestad era servido usar para que, entendido aquello y cómo yo iba con otra armada más gente, se levantasen en su real servicio los pueblos y vecinos del <i>Perú</i> [...]","43-44","","","","sin datos"
8036,"Nicaragua","8","T8070","Y, así, yendo número de gente, [por] poco que allí se detuviese, no sólo de pestilencia mas de hambre moría y por esto digo que Dios fortificó la tierra del <i>Perú</i> también con esterilidad, porque en Tierra Firme, que es la puerta, hay tanta como he dicho y, así, con haber yo tomado todo el bizcocho y harinas que en aquel tiempo vino de España y con haber traído <i>maíz</i> de <b>Nicaragua</b> y comprar todo cuanto en <i>Nata</i> y en los dichos dos pueblos pude haber, apenas pude [a]bastecer la primera armada, que fue en tres naos y una fragata, en que iban trescientos hombres de guerra que envié para correr la costa del <i>Perú</i> y dar cartas y provisiones y publicar la benignidad y perdón de que Su Magestad era servido usar para que, entendido aquello y cómo yo iba con otra armada más gente, se levantasen en su real servicio los pueblos y vecinos del <i>Perú</i> [...]","43-44","","","","sin datos"
8036,"Nicaragua","8","T8071","Y cuando con la segunda armada llegamos a la bahía de San Mateo, que es el principio de la costa del <i>Perú</i>, llegamos tan faltos de mantenimientos, que si Dios no nos proveyera con un navío que los de la audiencia de <b>Nicaragua</b> enviaron cargado de ellos (porque yo les había escrito que me los enviasen), que llegó al dicho puerto de la bahía, no sólo se nos murieran de hambre los caballos y bestias que nos habían quedado, mas aun mucha de la gente corría peligro, porque ya no había qué comer en los navíos, porque como la navegación es tan larga y tardía, no basta matalotaje que se embarque yendo algún número de gente, especialmente que, como se ha dicho, hay tanta esterilidad, que no se pueden hacer muchas vituallas.","45","","","","sin datos"
8036,"Nicaragua","8","T8072","La razón de esto debe ser por ser de mayor frialdad las constelaciones que están de la otra parte de la equinoccial hacia el Antártico que no las que están de esta otra hacia el Ártico; y eso parece no sólo por la mayor corriente de aguas que arguye mayor generación de ellas en aquella parte de [tach: a] donde corren, mas aun porque la experiencia lo muestra haber mayor frialdad de la otra parte de la equinoccial que no de ésta, porque <i>Panamá</i> está en nueve grados y el Nombre de Dios, en diez y Santa Marta, en once y Santo Domingo, en veinte y <b>Nicaragua</b> asimismo en los mismos y en todas estas partes que son de la equinoccial hacia el Artico hace mayores calores y más excesivos que no en <i>Piura</i> y Trujillo, que están en cinco y seis grados de la otra parte de la equinoccial y <i>Lima</i>, que está en XVI grados, en invierno hace fríos y grandes yelos.","48","","","","sin datos"
8036,"Nicaragua","8","T8073","Y porque para que haya lagartos, que son cocodrilos, se requieren las mismas dos cosas, se ve que de esta parte de la equinoccial se engendran en la boca de los ríos en <i>Panamá</i> y en toda <b>Nicaragua</b> y <i>Guatimala</i>, que es ya mucha altura; y de la otra parta [sic] de la equinoccial en la mar del Sur no se hallan sino hasta el río que se dice <i>Maricavelica</i>, que no será cinco grados de la otra parte de la equinoccial.","49","","","","sin datos"
8037,"ovejas","8","T8074","Tenían asimismo grandes manadas de <b>ovejas</b> de las de aquella tierra (y son como camellos, excepto que no son tan grandes con mucho ni tienen corcoba) dedicadas al sol y guardábanlas con gran cuidado, así a ellas como a lo que criaban y nadie se aprovechaba de ellas ni de la carne, sino [que], como cosa ofrecida al sol, aun cuando se morían las dexaban para que él las consumiese; y la lana que de ellas tresquilaban la ponían en casas que llamaban depósitos del sol, en el campo, donde sin osar nadie tocar en ella, se estaba perpetuamente hasta que se pudría o consumía.","38","","","","sin datos"
8038,"Pachacama","8","T8075","Esta tierra del <i>Perú</i>, según lo que yo pude entender procurando saberlo con diligencia (porque, como entre ellos no se usaban letras, las cosas de su antigüedad es dificultoso saberlas) fue habitada por dos maneras de gente: la una que vivía en los llanos y adoraba a uno que esta gente llamaba <b>Pachacama</b> y decía que había hecho el cielo y la tierra y la mar y todas las otras cosas, aunque decían que la mar al tiempo que la había criado la había metido en cierta vasija y dádola a guardar a un hombre y una mujer, los cuales habían quebrado la vasija y se había vertido el agua y derramado como ahora está y por ello el <b>Pachacama</b>, diciendo que ya que se había derramado se quedase como se estaba, había castigado [a] aquel hombre y mujer volviendo al hombre en mono y que de allí habían venido los monos; y a la mujer, en zorra y que de allí habían venido las zorras.","29","","","","sin datos"
8038,"Pachacama","8","T8076","A este <b>Pachacama</b> tenían hecho [inter: en los llanos] un gran templo y <i>edificio</i>, junto a la mar, que aún hoy día parece de mucha magestad (dado que está arruinado) y en él residían muchos a manera de sacerdotes que ofrecían <i>sacrificios</i> y consultaban al <b>Pachacama</b> en las necesidades y cosas que a aquella gente se ofrecían, la cual consulta hacían en una cámara muy obscura de aquel <i>edificio</i>, la cual [h]oy día, aunque arruinada, yo vi y tenía todas las paredes pintadas de diversidad de animales así de tierra como de mar.","30","","","","sin datos"
8038,"Pachacama","8","T8077","Y según [h]oy día afirman los indios aquel <b>Pachacama</b> parecía en diversas figuras de animales y ordinariamente en los más feos y bravos, como son serpientes y tigres, y respondía a lo que le preguntaban mostrando muchas veces estar enojado y que se había de desenojar con <i>sacrificios</i>.","31","","","","sin datos"
8038,"Pachacama","8","T8078","Estos <i>Ingas</i>, después que sujetaron la Sierra, procuraron sujetar  los llanos y, aunque con mucho trabajo y con gran muerte de gente, lo hicieron y mandaron a los de los llanos que tuviesen al sol por Dios y porque no lo querían hacer, hicieron en ellos muchos castigos; y afligidos los de los llanos, decíen [sic] que por sus sacerdotes consultaron a <b>Pachacama</b> sobre ello y respondió que, pues no podían hacer más, que adorasen al sol, pero que no dexasen a él; y así, los de los llanos tenían entrambas observancias, la del sol y <b>Pachacama</b>, pero más principal a <b>Pachacama</b>. ","38-39","","","","sin datos"
