id_palabra,"Palabra","id_cronista","id_texto","cita","pagina","lengua","propuesta","nota","enlace"
8039,"Paita","8","T8079","Y de esta manera, estando yo en <i>Lima</i>, iba de <i>Panamá</i> un galeón que se decía Calero y anduvo catorce mese por llegar a <i>Lima</i> y en bordes navegó, según dicen, más de cuatro mil leguas y nunca pudo llegar más de hasta el río de Santa, que es sesenta leguas antes de <i>Lima</i>; y, porfiando todavía, tornó a caer otras sesenta más atrás y tan perdido y lleno de vescosidad, la cual en aquella mar hay mucha, que quedó de muy poco provecho y hubo necesidad de enviar barcos por la mercancía que traía de <b>Paita</b>, donde había arribado.","51","","","","sin datos"
8040,"Panamá","8","T8080","Y esta tierra de estas dos Gobernaciones es de gran fortaleza y tanto, que parece que Dios la haya fortificado para que no se pueda ir a ella por parte alguna sino con gran dificultad, porque la parte por donde con menos se puede ir es por <b>Panamá</b> y por ésta parece que está fortificada con enfermedad y esterilidad y agua y viento para no poder ir a ella.","41","","","","sin datos"
8040,"Panamá","8","T8081","Porque Nombre de Dios y <b>Panamá</b> que son los pueblos que están en la puerta del <i>Perú</i>, el uno en que se ha de desembarcar después de haber caminado desde España mil y seiscientas o mil y setecientas leguas y donde se ha de tornar a embarcar por la mar que dicen del Sur, son tan enfermos, que de cien hombres que se detengan allí un mes creo no escaparán de caer enfermos veinte y de tal enfermedad, que gran número de ellos mueren; y en mi compañía, cuando a aquella tierra fui, irían treinta personas y ninguna dexó de adolecer en ella y más de las dos tercias partes murieron o llegaron a punto de muerte [...]","41","","","","sin datos"
8040,"Panamá","8","T8082","Y la gente de la armada que conmigo de aquel puerto del Nombre de Dios salió, con ser ya toda hecha a Indias, salió tan enferma, que era cosa de gran lástima, con solo haberlos yo detenido allí poco tiempo aguardando a ver si venía la armada que se había de enviar para traer la hacienda de Su Magestad y a pasarla de <b>Panamá</b> al Nombre de Dios y poner a punto la armada que yo allí hice; y aunque fueron mejorando después de apartados de aquella tierra, pero salieron tan enfermos de ella, que desde aquel puerto hasta <i>La Habana</i> se hecharon XVI hombres a la mar y entre ellos, dos maestros de naos; y esto de estas enfermedades y muertos pasa con haber medicinas y refrigerio para los enfermos de la gente que allí hay, que son mercaderes y sus criados y gente de la mar que viene del <i>Perú</i> y va de España y pasajeros que de una parte a otra pasan [...]","42","","","","sin datos"
8040,"Panamá","8","T8083","Porque no se coge en ella otro pan sino <i>maíz</i>  y de esto no tanto que basten para sustentar a los que en aquellos pueblos residen, sino que de Santo Domingo y Cartagena y de otras islas llevan allí <i>maíz</i> y gallinas y puercos; y de España los navíos, alguna harina y bizcocho; sólo hay abundancia de carne de vaca en <b>Panamá</b>, que en el Nombre de Dios aún hay poca.","43","","","","sin datos"
8040,"Panamá","8","T8084","Y sin embargo de esto llegó la primera armada tan necesitada de bastimentos, que hubo necesidad que el capitán Diego de Mora y otros vecinos de Trujillo la proveyesen de ellos cuando llegó a aquel paraje, que fue XVII a abril 1547; y con no haber desde allí a <i>Lima</i> sino ochenta leguas, tardó en andarlas hasta doce de julio, que llegó al <i>Callao</i> de la ciudad de <i>Lima</i>, con ser las naos que llevaban las más veleras y más bien despalmadas y a punto que desde <b>Panamá</b> pudimos enviar y en el mejor tiempo del año para aquel viaje. ","44-45","","","","sin datos"
8040,"Panamá","8","T8085","La razón de esto debe ser por ser de mayor frialdad las constelaciones que están de la otra parte de la equinoccial hacia el Antártico que no las que están de esta otra hacia el Ártico; y eso parece no sólo por la mayor corriente de aguas que arguye mayor generación de ellas en aquella parte de [tach: a] donde corren, mas aun porque la experiencia lo muestra haber mayor frialdad de la otra parte de la equinoccial que no de ésta, porque <b>Panamá</b> está en nueve grados y el Nombre de Dios, en diez y Santa Marta, en once y Santo Domingo, en veinte y <i>Nicaragua</i> asimismo en los mismos y en todas estas partes que son de la equinoccial hacia el Artico hace mayores calores y más excesivos que no en <i>Piura</i> y Trujillo, que están en cinco y seis grados de la otra parte de la equinoccial y <i>Lima</i>, que está en XVI grados, en invierno hace fríos y grandes yelos.","48","","","","sin datos"
8040,"Panamá","8","T8086","Y aun también me parece que esta mayor frialdad se experimenta en la frialdad que en la mar del Sur se halla de la otra parte de la equinoccial, donde por ser el agua de la mar más fría no se engendra aquel gusan[tach: ill]o  que llaman broma en los navíos en los puertos, al menos en el de <i>Lima</i> (dado que en él entre río de agua dulce), y en <b>Panamá</b> y en Nombre de Dios y en otros  de más altura de esta parte de la equinoccial se engendra mucha donde entra agua dulce, porque para que se engendre este gusanillo dicen que es menester que haya calor en el agua de la mar y se mezcle con ella agua de río.","49","","","","sin datos"
8040,"Panamá","8","T8087","Y porque para que haya lagartos, que son cocodrilos, se requieren las mismas dos cosas, se ve que de esta parte de la equinoccial se engendran en la boca de los ríos en <b>Panamá</b> y en toda <i>Nicaragua</i> y <i>Guatimala</i>, que es ya mucha altura; y de la otra parta [sic] de la equinoccial en la mar del Sur no se hallan sino hasta el río que se dice <i>Maricavelica</i>, que no será cinco grados de la otra parte de la equinoccial.","49","","","","sin datos"
8040,"Panamá","8","T8088","Digo asimismo que está cercada la tierra del <i>Perú</i> de viento, porque siempre todo el año corren sures o medios días que vienen del <i>Perú</i> hacia <b>Panamá</b>, si no son dos meses que corren vientos nortes, los cuales no recalan de tres partes del camino que desde <b>Panamá</b> al <i>Perú</i> hay, la una y en las otras, aun en aquellos dos meses andan siempre continuamente los dichos sures.","50","","","","sin datos"
8040,"Panamá","8","T8089","Y de esta manera, estando yo en <i>Lima</i>, iba de <b>Panamá</b> un galeón que se decía Calero y anduvo catorce mese por llegar a <i>Lima</i> y en bordes navegó, según dicen, más de cuatro mil leguas y nunca pudo llegar más de hasta el río de Santa, que es sesenta leguas antes de Lima; y, porfiando todavía, tornó a caer otras sesenta más atrás y tan perdido y lleno de vescosidad, la cual en aquella mar hay mucha, que quedó de muy poco provecho y hubo necesidad de enviar barcos por la mercancía que traía de <i>Paita</i>, donde había arribado.","51","","","","sin datos"
8040,"Panamá","8","T8090","Bien es verdad que aunque esta gran fortaleza de la tierra del <i>Perú</i> todavía sea mucha, pero no es ahora tan grande como lo era cuando fui, porque el camino más fácil que entonces había descubierto era, como he dicho, por la mar del Sur desde <b>Panamá</b>, donde yendo desde España había de haber dos navegaciones: una hasta el nombre de Dios y otra en otros navíos y armada, de <b>Panamá</b> al <i>Perú</i>, tan dificultosa como ya he dicho.","56","","","","sin datos"
8041,"Perú","8","T8091","La tierra que los Christianos llamaron <b>Perú</b> y la que el Emperador Rey nuestro señor Don Carlos V, que es el primer rey y señor de cristianos que la posee, llama <b>Perú</b> en sus reales provisiones, es muy grande y extendida, porque en ella, como parece en la provisión que a Juan de Sámamo hizo de la escribanía de la tierra del <b>Perú</b>, entra en la Gobernación de <i>Popayán</i>, que hasta este año de mil y quinientos y cincuenta y uno gobierna por Su Magestad el adelantado Don Sebastián de Belalcáçar, que en nombre de Su Magestad la pacificó y pobló de cristianos.","5","","","","sin datos"
8041,"Perú","8","T8092","Y ansimismo cae en lo que Su Magestad en la dicha provisión llama <b>Perú</b>, la <i>provincia</i> que dicen de <i>Chile</i>, que al presente gobierna, descubre y pacifica en nombre de Su Magestad y por provisión que para ello yo le di, por virtud del poder que de Su Magestad tuve para dar gobernaciones y conquistas, el gobernador y capitán Pedro de Valdivia, donde cuando salí del <b>Perú</b> dexé pobladas de cristianos tres ciudades que son La Serena (en nombre de indios, <i>Chimbo</i>), y Santiago (en nombre de indios, Chilo [sic: <i>Chile</i>]) y otra ciudad en la <i>provincia</i> que dicen de <i>Biobio</i>.","7","","","","sin datos"
8041,"Perú","8","T8093","Esta tierra del <b>Perú</b>, tan extendida y grande que de costa del Mar del Sur tiene mil y docientas o mil y trecientas lenguas, nunca fue vista ni conocida por hombre de Europa ni de Africa hasta nuestros tiempos […]","8","","","","sin datos"
8041,"Perú","8","T8094","Y dícese que la tierra del <b>Perú</b> nunca fue vista ni conocida por hombre de Europa ni de Africa, porque aunque no se tuviese por tan dudoso sino que fuese verdad lo que algunos quieren decir de los cartaginenses que tuvieron noticia de tierras occidentales y lo que dice en el Timeo Platón, que con Solón pasó el viejo sacerdote exipcio, aquello sería de alguna poca cosa de la costa del Mar que dicen del Norte, pero no de la Mar del Sur, que tan escondida está y tan dificultosa de hallar, que aun habiendo años que [e]spañoles tenían poblada la del Norte no sabían que la hubiese ni la pudieron hallar sino con gran trabajo, atravesando la tierra hasta llegar al mar del Sur, en cuya costa está el <b>Perú</b>.","13-14","","","","sin datos"
8041,"Perú","8","T8095","Hay en esta tierra del <b>Perú</b> grandes extremos y de gran admiración y que parece a los que no entienden causa, que no se pueden compadecer.","14","","","","sin datos"
8041,"Perú","8","T8096","Pero en las cordilleras del <b>Perú</b>  que se extienden las dichas más de mil leguas, dado que en algunas partes hace quebradas, hay perpetua y continuamente nieve fuera de las dichas quebradas, de tal manera que en ninguna parte del año parece que hay mella en ella.","15","","","","sin datos"
8041,"Perú","8","T8097","Esta tierra del <b>Perú</b>, según lo que yo pude entender procurando saberlo con diligencia (porque, como entre ellos no se usaban letras, las cosas de su antigüedad es dificultoso saberlas) fue habitada por dos maneras de gente: la una que vivía en los llanos y adoraba a uno que esta gente llamaba <i>Pachacama</i> y decía que había hecho el cielo y la tierra y la mar y todas las otras cosas, aunque decían que la mar al tiempo que la había criado la había metido en cierta vasija y dádola a guardar a un hombre y una mujer, los cuales habían quebrado la vasija y se había vertido el agua y derramado como ahora está y por ello el <i>Pachacama</i>, diciendo que ya que se había derramado se quedase como se estaba, había castigado [a] aquel hombre y mujer volviendo al hombre en mono y que de allí habían venido los monos; y a la mujer, en zorra y que de allí habían venido las zorras.","29","","","","sin datos"
8041,"Perú","8","T8098","En esta tierra del <b>Perú</b> abundante de [interl: todos] metales, especialmente de oro y plata, que se cree es la más rica de todo el mundo, al menos la parte de ella que  de ella cae en las gobernaciones de Su Magestad del Emperador nuestro señor encomendó al marqués Francisco Pizarro y al adelantado don Diego de Almagro, que fueron Norte-Sur derecho meridiano CCCC y LXX leguas, empeçando desde grado y medio antes de la equinoccial hasta XXV o XXVI grados de la otra parte de la equinoccial hacia el polo Antártico;y, así, los naturales, antes de entrar los [e]spañoles en ella, se sirvían estas dos gobernaciones de vaxillas grandes de oro y plata, de tinajas. cántaros, ollas, jarros, y platos y otros vasos de diversas maneras; y los <i>señores</i> tenían escaños de ellos y entre ellos se halló uno de oro que, reducido a oro fino, valió veinte y seis mil castellanos; y después que los  [e]spañoles entraron y, en especial, desde el año de 1546 se han descubierto tantas y tan ricas minas de plata, que es cosa de grande admiración.","39-40","","","","sin datos"
8041,"Perú","8","T8099","Porque Nombre de Dios y <i>Panamá</i> que son los pueblos que están en la puerta del <b>Perú</b>, el uno en que se ha de desembarcar después de haber caminado desde España mil y seiscientas o mil y setecientas leguas y donde se ha de tornar a embarcar por la mar que dicen del Sur, son tan enfermos, que de cien hombres que se detengan allí un mes creo no escaparán de caer enfermos veinte y de tal enfermedad, que gran número de ellos mueren; y en mi compañía, cuando a aquella tierra fui, irían treinta personas y ninguna dexó de adolecer en ella y más de las dos tercias partes murieron o llegaron a punto de muerte [...]","41","","","","sin datos"
8041,"Perú","8","T8100","Y la gente de la armada que conmigo de aquel puerto del Nombre de Dios salió, con ser ya toda hecha a Indias, salió tan enferma, que era cosa de gran lástima, con solo haberlos yo detenido allí poco tiempo aguardando a ver si venía la armada que se había de enviar para traer la hacienda de Su Magestad y a pasarla de <i>Panamá</i> al Nombre de Dios y poner a punto la armada que yo allí hice; y aunque fueron mejorando después de apartados de aquella tierra, pero salieron tan enfermos de ella, que desde aquel puerto hasta <i>La Habana</i> se hecharon XVI hombres a la mar y entre ellos, dos maestros de naos; y esto de estas enfermedades y muertos pasa con haber medicinas y refrigerio para los enfermos de la gente que allí hay, que son mercaderes y sus criados y gente de la mar que viene del <b>Perú</b> y va de España y pasajeros que de una parte a otra pasan [...]","42","","","","sin datos"
8041,"Perú","8","T8101","Y, así, yendo número de gente, [por] poco que allí se detuviese, no sólo de pestilencia mas de hambre moría y por esto digo que Dios fortificó la tierra del <b>Perú</b> también con esterilidad, porque en Tierra Firme, que es la puerta, hay tanta como he dicho y, así, con haber yo tomado todo el bizcocho y harinas que en aquel tiempo vino de España y con haber traído <i>maíz</i> de <i>Nicaragua</i> y comprar todo cuanto en <i>Nata</i> y en los dichos dos pueblos pude haber, apenas pude [a]bastecer la primera armada, que fue en tres naos y una fragata, en que iban trescientos hombres de guerra que envié para correr la costa del <b>Perú</b> y dar cartas y provisiones y publicar la benignidad y perdón de que Su Magestad era servido usar para que, entendido aquello y cómo yo iba con otra armada más gente, se levantasen en su real servicio los pueblos y vecinos del <b>Perú</b> [...]","43-44","","","","sin datos"
8041,"Perú","8","T8102","Y cuando con la segunda armada llegamos a la bahía de San Mateo, que es el principio de la costa del <b>Perú</b>, llegamos tan faltos de mantenimientos, que si Dios no nos proveyera con un navío que los de la audiencia de <i>Nicaragua</i> enviaron cargado de ellos (porque yo les había escrito que me los enviasen), que llegó al dicho puerto de la bahía, no sólo se nos murieran de hambre los caballos y bestias que nos habían quedado, mas aun mucha de la gente corría peligro, porque ya no había qué comer en los navíos, porque como la navegación es tan larga y tardía, no basta matalotaje que se embarque yendo algún número de gente, especialmente que, como se ha dicho, hay tanta esterilidad, que no se pueden hacer muchas vituallas.","45","","","","sin datos"
8041,"Perú","8","T8103","Y digo que, asimismo, está fortificada de agua, porque siempre continuamente las corrientes que salen del polo Antártico corren continuamente desde el estrecho de Magallanes por toda la costa de <i>Chile</i> y <b>Perú</b> y de la Buena Ventura, Tierra Firme, <i>Guatimala</i> y la Nueva [E]spaña hasta volver a las islas Molucos; y así, la navegación del  <b>Perú</b> a Tierra Firme y a la Nueva [E]spaña y a las dichas islas es fácil y la otra, que es al contrario que ir contra la corriente, es tan dificultosa, que con gran dificultad y en mucho tiempo se va comúnmente; desde Tierra Firme al  <b>Perú</b> y desde las islas Molucos a la Nueva [E]spaña nunca se han podido volver hasta ahora, año de 1533 [...]","46","","","","sin datos"
8041,"Perú","8","T8104","Digo asimismo que está cercada la tierra del <b>Perú</b> de viento, porque siempre todo el año corren sures o medios días que vienen del <b>Perú</b> hacia <i>Panamá</i>, si no son dos meses que corren vientos nortes, los cuales no recalan de tres partes del camino que desde <i>Panamá</i> al <b>Perú</b> hay, la una y en las otras, aun en aquellos dos meses andan siempre continuamente los dichos sures.","50","","","","sin datos"
8041,"Perú","8","T8105","Y allende de estas cosas ya dichas que hacen fuerte la tierra del <b>Perú</b>, hay otras dos que la hacen inexpugnable contra la voluntad de los [e]spañoles que en ella hay: la una es que, llegada cualquier gente a la costa, como por la larga navegación no pueda llevar qué coma, si no se lo quieren dar los que están en la tierra morirán de hambre; y, así, cuando yo llegué al puerto de <i>Túmbez</i>, con estar ya toda la comarca de aquel pueblo hasta <i>Lima</i>, que son ciento y noventa legus, prevenidos con los primeros navíos que envié y con los despachos que yo desde Puerto Viejo a todas partes envié para responder a la voz del del [sic] rey y juntarse conmigo y proveerme de mantenimientos y no se lo poder impedir Gonçalo Piçarro, porque era alejado hacia <i>Las Charcas</i>, y deseando todos proveerme, estuvimos diez o doce días sin comer sino sólo del <i>maíz</i> que yo había recogido de Puerto Viejo y de la isla de la <i>Puná</i> y de algunos porqueçuelos de los montes de aquella tierra y de pescado que con un chinchorro que hice llevar en el armada se pescaba.","51-52","","","","sin datos"
8041,"Perú","8","T8106","Bien es verdad que aunque esta gran fortaleza de la tierra del <b>Perú</b> todavía sea mucha, pero no es ahora tan grande como lo era cuando fui, porque el camino más fácil que entonces había descubierto era, como he dicho, por la mar del Sur desde <i>Panamá</i>, donde yendo desde España había de haber dos navegaciones: una hasta el nombre de Dios y otra en otros navíos y armada, de <i>Panamá</i> al <b>Perú</b>, tan dificultosa como ya he dicho.","56","","","","sin datos"
8041,"Perú","8","T8107","Y como después que yo allá fui se descubrió el camino del Río de la Plata al <b>Perú</b>, por los mensajeros que los del Río de la Plata me enviaron, y la gente, armas y municiones, ropa, [h]erraje, instrumentos para minas, caballos y yeguas que se les envió, parece que por aquella parte del Río de la Plata se podría enviar desde [E]spaña (que es buena y una sola navegación) exército con que, aunque con mucho trabajo y con harta dilación, ayudado de los del Río de la Plata y de los que del <b>Perú</b> acudiesen a la voz de su rey, se podría con más facilidad que de antes allanar lo del <b>Perú</b>, si se alterase, especialmente que para ir por aquel camino del Río de la Plata ayudarían las poblaciones de [e]spañoles que entre el <b>Perú</b> y el Río de la Plata yo ordené que se hiciesen, no sin falta de este respecto, aunque a nadie lo dixe.","56-57","","","","sin datos"
8041,"Perú","8","T8108","Y también no dexé de tener consideración en la población de <i>Chile</i>, que estando aquella tierra poblada y alindando con el <b>Perú</b>, podría ser de ayuda para semejante allanamiento; y, así, por estas cosas, aunque como he dicho todavía quedaba muy fuerte y casi con exército ina[c]cesible la tierra del <b>Perú</b>, pero todavía no parece quedar tanto como lo era antes.","57","","","","sin datos"
8042,"Piura","8","T8109","Y entra lo que dicen del Nuevo <i>Reino</i>, donde ahora se ha puesto Chancillería; y entra lo que al presente está subjeto a la Chancillería que reside, después del desbarato y castigo de Gonçalo Pizarro, en la ciudad de los Reyes, que por nombre antiguo de indios <i>Lima</i>, que son las ciudades con sus términos de <i>Quito</i>, <i>Loxa</i>, Puerto Viejo, <i>Guayaquil</i>, Jaén, <b>Piura</b>, <i>Chachapoyas</i>, Santiago de los Valles, Trujillo, <i>Guánuco</i>, la misma ciudad de los Reyes, <i>Guamanga</i>, el <i>Cuzco</i>, <i>Arequipa</i>, Nuestra Señora de la Paz, la Villa de la Plata [...]","6","","","","sin datos"
8042,"Piura","8","T8110","La razón de esto debe ser por ser de mayor frialdad las constelaciones que están de la otra parte de la equinoccial hacia el Antártico que no las que están de esta otra hacia el Ártico; y eso parece no sólo por la mayor corriente de aguas que arguye mayor generación de ellas en aquella parte de [tach: a] donde corren, mas aun porque la experiencia lo muestra haber mayor frialdad de la otra parte de la equinoccial que no de ésta, porque <i>Panamá</i> está en nueve grados y el Nombre de Dios, en diez y Santa Marta, en once y Santo Domingo, en veinte y <i>Nicaragua</i> asimismo en los mismos y en todas estas partes que son de la equinoccial hacia el Artico hace mayores calores y más excesivos que no en <b>Piura</b> y Trujillo, que están en cinco y seis grados de la otra parte de la equinoccial y <i>Lima</i>, que está en XVI grados, en invierno hace fríos y grandes yelos.","48","","","","sin datos"
8043,"Popayán","8","T8111","La tierra que los Christianos llamaron <i>Perú</i> y la que el Emperador Rey nuestro señor Don Carlos V, que es el primer rey y señor de cristianos que la posee, llama <i>Perú</i> en sus reales provisiones, es muy grande y extendida, porque en ella, como parece en la provisión que a Juan de Sámamo hizo de la escribanía de la tierra del <i>Perú</i>, entra en la Gobernación de <b>Popayán</b>, que hasta este año de mil y quinientos y cincuenta y uno gobierna por Su Magestad el adelantado Don Sebastián de Belalcáçar, que en nombre de Su Magestad la pacificó y pobló de cristianos.","5","","","","sin datos"
8044,"personas principales","8","T8112","Y así, le sacrificaban sangre humana y otros animales y tenía aquella gente tan gran devoción en aquel templo, que los más <i>señores</i> y <b>personas principales</b> de aquellos llanos se mandaban llevar a enterrar en el circuito de aquel templo y, así, hoy día hay en mucho campo alderredor de aquel <i>edificio</i> gran muchedumbre de montones de huesos que españoles han desenterrado buscando las riquezas con que se habían enterrado así de oro como plata y esmeraldas.","31","","","","sin datos"
8045,"provincia","8","T8113","[...] de las cuales hice poblar después del desbarato de Gonçalo Pizarro, a <i>Loxa</i> y Jaén y a Santiago de los Valles y a Nuestra Señora de la Paz, y dexé poblando más adelante de <i>Loxa</i> al capitán Mercadillo otro pueblo, y al capitán Diego Palomino otro más adelante de Jaén, y al capitán Baçán otro en la <b>provincia</b> de <i>Çumaco</i>, que es a la parte de <i>Quito</i>, y al capitán Benavente dexé poblando otros dos en la <b>provincia</b> que dicen de <i>Macas</i>, y al capitán Juan Nuñez de Prado poblando otro en la <b>provincia</b> que dicen de <i>Tucumán</i>, que es adelante de los <i>Charcas</i>, entre lo que dicen del Río de la Plata y la <b>provincia</b> de <i>Chile</i> [...]","7","","","","sin datos"
8045,"provincia","8","T8114","Y ansimismo dexé comisión al capitán Francisco Hernández para que poblase otros dos en la <b>provincia</b> que dicen de los <i>Chunchos</i>, que cae dentro del mismo distrito, a las espaldas del término de Nuestra Señora de la Paz, más hacia lo que dicen del Río de la Plata; lo cual todo cae en el dicho distrito de la audiencia de los Reyes.","7","","","","sin datos"
8045,"provincia","8","T8115","Y ansimismo cae en lo que Su Magestad en la dicha provisión llama <i>Perú</i>, la <b>provincia</b> que dicen de <i>Chile</i>, que al presente gobierna, descubre y pacifica en nombre de Su Magestad y por provisión que para ello yo le di, por virtud del poder que de Su Magestad tuve para dar gobernaciones y conquistas, el gobernador y capitán Pedro de Valdivia, donde cuando salí del <i>Perú</i> dexé pobladas de cristianos tres ciudades que son La Serena (en nombre de indios, <i>Chimbo</i>), y Santiago (en nombre de indios, Chilo [sic: <i>Chile</i>]) y otra ciudad en la <b>provincia</b> que dicen de <i>Biobio</i>.","7","","","","sin datos"
8045,"provincia","8","T8116","Y así, cuando el adelantado Don Diego de Almagro fue a la <b>provincia</b> de <i>Chile</i> y atravesó estas cordilleras, se le murieron en ellas gran número de indios, negros, caballos y cantidad de españoles y algunos de los que escaparon salieron de las dichas cordilleras habiendo perdido los dedos de los pies y una parte de la gente del dicho adelantado que iba tras él y pasó las dichas cordilleras seis meses después hallaron tan fresca la carne de los caballos que se habían muerto al dicho Don Diego de Almagro como si no hubiera más de ocho días que habían muerto y así se socorrieron de ella y la comieron y hallaban los hombres muertos y [h]elados junto al caballo que se les había quedado la rienda el la mano y arrebujados con sus capas.","16","","","","sin datos"
