"id_palabra","Palabra","id_cronista","id_texto","cita","pagina"
40420,"Ynga Yupangue / Pachacuti Ynga Yupangue / Pachacuti / Ynga Yupangue",4,"T44787","Y al tiempo que la edificavan, estando asentando, çierta piedra quebrose de la tal piedra un pedaço como tres dedos en hancho e largo, y mandó Ynga Yupangue que luego fuese allí derritida çierta plata y baziada de tal manera en la piedra y quebrado della que viniese al justo de lo que la piedra se quebró, toda la qual hera de cantería, y la juntura de la tal cantería de piedra con piedra hera tan sutilmente asentada que paresçía raya hecha con un clavo en una piedra. En la qual casa se enterravan los señores prinçipales en los patios e aposentos, eçepto donde el ydolo estaba.",165
40420,"Ynga Yupangue / Pachacuti Ynga Yupangue / Pachacuti / Ynga Yupangue",4,"T44788","Y el día que el ydolo se puso en las casas del sol, se puso la piedra en medio de la plaça e dende a diez días que el bulto fue puesto en el escaño que avéis oydo, mandó Ynga Yupangue que se adereçasen unas andas pequeñas enaforradas con çierta tela de oro y ansí adereçadas mandó que los señores más prinçipales de la çiudad, que heran aquellos sus tres amigos, y el mayordomo del sol, tomasen las andas; y el mismo Ynga Yupangue entró donde el ydolo estava e tomole e púsole en las andas y ansí le mandó llevar por toda la çiudad diziendo que bendezía el sol la tal çiudad e moradores della.",165
40420,"Ynga Yupangue / Pachacuti Ynga Yupangue / Pachacuti / Ynga Yupangue",4,"T44789","Acavado de dar horden Ynga Yupangue e de aver hecho los ydolos e casas del sol que avéis oydo, mandó en la çiudad del Cuzco que en un çierto día señalado fuesen juntos en ella todos los señores caçiques y prinçipales que en las provinçias e comarcas de [e]n torno de la çiudad del Cuzco bivían y a él avían dado obidiençia para que tenía çiertas cosas que comunicar con ellos.",167
40420,"Ynga Yupangue / Pachacuti Ynga Yupangue / Pachacuti / Ynga Yupangue",4,"T44790","E oydo el mando por los prinçipales del Cuzco, luego enbiaron sus orejones por las provinçias e comarcas que ya avéis oydo, con los quales enbiavan a mandar a los tales señores dellas el mando que el Ynga tenía hecho y que para aquel día señalado fuesen todos a las çiudad. E como los tales señores supiesen el mando de Ynga Yupangue, con la más brevedad que posible les fuese vinieron a la çiudad del Cuzco.",167
40420,"Ynga Yupangue / Pachacuti Ynga Yupangue / Pachacuti / Ynga Yupangue",4,"T44791","E luego de allí mando Ynga Yupangue que todos fuesen a çierto sitio do las tales tierras estavan pintadas, donde como allí fuese, dio e repartió las dichas tierras, dando a cada uno dellos las tierras que le paresçió que le bastavan. Y esto hecho mandó allí luego que aquellos tres señores sus amigos se las fuesen a repartir todos los de la çiudad bien ansí como se las avía dado e señalado, y que esto hecho bolviesen todos ellos delante dél.",167
40420,"Ynga Yupangue / Pachacuti Ynga Yupangue / Pachacuti / Ynga Yupangue",4,"T44792","Y esto proveydo Ynga Yupangue estuvo algunos días, mientras en el adereçar de las tierras se dava horden, holgándose y recreándose y biendo cómo cada uno travajava y adereçava la parte que le avía cavido; y al que vía que con algún trabajo lo hazía, dávale ayuda. E como viese que el edifiçio y reparaçión de las tales tierras yba a la larga y que a según yban los reparos que los tales hazían y que hera edifiçio que no se podría acavar tan ayna, mandó que los señores e caçiques que allí heran se juntasen en su casa çierto día y luego fueron juntos bien ansí como él lo mandó.",168
40420,"Ynga Yupangue / Pachacuti Ynga Yupangue / Pachacuti / Ynga Yupangue",4,"T44793","E luego los señores caçiques dijeron que les plazía de toda voluntad de lo mandar traer; que mandase que de la çiudad del Cuzco fuesen algunos orejones en compañía de los yndios que ansí ellos enbiasen para que en sus tierras les constase a los que allá heran que hera su voluntad que el tal proveymiento hiziese a la çiudad del Cuzco, porque aquel serviçio primero quellos hazían e por ellos muy mucho deseado de hazer el tal serviçio a la çiudad del Cuzco y a su señor Ynga Yupangue. Todo lo qual les fue agradesçido por Ynga Yupangue e mandó luego a aquellos señores del Cuzco que proveyesen allá en sus posadas juntamente con aquellos caçiques los orejones que ansí avían de yr por los pueblos e provinçias a juntar e traer las tales comidas e mantenimientos.",168
40420,"Ynga Yupangue / Pachacuti Ynga Yupangue / Pachacuti / Ynga Yupangue",4,"T44794","Y ansí fueron los señores a sus posadas y hizieron allá su junta ellos e los caçiques e repartieron lo que cada provinçia avía de traer e contribuir y ansí se les repartió a los caçiques que allí heran los depósitos que ansí avían de hazer e se les mandó e señaló el tienpo que de tantos a tantos años se les hinchiesen yn perpetuun si por el Ynga no le fuese mandado otra cossa. Todo lo qual açeptaron de hazer los tales caçiques porque entendían que Ynga Yupangue hera señor que sabía bien satisfazer todo serviçio que le fuese hecho.",169
40420,"Ynga Yupangue / Pachacuti Ynga Yupangue / Pachacuti / Ynga Yupangue",4,"T44795","E luego allí en su junta los señores señalaron los orejones que avían de yr e ansimismo los caçiques los prinçipales que ellos enbiavan e ansí se partieron estos orejones e prinçipales a traer las tales comidas e proveymientos que los señores e caçiques salieron de su junta e fueron do Ynga Yupangue estava, al qual le dixeron lo que ansí avían hecho y ordenado como él los avía avisado e que les señalase los sitios e lugares do avían de ser hechos los depósitos, porque los que cada uno avía de hazer ya entre ellos los tenían repartidos.",169
40420,"Ynga Yupangue / Pachacuti Ynga Yupangue / Pachacuti / Ynga Yupangue",4,"T44796","Y luego Ynga Yupangue le[s] señaló çiertas chapas e laderas de sierras que en torno de la çiudad del Cuzco estavan y a vista y allí les mandó que luego fuesen edificados los tales depósitos para que quando el tal proveymiento fuese traído hallasen en que lo meter.",169
40420,"Ynga Yupangue / Pachacuti Ynga Yupangue / Pachacuti / Ynga Yupangue",4,"T44797","E luego fueron los señores a los sitios que por el Ynga le fueron señalados e pusieron por obra el edifiçio de los tales depósitos; e tardose en hazer estos depósitos e reparar las tierras çinco años, porque fueron muy muchos los depósitos que se hizieron, las quales mandava hazer Ynga Yupangue por tener mucha e muy gran cantidad de comida y tanta que no le faltase.",169
40420,"Ynga Yupangue / Pachacuti Ynga Yupangue / Pachacuti / Ynga Yupangue",4,"T44798","E siendo ya las tierras reparadas e acabadas todas de reparar, Ynga Yupangue mandó juntar los caçiques e señores que en todo lo ya dicho le avían hecho serviçio; e paresçiéndole que hera justo hazeles algunas merçedes e dales algún contentamiento e siendo ansí juntos dioles e repartioles muchas joyas de oro e plata que mediante aquel tienpo que en la obra estuvieron él avía mandado labrar; e ansimismo les dio cada dos bestidos de las ropas de su bestir e a cada uno dellos les dio una señora naturales del Cuzco y de su linaje para que fuesen cada una déstas muger prinçipal del caçique a quien ansí le avían dado; e que los hijos que en las tales uviesen fuesen herederos de los tales Estados e señoríos que sus padres tuviesen, fundándose Ynga Yupangue que por el deudo que con ellos por esta vía avía, que nunca ninguno dellos en sus días se le rebelaría e que abría entre ellos e los de la çiudad del Cuzco perpetua amistad y confederaçión.",169
40420,"Ynga Yupangue / Pachacuti Ynga Yupangue / Pachacuti / Ynga Yupangue",4,"T44799","Todo lo qual ansí hecho y visto por los caçiques las grandes merçedes que les hazía, todos se ynclinaron a le besar los pies y a le dar grandes graçias, a los quales mandó Ynga Yupangue que se fuesen a descansar a sus tierras y que dentro de un año bolviesen a la çiudad del Cuzco e que mediante este tienpo cada uno dellos en sus tierras hiziesen senbrar muchas sementeras de todas comidas porque tenía que serían menester andando el tienpo; e que les reconmendava que en sus tierras no uviese oçiosidad en los mançebos ni en las mugeres porque no fuesen causa las tales oçiosidades de tener los suyos resabios de mal exenplo; e que los procurasen exerçitar todo tienpo que no entendiesen en hazer sementeras en las cosas de la guerra y en los semjantes exerçiçios como hera en saber esgremir hondas, tirar flechas, jugar con hechas a manera de pelea en batalla, blandear lanças con rodelas en las manos, todo lo qual avían de hazer en sus tierras los mançebos, haziendo poner tantos a un cavo como a otro. Todo lo qual oydo por los caçiques dijeron que ansí lo harían e que él les dezía lo que hera bueno; y ansí el Ynga los despidió y ellos, haziendo su acatamiento, se salieron y se fueron para sus tierras.",170
40420,"Ynga Yupangue / Pachacuti Ynga Yupangue / Pachacuti / Ynga Yupangue",4,"T44800","Ydos que fueron los caçiques a sus tierras aquel año que los tales caçiques avían de estar en sus tierras y Ynga Yupangue mediante este tieenpo no tuviese que hazer como por exerçiçio de se yr a caça, lo qual hazía los más de los días y otros días se andava por la çiudad mirándola y el sitio della e ymaginando él en sí la horden que la avía de dar y el edifiçio e reedificaçión que en ella pensava hazer.",171
40420,"Ynga Yupangue / Pachacuti Ynga Yupangue / Pachacuti / Ynga Yupangue",4,"T44801","Y el año cunplido que a Ynga Yupangue le paresçió que ya hera tieenpo que los señores comarcanos viniesen, enbioles sus mensajeros por los quales les enbió a dezir que ya hera tieenpo que viniesen a la çiudad como él ya les avía dicho quando de allí fueran y que ansimismo truxesen todos los más ganados que pudiesen e comidas e mantenimientos porque hera ya llegado el tieenpo que dellos e dello tenía neçesidad. Todo lo qual oydo por los caçiques, como ellos tenían ansimesmo en cuydado lo que ansí les mandara quando del se partieran, luego se pusieron en camino porque ellos ya tenían junto todo aquel menester para traerlo e ansí estavan ya en camino, con todo lo qual se partieron e binieron a la çiudad del Cuzco e truxeron consigo toda la más gente que pudieron.",171
40420,"Ynga Yupangue / Pachacuti Ynga Yupangue / Pachacuti / Ynga Yupangue",4,"T44802","Y esto ansí hecho, el Ynga los salvdava diziendo que fuesen bienvenidos e preguntándoles si venían buenos e si lo estavan ansimismo en sus tierras; todo lo qual que aveys oydo hizieron estos señores caçiques con Ynga Yupangue quando delante dél se vieron; y él ansimismo les respondió e dijo lo que avéis oydo e díjoles que diesen aquello que ansí trayan a aquellos señores del Cuzco que allí estavan. E ansí se salieron de donde el Ynga estava y ellos y aquellos señores del Cuzco fueron donde los depósitos heran e pusieron todo el mantenimiento que trayan a recaudo.",172
40420,"Ynga Yupangue / Pachacuti Ynga Yupangue / Pachacuti / Ynga Yupangue",4,"T44803","Y después e se aver holgado con el Ynga e con los señores del Cuzco çinco días en sus fiestas e regozijos, Ynga Yupangue les dijo lo que pensava hazer e cómo quería reparar e fortalezer aquellas beras de aquellos dos arroyos que por la çiudad pasavan, contándoles el perjuizio que la çiudad de los tales arroyos resçebía.",172
40420,"Ynga Yupangue / Pachacuti Ynga Yupangue / Pachacuti / Ynga Yupangue",4,"T44804","E ansí Ynga Yupangue le señaló los naçimientos de los arroyos y desde dónde a él le paresçió que avía de començar los tales fortaleçimientos y reparos hasta la junta de los dos arroyos, que es el remate de la çiudad do ellos llaman Pumo [sic: Puma] Chupa, que dize cola de león. E de allí mandó que este fortaleçimiento e reparo llegase hasta Mohina, que es quatro leguas de esta çiudad. E ansí los señores caçiques midieron con sus cordeles el espaçio que avía desde el encomienço de donde les mandava Ynga Yupangue que començasen hasta la junta de los dos arroyos; e ansí medido repartieron entre sí la parte que a cada uno le cabía del edifiçio que ansí avían de hazer.",172
40420,"Ynga Yupangue / Pachacuti Ynga Yupangue / Pachacuti / Ynga Yupangue",4,"T44805","Y esto hecho, mandoles Ynga Yupangue que hiziesen traer mucha piedra tosca porque de piedra tosca avía de ser el reparo e que la mezcla que avía de entrar entre piedra, que mirasen que avían de ser de un barro pegajoso, que ya que el agua lo mojase que no lo despegase, y que antes estriben las piedras más asidas unas con otras y el agua no comiese tal mezcla. Y ansí los caçiques dieron horden en buscar el tal barro e mezcla e traer la piedra tosca que ansí les hera mandado; todo lo qual ansí traydo començaron su edifiçio.",172
40420,"Ynga Yupangue / Pachacuti Ynga Yupangue / Pachacuti / Ynga Yupangue",4,"T44806","E después de aver comido començaron a veber y después de aver bevido, el Ynga mandó sacar quatro atanbores de oro, e siendo allí en la plaça mandáronlos poner a trecho en ella e luego se asieron de las manos todos ellos, tantos a una parte como a otra; e tocando los atanbores que ansí en medio estavan enpeçaron a cantar todos juntos, començando este cantar las señoras mugeres que detrás dellos estavan, en el qual cantar dezían e declaravan la venida que Uscovilca avía venido sobre ellos e la salida de Viracocha Ynga e cómo Ynga Yupangue le avía preso e muerto diziendo que el sol le avía dado favor para ello como a su hijo e cómo después ansimismo avía desbaratado y preso e muerto a los capitanes que ansí avían hecho la junta postrera.",173
40420,"Ynga Yupangue / Pachacuti Ynga Yupangue / Pachacuti / Ynga Yupangue",4,"T44807","E después deste canto, dando en lores e graçias al sol e ansimismo a Ynga Yupangue, saludándole como a hijo del sol, se tornaron a asentar e ansimismo començaron a bever de la chicha que allí tenían, que a según ellos dizen avía muy mucha que allí tenían, que a según ellos y en muy gran cantidad; e luego les fue traydo allí muy mucha coca y repartida entre todos ellos.",173
40420,"Ynga Yupangue / Pachacuti Ynga Yupangue / Pachacuti / Ynga Yupangue",4,"T44808","Todo lo qual oydo por los señores caçiques que allí heran, dixeron a Ynga Yupangue que les plazía y holgavan de lo hazer bien ansí como el Ynga se lo avía mandado; e salidos de allí luego enbiaron a sus tierras, pueblos e provinçias […] E como allí fuese, el Ynga mandó a los prinçipales del Cuzco que la mandasen poner en los depósitos que para tal ropa ansí avían mandado hazer.",174
40420,"Ynga Yupangue / Pachacuti Ynga Yupangue / Pachacuti / Ynga Yupangue",4,"T44809","Y ansimismo les repartió e les hizo repartir el maíz e carne seca e pescado seco e obejas en pie e loça con que se sirviesen todo lo más que a él le paresçió que nesçesario les hera para tener casa cada uno dellos e lo neçesario que les hera tener en ella; y mandó que cada quatro a quatro meses se diese y repartiese a todos los del Cuzco lo qual cada uno avía menester de comida e proveymiento, visto y savido por las casas dél el número de serviçio que cada uno dellos tenía e que ansí les fuese dado el proveymiento que ansí les fuese nesçesario para sí e para su serviçio, mandando que de los depósitos se sacasen los tales bastimentos y comidas e que dellos se hiziesen en la plaça de la çiudad grandes montones de las tales comidas y de allí se les fuese repartido por su medida y quenta e razón, dando a cada uno lo que ansí uviese menester, el qual benefiçio mandó que sienpre se hiziese e durase el tieenpo que la çiudad del Cuzco fuese. Y ansí duró desde este señor Ynga Yupangue este benefiçio e proveymiento hasta que los españoles en ella entraron, con cuya entrada todo esto se perdió.",175
40420,"Ynga Yupangue / Pachacuti Ynga Yupangue / Pachacuti / Ynga Yupangue",4,"T44810","Acavado de proveher Ynga Yupangue la horden que se avía de tener en el proveymiento de la çiudad del Cuzco e su república, bolvieron los señores sus tres buenos amigos que ansí él avía enviado a casar los solteros, como ya la ystoria os a contado. E siendo ya en el Cuzco estos señores e los demás que en la çiudad heran, mandó Ynga Yupangue que todo[s] se juntasen en su casa otro día de mañana porque quería comunicar con ellos çierta fiesta uviese memoria quería constituir en ella çierta cossa que allá con ellos en su junta comunicaría.",177
40420,"Ynga Yupangue / Pachacuti Ynga Yupangue / Pachacuti / Ynga Yupangue",4,"T44811","Y otro día de mañana se juntaron estos señores en las casas del Ynga, donde comunicó con ellos la fiesta que ansí quería hazer e para que della uviese memoria para sienpre díjoles Ynga Yupangue que sería bien que en esta fiesta se hiziesen los orejones con çiertas çerimonias y ayunos, porque una cosa semejante que aquella que hera señal y ynsignia para que por toda la tierra fuesen conoçidos, desde el menor hasta el mayor de aquella çiudad, por tales señores e hijos del sol, porque le paresçía que desde allí adelante avían de ser tenidos y respectados los de aquella çiudad por los de toda la tierra más que avían sido hasta allí.",177
40420,"Ynga Yupangue / Pachacuti Ynga Yupangue / Pachacuti / Ynga Yupangue",4,"T44812","Oydo por los señores lo que Ynga Yupangue tenía hordenado, dixeron que aquello estava muy bien hordenado he pensado e que ansí se hiziese de allí adelante e que les dixe[re] que desde quándo quería que començase aquella fiesta; y él les dixo que desde allí en treynta días se podía començar porque allí entrava el mes de do prinçipiaba el año.",182
40420,"Ynga Yupangue / Pachacuti Ynga Yupangue / Pachacuti / Ynga Yupangue",4,"T44813","Pasados que fueron los diez días que Ynga Yupangue dijo a los señores que después de aquellos se juntarían con él otra vez, en la qual junta les avía de dezir la orden que ansí le pedían que hiziese del año e meses e de las demás fiestas que ellos avían de tener e guardar, Ynga Yupangue mandó juntar los señores del Cuzco que se juntasen en su casa ansí como avían hecho la otra vez.",183
40420,"Ynga Yupangue / Pachacuti Ynga Yupangue / Pachacuti / Ynga Yupangue",4,"T44814","E ya que allí fueron, Ynga Yupangue les dijo que él avía muchos años avía ymaginado los meses e tienpos del año, los quales avía hallaron que heran doze e que no pensava dezirles destos meses e tienpos cosa si no fuese bien ansí como ellos fuese entrandoy las tales fiestas que ellos en ellos avía de hazer él fuese constituyendo; mas pues que ellos se lo avían pedido que él se lo quería dezir y ansimmesmo declararles las fiestas e sacrifiçios que en los  tales meses ansí avían de hazer, que estuviesen atentos e lo tomasen bien en sus memorias.",183
40420,"Ynga Yupangue / Pachacuti Ynga Yupangue / Pachacuti / Ynga Yupangue",4,"T44815","E ansí los señores, estando atentos Ynga Yupangue, les dixo este mes que biene en el qual se han de hazer los orejones, como ya os tengo dicho, que es de donde el año comiença llamaréis pucoiquillaraimequis, que es nuestro mes de diziembre; y al mes de henero llamó hatumpocoiquis; y al mes de hebrero llamó allapocoiquis; y al mes de março llaman pachapocoiquis; y al mes de abril ayriguaquis; y al mes de mayo llaman huacaiquesquiquilla.",183
40420,"Ynga Yupangue / Pachacuti Ynga Yupangue / Pachacuti / Ynga Yupangue",4,"T44816","En este mes constituyó e mandó Ynga Yupangue que se hiziese otra fiesta al sol muy solemne, en la qual se hiziesen grandes sacrifiçios a fin de que les avía dado las tierras y el maíz que en ellas tenían y que desde que entonçes començasen a cojjer sus maízes començase la fiesta y durase hasta en fin de junio que llaman hatunquosquiquilla.",183
40420,"Ynga Yupangue / Pachacuti Ynga Yupangue / Pachacuti / Ynga Yupangue",4,"T44817","Y al mes de agosto llamó carpaiquis; y al mes de setiembre llamo situaiquis. En este mes dizen que constituyó Ynga Yupangue que se hiziesen dos fiestas, la una que casi quiere paresçer a la que nos hazemos de Sant Juan, porque se lebantan a medianoche y se laban hasta que ríe el día y llevan çiertos hachos ençendidos y después de ser lavados danse con estos hachos en las espaldas y dizen que hechan de sí toda dolençia e mal que tengan.",184
40420,"Ynga Yupangue / Pachacuti Ynga Yupangue / Pachacuti / Ynga Yupangue",4,"T44818","E la otra fiesta es que llamó esta Ynga Yupangue, poray upia, ansimesmo la hazían e mandó hazer en este mes, la qual mandó que se hiziese a las aguas e que ansimismo las hiziesen sacrifiçio y en este sacrifiçio mandó que se ofreçiese mucha ropa y obejas y coca y que todas quantas yerbas y plantas que avía en los canpos truxesen las flores de ellos.",184
40420,"Ynga Yupangue / Pachacuti Ynga Yupangue / Pachacuti / Ynga Yupangue",4,"T44819","E ansimismo mandó Ynga Yupangue que quando este sacrifiçio se hiziese fuesen dos señores del Cuzco, yendo el uno por la una parte del río y el otro por la otra, los quales llevasen consigo cada uno por sí a cada diez yndios e los que más quisiese, los queles [sic] yndios llevasen unos palos largos en las manos para que si las tales cosas que fueron sacrificadas en el río se parasen en alguna vera dél, los yndios con sus palos las hechasen al medio para que las aguas las llevasen; e que estos señores que estos yndios llevasen para que hechasen al medio del río las tales cosas e sacrifiçios fuesen por las beras del río treinte [sic] leguas el río abaxo porque en parte ninguna no parasen.",185
40420,"Ynga Yupangue / Pachacuti Ynga Yupangue / Pachacuti / Ynga Yupangue",4,"T44820","Al mes de nobienbre llamó este señor cantaraiquis. En este mes comiença a hazer la chicha que an de bever en el mes de diziembre y henero, do comienza el año y hazen la fiesta de los orejones, según que la ystoria os a contado, a los quales meses Ynga Yupangue nombró en la manera que ya avéis oydo.",186
40420,"Ynga Yupangue / Pachacuti Ynga Yupangue / Pachacuti / Ynga Yupangue",4,"T44821","Y quando el sol salía, estando uno puesto do Ynga Yupangue se paró para mirar e tantear este derecho sale y ba por el derecho y medio destos dos pilares; y quando se pone lo mismo por la parte do se pone, por donde la gente común tenían entendimiento del tieenpo que hera así de senbrar como de cojer, porque los relojes heran quatro a do el sol salía y otros quatro a do se ponía, do se diferençiavan los transcursos y movimientos que ansí el sol haze en el año.",186
40420,"Ynga Yupangue / Pachacuti Ynga Yupangue / Pachacuti / Ynga Yupangue",4,"T44822","E herrose Ynga Yupangue en el tomar del mes para que biniera a nuestra quenta los meses del año que ansí señaló, porque tomó de diziembre aviendo de tomar henero, mas al fin él supo entenderse y dar horden a su república.",186
40420,"Ynga Yupangue / Pachacuti Ynga Yupangue / Pachacuti / Ynga Yupangue",4,"T44823","Después que Ynga Yupangue uvo hecho e dado horden en el año e meses e fiestas que en él se avían de çelebrar e hechos los relojes e aviéndose recreado e holgado en las cosas que ya avéis aydo tieenpo y espaçio de dos años, el qual tieenpo gastó este señor en estarse en su pueblo porque los naturales e caçiques que a él estavan subjetos tuviesen espaçio e tieenpo para holgarse en sus tierras del travajo que avían pasado y en el reparo que ansí avían hecho en los arroyos de la çiudad del Cuzco; e porque ansí tuviesen espaçio e tieenpo  de senbrar e cojer grandes sementeras con las quales se reparasen de comidas e todos proveymientos e tuviesen con que poder servir e contribuir a la çiudad del Cuzco y a los depósitos que en ella heran.",187
40420,"Ynga Yupangue / Pachacuti Ynga Yupangue / Pachacuti / Ynga Yupangue",4,"T44824","E Ynga Yupangue e los demás señores que allí quedaron, salidos que fueron de su consulta, fueron por todo el torno de la çiudad en çinco leguas, en el qual espaçio buscaron e miraron do uviese sierras e sitios do se pudiese sacar piedras e cantería e barro e tierras para hazer las mezclas que los tales edifiçios avían de llevar, donde hallaron que en el sitio de Sa...[¿?] avía mucha e muy gran cantidad de piedra e muy grandes canteras.",187-188
40420,"Ynga Yupangue / Pachacuti Ynga Yupangue / Pachacuti / Ynga Yupangue",4,"T44825","Y luego que esto ansí fuese hecho, Ynga Yupangue traçó la çiudad e hizo hazer de figuras de barro bien ansí como él la pensava hazer y edificar. E luego que esto fue hecho, llegaron en aquella sazón en tieenpo aquellos orejones señores que avían ydo a hazer traer proveymiento e comida e cantidad e suma de gente para hazer los tales edifiçios, como ya la ystoria os a contado, e como ansí llegasen los caçiques saludaron al Ynga en la manera que ya os diximos y el Ynga les resçibió con entrañable amor, con los quales le pareçió que sería bien holgarse çinco días y ansí fue hecho.",188
