"id_palabra","Palabra","id_cronista","id_texto","cita","pagina"
18162,"Guaca / Guacas ",18,"T18404","La quinta <strong>guaca</strong> era otra casa dicha <italic>Pomacorco</italic> y no dan otra razón de sacrificar en ella más que haber sido de <italic>Guaynacápac</italic>.",6
18162,"Guaca / Guacas ",18,"T18405","La sexta <strong>guaca</strong> se llamaba <italic>Molloguanca</italic>: era  cierta piedra que estaba en medio de un llano que llamaban <italic>Calispuquio</italic>, la cual mandó poner allí y tenerla por <italic>adoratorio</italic> <italic>Inca Yupanqui</italic>.",7
18162,"Guaca / Guacas ",18,"T18406","La sétima <strong>guaca</strong> era la casa que fue del rey <italic>Tupa Inca</italic> llamada <italic>Calispuquioguaci</italic>, en que se ofrecían <italic>sacrificios</italic> al dicho <italic>Tupa Inca</italic>.",7
18162,"Guaca / Guacas ",18,"T18407","La octava <strong>guaca</strong> era una fuente que se decía <italic>Calispúquio</italic>, que estaba debajo de la dicha casa de <italic>Tupa Inca</italic>, y se iban a lavar en ella todos los que hacían <italic>orejones</italic> en la fiesta del <italic>Raymi</italic>.",7
18162,"Guaca / Guacas ",18,"T18408","La novena <strong>guaca</strong> se llamaba <italic>Cugiguaman</italic>: era una piedra a manera de Halcón, que dijo <italic>Inca Yupanqui</italic> habérsele aparecido en una cantera, y mando que se pusiese en este <italic>ceque</italic>. ",7
18162,"Guaca / Guacas ",18,"T18409","La décima <strong>guaca</strong> deste <italic>ceque</italic> era una fontezuela dicha <italic>Quinoapúquio</italic>, que señaló por adoratorio <italic>Inca Yupanqui</italic>: ofreciansele <italic>sacrificios</italic> por la salud del <italic>Inca</italic>.",7
18162,"Guaca / Guacas ",18,"T18410","Al cuarto ceque llamaban <italic>Payao</italic>; tenía ocho <strong>guacas</strong>, de las cuales la primera se decía <italic>Araytampu</italic>; era una piedra grande con otras cuatro pequeñas, que estaban junto a la casa que fue de Benito de la Peña, y eran de los <italic>Pururaucas</italic>.",7
18162,"Guaca / Guacas ",18,"T18411","La segunda <strong>guaca</strong> se llamaba <italic>Puñui</italic>: estaba en un llano pequeño junto a la casa de Diego Maldonado. Fue <italic>adoratorio</italic> muy solemne, porque era tenido por causa del sueño; ofrecíanle todo género de <italic>sacrificios</italic>. ",7
18162,"Guaca / Guacas ",18,"T18412","La tercera <strong>guaca</strong> se llamaba <italic>Curiocllo</italic>; era una casa de <italic>Curi Ocllo</italic>, mujer que fue de <italic>Amaro Topa Inca</italic> la cual esta en <italic>Colcapata</italic>.",7_8
18162,"Guaca / Guacas ",18,"T18413","La cuarta <strong>guaca</strong> se llamaba <italic>Colcapata</italic>; y era la casa de <italic>Paullo Inca</italic>, donde estaba una piedra por <italic>ídolo</italic>, que adoraba el <italic>ayllo</italic> de <italic>Andasaya</italic>; y el origen que tuvo fue haberla mandado adorar <italic>Pachacutic Inca</italic>.",8
18162,"Guaca / Guacas ",18,"T18414","La quinta <strong>guaca</strong> se decía <italic>Guamancancha</italic>, la cual estaba cabe [sic] la <italic>fortaleza</italic> en un cerrillo deste nombre , era un cercado dentro del cual había dos <italic>Buhios</italic> pequeños diputados para ayunar cuando se hacian <italic>orejones</italic>.",8
18162,"Guaca / Guacas ",18,"T18415","La sexta <strong>guaca</strong> era una piedra grande llamada <italic>Collaconcho</italic>, que estaba en la <italic>fortaleza</italic>, la cual afirman que, trayéndola para aquel edificio, se les cayó tres veces y mató algunos indios; y los <italic>hechiceros</italic>, en preguntas que le hicieron, dijeron haber respondido, que, si porfiaban en querella poner en el <italic>edificio</italic> todos habrian mal fin, allende de que no serían parte para ello; y desde aquel tiempo fue tenida por <italic>guaca</italic> General. ",8
18162,"Guaca / Guacas ",18,"T18416","La sétima <strong>guaca</strong> se decía <italic>Chachacomacaja<italic>: eran ciertos árboles puestos a mano, junto a los cuales estaba una piedra a quien hacían sacrificio porque el <italic>Inca</italic> no tuviese ira.",8
18162,"Guaca / Guacas ",18,"T18417","La octava y última <strong>guaca</strong> desde <italic>ceque</italic> era un cerro alto llamado <italic>Chuquipalpa</italic>, que esta junto a la <italic>fortaleza</italic>, en el cual estaban puestas tres piedras en representación del <italic>Pachayachachic</italic>, <italic>Intiillapa</italic> y <italic>Punchao</italic>; y en este cerro se hacia sacrificio universal de niños y niñas y figuras pequeñas de lo mismo hechas de oro.",8
18162,"Guaca / Guacas ",18,"T18418","El quinto <italic>ceque</italic> deste mismo camino y rumbo de <italic>Chinchaysuyu</italic> se decia <italic>Cayao</italic>; contenía diez <strong>guacas</strong>: la primera, llamada <italic>Cusicancha</italic>, era el lugar donde nació <italic>Inca- Yupanqui</italic>, frontero del templo de <italic>Coricancha</italic>; y por esta razón ofrecían allí los del <italic>ayllu</italic> <italic>Inacapanaca</italic>.",8_9
18162,"Guaca / Guacas ",18,"T18419","La segunda <strong>guaca</strong> era un templo llamado <italic>Pucamarca</italic>, que estaba en las casas que fueron del licenciado de la Gama; en la cual estaba un <italic>ídolo</italic> del Trueno, dicho <italic>Chucuylla</italic>.",9
18162,"Guaca / Guacas ",18,"T18420","la tercera <strong>guaca</strong> se decía <italic>Cuzocalla</italic>: estaba en la calle que sale a la plaza yendo por esta raya o <italic>ceque</italic>, era buena cantidad de piedras, que todas decian ser de los <italic>pururaucas</italic>.",9
18162,"Guaca / Guacas ",18,"T18421","La cuarta <strong>guaca</strong> era la plaza principal, llamada <italic>Aucaypata</italic>, que al presente tambien lo es. En ella se hacia el sacrificio universal para el Sol y las demás <strong>guaca</strong>, y se repartían y llevaban a las otras partes del reino, y era lugar muy venerado.",9
18162,"Guaca / Guacas ",18,"T18422","La Quinta <strong>guaca</strong> era un buhiho llamado <italic>Coracora</italic>, en que dormía <italic>Inca-Yupanqui</italic>, que es donde ahora están las casas de Cabildo. ",9
18162,"Guaca / Guacas ",18,"T18423","La sexta <strong>guaca</strong> se llamaba <italic>Sabacurinca</italic>: era un asiento bien labrado, donde se sentaban los <italic>Incas</italic>; el cual fue muy venerado, y se le hacían solemnes <italic>sacrificios</italic> y por el respeto deste asiento se adoraba toda la <italic>fortaleza</italic>.",9
18162,"Guaca / Guacas ",18,"T18424","La sétima <strong>guaca</strong> se llamaba  <italic>Chacaguanacauri</italic>; la cual es un cerrillo que esta camino a <italic>Yucay<italic>, a donde iban los mancebos que se armaban <italic>orejones</italic> por cierta paja que llevaban en las lanzas.",9
18162,"Guaca / Guacas ",18,"T18425","La octava <strong>guaca</strong> era una sepultura pequeña, llamada <italic>Guamanguachanca</italic>, de un hermano de <italic>Guaynacápac</italic>, la cual estaba de la otra parte de la <italic>fortaleza</italic>. Hiciéronla adoratorio por haber muerto pequeño el hermano del <italic>Inca</italic>.",10
18162,"Guaca / Guacas ",18,"T18426","La novena <strong>guaca</strong> era un cerro que esta camino del valle de <italic>Yucay</italic>, llamado <italic>Cinca</italic>, en que habia una piedra que adoraban los indios de <italic>Ayamarca</italic>, teniendo opinión que procedian della.",10
18162,"Guaca / Guacas ",18,"T18427","La décima <strong>guaca</strong> era un <italic>puquio</italic> o manantial llamado <italic>Corcorpuquio</italic>, en el cual se ofrecian niños y todo lo demás.",10
18162,"Guaca / Guacas ",18,"T18428","El sexto <italic>seque</italic> se decia <italic>Collana</italic>, como el tercero y tenía once <strong>guacas</strong>: la primera se decia <italic>Canlonge</italic>, y era una piedra de los <italic>Pururaucas</italic>, que estaba en una ventana junto del templo del sol.",10
18162,"Guaca / Guacas ",18,"T18429","La segunda <strong>guaca</strong> se llamaba <italic>Pucamarca</italic>: era una casa o templo diputado para los <italic>sacrificios</italic> del <italic>Pachayachachic</italic>, en el cual se sacrificaban niños y todo lo demás.",10
18162,"Guaca / Guacas ",18,"T18430","La tercera <strong>guaca</strong> se decía <italic>Ñan</italic> que quiere decir camino: estaba en la plaza donde se tomaba el camino para <italic>Chinchaysuyo</italic>: haciase en ella sacrificio universal por los caminantes y porque aquel camino estuviese siempre entero.",10
18162,"Guaca / Guacas ",18,"T18431","La cuarta <strong>guaca</strong> tenía por nombre <italic>Guayra</italic>, y estaba en la puerta de <italic>Cajana</italic> en ella se hacían <italic>sacrificios</italic> al viento para que no hiciese daño.",10
18162,"Guaca / Guacas ",18,"T18432","La quinta <strong>guaca</strong> era el palacio de <italic>Guaynacápac</italic> llamado Cajana, dentro del cual habia una laguna nombrada <italic>Ticcicocha</italic>, que era <italic>adoratorio</italic> principal y a donde hacían grandes <italic>sacrificios</italic>.",10
18162,"Guaca / Guacas ",18,"T18433","La sexta <strong>guaca</strong> era una fuente llamada <italic>Capipachan</italic> que esta en <italic>Capi</italic>, en la cual solia bañar el <italic>Inca</italic>; hacianse en ella <italic>sacrificios</italic>.",11
18162,"Guaca / Guacas ",18,"T18434","La sétima <strong>guaca</strong> se decia <italic>Capi</italic>, que significa raíz; era una raíz muy grande de <italic>quinua</italic>, la cual decían los <italic>hechiceros</italic> que era la raíz de donde procedía el <italic>Cuzco</italic>.",11
18162,"Guaca / Guacas ",18,"T18435","La novena <strong>guaca</strong> era un cerro llamado <italic>Qiangalla</italic>, que esta en el camino de <italic>Yucay</italic>, donde estan dos mojones o pilares que tenían por señales que, llegando allí el Sol, era el principio del verano.",11
18162,"Guaca / Guacas ",18,"T18436","La décima era una fontezuela que se decía <italic>Guargua Illapúquio</italic>, y está junto a este cerro, en que echaban el polvo que sobraba de los <italic>sacrificios</italic> de las <strong>guacas</strong> deste <italic>ceque</italic>.",11
18162,"Guaca / Guacas ",18,"T18437","La undécima <strong>guaca</strong> se decía <italic>Illacamarca</italic>, estaba en una <italic>fortaleza</italic> que habia edificado en una peña camino de <italic>Yucay</italic>.",11
18162,"Guaca / Guacas ",18,"T18438","El sétimo <italic>ceque</italic> se decía <italic>Callao</italic>, y era del <italic>ayllo</italic> de <italic>Capacayllo</italic>: tenía las ocho <strong>guaca</strong>s que se siguen: La primera se llamaba <italic>Omanaman</italic>, y era una piedra larga que decían ser de los <italic>Pururaucas</italic>, la cual estaba a la puerta de la casa que fue de Figueroa. ",11
18162,"Guaca / Guacas ",18,"T18439","La segunda <strong>guaca</strong> eran dos <italic>buhios</italic> pequeños, llamados <italic>Sancacancha</italic> el uno, y el otro <italic>Hurisanca</italic>, donde tenían cantidad de leones, tigres, culebras y de todas las malas sabandijas. En estos <italic>buhios</italic> metían a los prisioneros que traian de la guerra.",12
18162,"Guaca / Guacas ",18,"T18440","La tercera <strong>guaca</strong> se decía <italic>Marcatampu</italic>: eran unas piedras redondas que estaban en <italic>Carmenga</italic>, de donde ahora es la parroquia de Santa Ana, las cuales señaló por <italic>adoratorio</italic> principal <italic>Inca Yupanqui</italic>.",12
18162,"Guaca / Guacas ",18,"T18441","La cuarta se llamaba <italic>Toxanamaro</italic>: eran cinco piedras redondas que <italic>Viracocha - Inca</italic> mando poner en el cerro de <italic>Toxan</italic>, que esta encima de <italic>Carmenga</italic>. La ofrenda que le daban era solamente de conchas partidas. Rogabase a esta <strong>guaca</strong> por la victoria del <italic>Inca</italic>.",12
18162,"Guaca / Guacas ",18,"T18442","La quinta <strong>guaca</strong> deste <italic>ceque</italic> llamaban <italic>Urcoslla amaro</italic>: era muchas piedras juntas puestas en un cerrillo que esta encima de <italic>Carmenga</italic>; haciensele <italic>sacrificios</italic> por la salud del <italic>Inca</italic>.",12
18162,"Guaca / Guacas ",18,"T18443","La sexta <strong>guaca</strong> se decía <italic>Callancapúquio</italic>: es el manantial de <italic>Ticatica</italic>, al cual ofrecian conchas porque siempre manase.",12
18162,"Guaca / Guacas ",18,"T18444","La séptima <strong>guaca</strong> se decía <italic>Churuncana</italic>; es un cerro redondo que está encima de <italic>Carmenga</italic>, donde se parte el camino Real de <italic>chinchero</italic> del de <italic>Yucay</italic>. Desde este cerro se hacian <italic>sacrificios</italic> a <italic>Ticciviracocha</italic>.",12
18162,"Guaca / Guacas ",18,"T18445","La octava <strong>guaca</strong> deste <italic>seque</italic> era una fuente llamada <italic>Muchaylla puquio</italic>, que está cerca de <italic>Guarguailla</italic>.  ",12_13
18162,"Guaca / Guacas ",18,"T18446","El octavo <italic>seque</italic> deste camino [sic] se decia <italic>Payan</italic> como el segundo, y habia en el trece <strong>guacas</strong>. La primera era una casa pequeña junto al templo del sol, llamada <italic>Illanguarque</italic>, en que se guardaban ciertas armas que decian haberlas dado el Sola á [sic] <italic>Inca-Yupanqui</italic>, con que venció a sus enemigos. ",13
18162,"Guaca / Guacas ",18,"T18447","La tercera <strong>guaca</strong> era una fuente llamada <italic>Aasaipata</italic>, que estaba junto á donde ahora es la casa de Cabildo, en la cual decian los sacerdotes de <italic>Chuncuilla</italic> que se bañaba el Trueno.",13
18162,"Guaca / Guacas ",18,"T18448","La cuarta <strong>guaca</strong> decia <italic>Cugilalis</italic>: era un llano donde se edificó la Casa de Garcilaso. El origen cuentan haber sido que durmiendo alli <italic>Huayna-Cápac</italic>, soñó que venia cierta guerra.",13
18162,"Guaca / Guacas ",18,"T18449","La quinta <strong>guaca</strong> era una <italic>chácra</italic> llamada <italic>Chaguaytapra</italic>, que estaba en <italic>Carmenga</italic> y que fué de <italic>Amaro-Tupa Inca</italic>.",13
18162,"Guaca / Guacas ",18,"T18450","La octava <strong>guaca</strong> era una casa dicha <italic>Mamararoy</italic>, en que eran venerados ciertas piedras que decian fueron mujeres de <italic>Ticci-Viracocha</italic>, y que hallándose en a aquel lugar.",14
18162,"Guaca / Guacas ",18,"T18451","La novena <strong>guaca</strong> se decia <italic>Urcoscalla</italic>. Era el lugar donde perdian de vista la ciudad del <italic>Cuzco</italic> los que caminaban a <italic>Chinchaysuyu</italic>.",14
18162,"Guaca / Guacas ",18,"T18452","La décima <strong>guaca</strong> se decia <italic>Catachillay</italic>. Es una fuente que está en el primer llano que abaja al camino de <italic>Chinchaysuyu</italic>.",14
18162,"Guaca / Guacas ",18,"T18453","La undécima <strong>guaca</strong> era otra fuente junto a la de arriba, que se dice <italic>Aspadquirí</italic>, a la cual mandó sacrificar <italic>Inca-Yupanqui</italic>.",14
18162,"Guaca / Guacas ",18,"T18454","La duodécima <strong>guaca</strong> era otra fuente  llamada <italic>Poroypúquiu</italic> que ésta junto al molino que fue de Juan Julio.",14
18162,"Guaca / Guacas ",18,"T18455","La postrera <strong>guaca</strong> deste <italic>ceque</italic> se decia <italic>Collana Sayba</italic>: era un mojón que esta en un cerro al principio de <italic>Sicllabamba</italic> por fin y termino de las <italic>guacas</italic> deste <italic>ceque</italic>.",14
18162,"Guaca / Guacas ",18,"T18456","El noveno y último <italic>ceque</italic> de este dicho camino de <italic>Chinchaysuyu</italic> se llamaba <italic>Cápac</italic>, y tenía doce <strong>guacas</strong>. La primera era una fuente dicha <italic>Aypanospacha</italic>, que estaba en la calle de Pedro Alonso Carrasco.",14
18162,"Guaca / Guacas ",18,"T18457","La cuarta <strong>guaca</strong> era una fuente llamada <italic>Pomacucho</italic> que estaba algo apartada deste <italic>ceque</italic>: ofrecianle conchas.",15
18162,"Guaca / Guacas ",18,"T18458","La sexta <strong>guaca</strong> era una piedra llamada <italic>Apuyovira</italic> que estaba sobre el cerro de <italic>Piccho<italic>: teniendo creido que era uno de aquellos que salieron de la tierra con <italic>Huanacauri</italic>, y que después de haber vivido mucho tiempo, se subio alli y se volvió piedra; á la cual iban á adorar todos los <italic>ayllus</italic> en la fiesta del <italic>Raymi</italic>.",15
18162,"Guaca / Guacas ",18,"T18459","La novena <strong>guaca</strong> se decia <italic>Quishuarpúquio</italic>: era un manantial en que decían haber bebido la gente del <italic>Inca</italic> acabada la batalla de arriba.",15
18162,"Guaca / Guacas ",18,"T18460","La duodécima y postrero <strong>guaca</strong> deste <italic>ceque</italic> era una fuente llamada <italic>Totorgo aylla</italic>: aquí se acababan las <italic>guacas</italic> de los nueve <italic>ceques</italic> del camino de <italic>Chinchaysuyu</italic>, que por todas venian á ser ochenta y cinco.",15_16
18162,"Guaca / Guacas ",18,"T18461","Tenía el camino de <italic>Antisuyu</italic> nueve <italic>ceques</italic> y en ellos setenta y ocho <strong>guacas</strong>, por este-orden. El primer <italic>ceque</italic> se llamaba <italic>Collana</italic>, y estaba á cargo del <italic>ayllu</italic> de <italic>Cubcupañacaayllu</italic>.",16
18162,"Guaca / Guacas ",18,"T18462","La primera <strong>guaca</strong> se decía <italic>Chiquinopampa</italic>: era un cercado que estaba junto al templo del sol, en el cual se hacia el sacrificio por la salud universal de los indios.",16
18162,"Guaca / Guacas ",18,"T18463","La segunda <strong>guaca</strong> se decía <italic>Turuca</italic>: era una piedra caso redonda que estaba junto al dicho templo del sol, en una ventana, la cual decian que era <italic>Guáque de Ticciviracocha</italic>.",16
18162,"Guaca / Guacas ",18,"T18464","La tercera <strong>guaca</strong> era una piedra grande llamada <italic>Chiripacha</italic>, que estaba en el principio del camino de <italic>Collasuyu</italic>.",16
18162,"Guaca / Guacas ",18,"T18465","La sétima <strong>guaca</strong> se decía <italic>Amaromarcaguaci</italic>: esta era casa de <italic>Amaro-Tupa-Inca</italic>, que estaba en el camino de los <italic>Andes</italic>.",17
18162,"Guaca / Guacas ",18,"T18466","La séptima <strong>guaca</strong> tenía por nombre <italic>Timpuqpúquio</italic>: era una fuente que está cerca de <italic>Tambomachay</italic>. Llámase así porque mana de modo que hierve el agua.",17
18162,"Guaca / Guacas ",18,"T18467","La décima <strong>guaca</strong> se decia <italic>Quinoapúquio</italic>; era una fuente cabe <italic>Tambomachay</italic> que se compone de dos manantiales.",17
18162,"Guaca / Guacas ",18,"T18468","La postrera <strong>guaca</strong> deste <italic>ceque</italic> se decia <italic>Quiscourco</italic>: era una piedra redonda no <italic>muyu</italic> grande, que servía de término y mojón destas <italic>guacas</italic>.",17
18162,"Guaca / Guacas ",18,"T18469","El segundo <italic>ceque</italic> del dicho camino de <italic>Antisuyu</italic> se decia <italic>Payan</italic>, y tenia diez <strong>guacas</strong>. La primera era un lugar llamado <italic>Vilcacona</italic>, donde se edificó la casa que fue de Juan Salas.",17
18162,"Guaca / Guacas ",18,"T18470","La segunda <strong>guaca</strong> se llamaba <italic>Pachatosa</italic> era una piedra grande que estaba junto á la casa de <italic>Cayo</italic>. ",17_18
18162,"Guaca / Guacas ",18,"T18471","La tercera <strong>guaca</strong> se decia <italic>Chusacachi</italic>: es un cerro grande, camino de los <italic>Andes</italic>, encima del cual estaban ciertas piedras que eran adoradas. ",18
18162,"Guaca / Guacas ",18,"T18472","La quinta <strong>guaca</strong> era llamada <italic>Sunchupúquio</italic>: era un <italic>adoratorio</italic> que estaba junto á la ladera de un cerro así llamado.",18
18162,"Guaca / Guacas ",18,"T18473","La octava <strong>guaca</strong> se decía <italic>Púquio</italic>: era una fuente que está de ese cabo de <italic>Tambomachay</italic>.",19
18162,"Guaca / Guacas ",18,"T18474","La novena se llamaba <italic>Cascasayba</italic>: eran ciertas piedras que estaban en el cerro de <italic>Quisco</italic>. Era <strong>guaca</strong> principal y tenia cierto origen largo.",19
18162,"Guaca / Guacas ",18,"T18475","La segunda <strong>guaca</strong> era una Pared que estaba junto á la <italic>chácra</italic> de Bachicao, que tenía una barriga hacia afuera, cuyo origen decían haber sido que, pasando por allí el <italic>Inca</italic>, había salido á hacerle reverencia.",19
18162,"Guaca / Guacas ",18,"T18476","La quinta <strong>guaca</strong> se decia <italic>Mantocallaspa</italic>; era una fuente de buen agua, que está en el cerro sobredicho.",20
18162,"Guaca / Guacas ",18,"T18477","La séptima <strong>guaca</strong> se llamaba <italic>Curipúquiu</italic>; era una fuente que está en la falda del cerro dicho.",20
18162,"Guaca / Guacas ",18,"T18478","La novena <strong>guaca</strong> se nombraba <italic>Yuncaycalla</italic>: es como puerta donde se ve el llano de <italic>Chila</italic> y se pierde la vista del <italic>Cuzco</italic>.",20
18162,"Guaca / Guacas ",18,"T18479","La última <strong>guaca</strong> deste <italic>ceque</italic> era una fuente dicha <italic>Urcomilpo</italic>, que está en el llano grande de Chila. ",20
18162,"Guaca / Guacas ",18,"T18480","El cuarto <italic>ceque</italic> deste dicho camino se decia <italic>Collana</italic>: era del <italic>ayllu</italic> y familia de <italic>Aucailli panaca</italic>, y tenia siete <strong>guacas</strong>. La primera se llamaba <italic>Cariurco</italic>, y era un cerro que está cerca de <italic>Mantocalla</italic>, encima del cual había ciertas piedras que eran veneradas y les ofrecían ropa y carneros manchados.",20
18162,"Guaca / Guacas ",18,"T18481","La décima <strong>guaca</strong> se llamaba <italic>Chuquiquirao Púquio</italic>: era una fuente que nace en una quebrada en la falda del cerro sobredicho.",21
18162,"Guaca / Guacas ",18,"T18482","La tercera <strong>guaca</strong> se decía <italic>Callachaca</italic>: eran ciertas piedras puestas sobre el dicho cerro.",21
18162,"Guaca / Guacas ",18,"T18483","La sexta <strong>guaca</strong> se decía <italic>Illansayba</italic>: era cierto cerro encima del cual habia unas piedras á que sacrificaban por la salud de los que entraban en la <italic>provincia</italic> de los <italic>Andes</italic>.",21
18162,"Guaca / Guacas ",18,"T18484","La postrera <strong>guaca</strong> deste <italic>ceque</italic> era una piedra llamada <italic>Maychaguanacauri</italic>, hecha a manera del cerro <italic>Huanacauri</italic>, que se mandó poner en este camino de <italic>Antisuyu</italic>.",21
18162,"Guaca / Guacas ",18,"T18485","El quinto <italic>ceque</italic> tenía por nombre <italic>Payan</italic>, en que habia diez <strong>guacas</strong>. La primera era una piedra llamada <italic>Usno</italic>, que estaba en la plaza de <italic>Hurinaucaypata</italic>: era ésta la primera <italic>guaca</italic> á quien ofrecian los que se hacían <italic>orejones</italic>.",21
18162,"Guaca / Guacas ",18,"T18486","La segunda <strong>guaca</strong> era el manantial llamado <italic>Cachipúquio</italic>, que está en las salinas, de que se hace mucha y muy fina sal.",21
18162,"Guaca / Guacas ",18,"T18487","La quinta <strong>guaca</strong> se decia <italic>Oyaraypúquiu</italic>: era una fontezuela que está algo mas arriba.",21_22
18162,"Guaca / Guacas ",18,"T18488","La séptima se decia <italic>Aquarsayua</italic>: era <strong>guaca</strong> de gran veneración, y tenían por opinión que cualquiera cosa que le ofrecian la recibian todas las <italic>guacas</italic>.",22
18162,"Guaca / Guacas ",18,"T18489","La décima y última <strong>guaca</strong> deste <italic>ceque</italic> era otra piedra llamada <italic>Pomaurco</italic>, que estaba puesta por fin y término de las <italic>guacas</italic> deste <italic>ceque</italic>.",22
18162,"Guaca / Guacas ",18,"T18490","El sexto <italic>ceque</italic> se llamaba <italic>Cayao</italic>, y en él había siete <strong>guacas</strong>. La primera se decia <italic>Auriaca</italic>: era como un portal ó ramada que estaba junto al templo del Sol.",22
18162,"Guaca / Guacas ",18,"T18491","La segunda <strong>guaca</strong> era una piedra corva llamada <italic>Comovilca</italic>; que estaba cabe <italic>Collachaca</italic>.",22
18162,"Guaca / Guacas ",18,"T18492","La séptima se decía <italic>Curavacaja</italic>: es un altozano, camino de <italic>Chila</italic>, donde se pierde de vista la ciudad, y estaba señalado por fin y mojón de las <strong>guacas</strong> deste <italic>ceque</italic>.",23
18162,"Guaca / Guacas ",18,"T18493","En el séptimo <italic>ceque</italic> llamado <italic>Yacanora</italic>, habia otras siete <strong>guacas</strong>. La primera se decía <italic>Ayllipampa</italic>: era un llano donde está la <italic>chácra</italic> que fue de Mesa. Decian que era la diosa Tierra llamada <italic>Pachamama</italic>.",23
18162,"Guaca / Guacas ",18,"T18494","La segunda <strong>guaca</strong> era una fontezuela junto á esta <italic>chácra</italic>, llamada <italic>Guamantanta</italic>: ofrecíase en ella lo ordinario.",23
18162,"Guaca / Guacas ",18,"T18495","La <strong>guaca</strong> se decía <italic>Cuirllurpúquiu</italic>: era un manantial pequeño que está mas abajo.",23
