"id_palabra","Palabra","id_cronista","id_texto","cita","pagina"
40414,"Ynga / Yngas",4,"T44583","Y los españoles escaramuçaron un poco un cavallo allí delante del Ynga y haziendo al Ynga una manera de cortesía, abajando las cabeças de salieron diziendo al Ynga que otro día le esperavan en Caxamalca y ansí se partieron de donde el Ynga estava, sus lanças en las manos.",392
40414,"Ynga / Yngas",4,"T44584","Y pasado que uvieron el arroyo, como se viesen en la otra parte en lo llano, escaramuçearon los cavallos todos juntos y corriéronlos, todo lo qual mirava el Ynga desde çierta bentana desde la otra parte.",393
40414,"Ynga / Yngas",4,"T44585","Y dejarlo hemos aquí al Ynga y hablaremos de cómo bolvió el capitán al Marqués y de lo que el Marqués hizo tenida razón de lo que pasava.",393
40414,"Ynga / Yngas",4,"T44586","Como bolviese aquel capitán a Caxamalca de buelta de averse visto con el Ynga, el qual como partiese de los baños donde al Ynga dejava después de averle passado con él lo que avéis oydo, llegó a Caxamalca donde halló al Marqués, que estava esperando al Ynga, y como llegase aquel capitán contole lo que le avía passado con el Ynga y la gran gravedad que mostrava y que no avía querido venir con él y que le dijo que otro día bernía.",395
40414,"Ynga / Yngas",4,"T44587","Y el Marqués le preguntó al capitán que qué arte y aspecto de hombre tenía el Ynga. El capitán le dijo que le paresçía hombre de treinta años y que se demostró con gran magestad y que hera tanta su gravedad que no avía querido hablar con él sino por terçera persona, que lo que ansí habló con ellos que le dezía él allí a un capitán suyo, aunque ellos estavan allí junto con él y que aquel capitán le dezía a la lengua y la lengua se lo dezía a ellos; y que quando ansí hablava, que mostrava un rostro muy sereno y las palabras muy graves, y que esto avía entendido que hera su usança de hablar por terçera persona con quien con él negoçiava. El Marqués le preguntó qué que gente tenía el Ynga.",395
40414,"Ynga / Yngas",4,"T44588","Y dejarle hemos aquí y hablaremos del Ynga Atagualpa, el qual como uviese visto a los españoles y uviese visto al escaramuçear y correr de los cavallos y la ligereza dellos yendo los españoles ençima dellos, túbolo a gran admiraçión y mandó que luego se juntasen todos sus capitanes en çierto aposento para comunicar con ellos lo que devía de hazer y ansí se juntaron.",396
40414,"Ynga / Yngas",4,"T44589","Y siendo en su acuerdo mandó el Ynga que çiquinchara entrase allí para que les dijese lo que avían entendido de los españoles, para que conforme a lo que aquél les dijese como hombre que avía venido con ellos desde Tangaralá y los conoçía.",396
40414,"Ynga / Yngas",4,"T44590","Y el çiquinchara entró en el acuerdo y el Ynga mandó a sus capitanes que le preguntasen qué sentía de aquella gente y qué hera lo que con ella le avía passado y si avía visto, viniendo en conpañía dellos, que uviesen hecho algún milagro por donde se pudiesen conosçer que heran dioses porque posible sería que lo fuesen y como viesen que no les davan aquella obediençia que ellos quisiesen, que podría ser que enojados desto, siendo dioses, que les hiziesen algún mal o daño y los destruyesen y biniesen en disminuçión y perdimiento.",396
40414,"Ynga / Yngas",4,"T44591","Oydo que fue por çiquinchara la ynterrogaçión y pregunta que le avían hecho aquellos señores bien ansí como el Ynga se lo avía dicho a ellos que se lo preguntasen, considerando el traydor que la pujança de gente que el Ynga tenía hera grande y que los españoles heran pocos y que serían muertos y pressos por la gran multitud de los yndios; y, aunque el Ynga estava admirado de le ver correr los cavallos, el traidor no lo estava porque los avía visto correr muchas bezes en el camino viniendo en compañía dellos y por otras muy muchas cossas que avía procurado saber de los yndios y lenguas que benían en compañía de los españoles.",396
40414,"Ynga / Yngas",4,"T44592","Preguntáronme cómo se llamava, déjeles que çapa Ynga Atagualpa y como esto les dijese, vi que se avían holgado mucho y consideré que si fueran dioses que no me preguntaran que avía acá arriba y si avía mucha gente o poca, ni me preguntaran por el solo señor ni cómo se llamava y preguntáranme por cosas ya hechas y que ellos las uvieran hecho y, si a mí se me olvidara algo dellas, trujéranmelas a la memoria y me dijeran que ellos las avían hecho y dijéranme que venían a dar horden cómo el solo señor estuviese en bien y en el bien de las gentes.",397
40414,"Ynga / Yngas",4,"T44593","Preguntáronme que si hera lejos al Cuzco y si avía allí mucho oro y plata; preguntáronme que qué tantos meses se tardarían en yr desde allí al Cuzco; yo les dije que avía dos caminos de allí al Cuzco y que el uno yba por la costa de la mar y que el otro yba por la sierra y díxeles que si los yndios caminavan desde allí hasta el Cuzco, que tardavan tres o quatro meses yendo poco a poco, y si yban por las postas [Martín: costas] en çinco o seis días llegava al Ynga la nueba de lo que le querían hazer saber.",397
40414,"Ynga / Yngas",4,"T44594","Y que le avía preguntado a la lengua que la tierra déstos dónde hera; y que le dijo el yntérprete PACHAP TIQUI CINPILLACTA YOCXI ÑIVARGA, que dize en el feneçimiento y remate de la tierra me dijo que hera su tierra. Entonçes dijo el Ynga TICçI VIRACOCHA CHECA CON CAICUNA, los dioses de los remates de la tierra deven de ser éstos.",397
40414,"Ynga / Yngas",4,"T44595","Y como saliese, dijo el Ynga a sus capitanes que qué les paresçía que devían de hazer y que a él le pareçía que les devía de dar obidiençia y que tenía que el Capito hera el Viracocha.",398
40414,"Ynga / Yngas",4,"T44596","Y con lo que ansí viese bolviese luego a dar razón al Ynga para que conforme a lo que çiquinchara les dixesse del estado en que estavan los españoles y ansí harían y entrarían en Caxamalca.",398
40414,"Ynga / Yngas",4,"T44597","Y ansí salieron de su consulta y el Ynga y los demás capitanes se fueron a dormir, manda[n]do a su gente de guerra y guardia que estuviesen sobre el aviso y que uviese gran recaudo.",398
40414,"Ynga / Yngas",4,"T44598","Y ansí como salieron, dijo el Ynga a Unanchullo que llevase a çiquinchara consigo a su aposento y que él con su paresçer le enbiasse como hera acordado y que se partiese luego para que fuesse a amaneçer a Caxamalca o antes que amanesçiesse y que le mandase que fuese con toda brevedad.",398
40414,"Ynga / Yngas",4,"T44599","Y ansí se fue el Ynga a dormir y Una[n]chullo despachó a çiquinchara en la manera que avéis oydo.",398
40414,"Ynga / Yngas",4,"T44600","Y el Ynga, como se uviese acostado tarde por causa de la consulta en que avía estado, durmió hasta que serían las diez del día. Y, como amaneçiesse el día, mandaron sus capitanes a la gente de guerra que luego tomasen sus armas y estuviesen prestos para partir a Caxamalca porque el Ynga avía de yr aquel día allá; y luego la gente de guerra se puso presta y a punto de batalla. Y siendo ya alto el día, que sería a la otra de las diez, el Ynga recordó de su sueño y como viesse que hera tarde pidió de comer.",399
40414,"Ynga / Yngas",4,"T44601","Y después de aver comido, sus capitanes le dijeron que hera ya ora de se partir porque llegasen con sol a Caxamalca. Y el Ynga les dijo que tienpo avía harto para todo y que, siendo ora, que él les diría que partiesen.",399
40414,"Ynga / Yngas",4,"T44602","Y luego mandó el Ynga que le trujesen de bever y trujéronle de bever y, bevió tanto y con tanta agonía, que se enbriagó de tal manera que antes que de allí saliese estava ya tomado de la vebida.",399
40414,"Ynga / Yngas",4,"T44603","Y luego el Ynga mandó que partiesse la gente de guerra e ansí se partió el Ynga de los vaños para Caxamalca en demanda del Marqués.",399
40414,"Ynga / Yngas",4,"T44604","E ya que avía andado el Ynga la mitad del camino que ay desde los vaños a Caxamalca, llegó a él otro yndio y díjole: çapa Ynga, as de saber que aquellas gentes an entrado en tus casas y te an tomado todo lo que en ellas tenías y a tus mugeres ansimismo se las an tomado y forçado; de la qual nueba el Ynga fue ayrado y mandó que aquel yndio que le trujó esta nueba que le cortasen luego la cabeça y ansí se la cortaron allí luego.",400
40414,"Ynga / Yngas",4,"T44605","Y el çiquinchara vino allí luego y encontrosse con el Ynga casi media legua de Caxamalca. Y como el çiquinchara llegó, mandó el Ynga que parase toda la gente de guerra y el Ynga y sus capitanes se juntaron  allí en el camino e llamaron a çiquinchara para dar horden en lo que devían de hazer según las nuebas que tenían.",400
40414,"Ynga / Yngas",4,"T44606","En la qual consulta los capitanes dezían que se diese batalla; y el Ynga, aunque yba enbriagado y supiese las nuebas de lo que hazían los españoles en Caxamalca, siempre porfió que no se diesse batalla.",400
40414,"Ynga / Yngas",4,"T44607","Y el çiquinchara dijo al Ynga que si no se dava batalla, que aquellas gentes no los ternían en nada, y que heran muy poquitos y que no se avía de travajar mucho en hazellos pedaços y prendellos y dezíale otras cosas muy feas, anichilándolos [sic] y deshaziéndolos en tanta manera, que los capitanes estavan en lo que el çiquinchara dezía.",400
40414,"Ynga / Yngas",4,"T44608","Y como viese el Ynga el gran persuadir de los capitanes y las cosas que hazían y dezían por las cosas que el çiqinchara dezía y las demás cosas que los yndios que avían venido de allá le avían dicho, díjoles que como viesen que los españoles hazían a la entrada de Caxamalca, que ansí se haría.",400
40414,"Ynga / Yngas",4,"T44609","Y ya que el Ynga llegava dos tiros de alcabuz [sic] de Caxamalca, llegó a él un español de a pie con el qual le enbiava el Marqués a llamar al Ynga; y como el Ynga le viesse dijo a Unanchullo que dijese [a] aquel Viracocha que a qué venía, que si estava ya harto su señor y ellos de robar en Caxamalca y forçar mugeres.",400
40414,"Ynga / Yngas",4,"T44610","El Unanchullo se lo dijo y el español no entendió lo que le dezían, mas de que por señas el español les dijo que le enbiavan a llamar al Ynga. El Unanchullo le dijo que se fuese al español, que ya yba el Ynga y an[sí] se bolvió el español y dijo al Marqués que ya venía el Ynga y que traya gran poder de gente.",400
40414,"Ynga / Yngas",4,"T44611","Y estando ya el Marqués en su sitio, entró el Ynga bien tomado de la bevida que avía bevido ansí en los vaños antes que partiesse como en el camino, en el qual avía hecho muchas posas [postas?] y en todas ellas avía bevido bien y ansimesmo allí en las andas do venía caminando pedía de bever.",401
40414,"Ynga / Yngas",4,"T44612","Y como esto oyese dijo: Pues no ay donde yo me aposente, que todo lo tienen lleno. Y estando en esto vino a él frai Viçente al yndio bien tengo yo que el yntérprete no se lo supo declarar al Ynga porque lo que dizen los señores que allí se hallaron y pegados a las andas del Ynga que lo que la lengua dijo al Ynga fue que el padre sacó un libro y abriolo y la lengua dijo que aquel padre hera hijo del sol y que le enbiava el sol a él a le dezir que no peleasse y que le diese obediençia al capitán que tanbién hera hijo del sol y que allí estava en aquel libro aquello y que ansí lo dezía aquella pintura por el libro.",401
40414,"Ynga / Yngas",4,"T44613","E como dijo pintura, pidió el Ynga el libro y tomolo en sus manos, abriolo y como él biese los ringlones de la letra, dijo: ¿Esto habla y esto dize que heres hijo del sol?; yo soy tanbién hijo del sol; respondieron a esto sus yndios y dijeron en alta boz todos juntos: Ansí es çapa Ynga. Y tornó a dezir el Ynga en alta boz que tanbién él benía de donde el sol esstava. Y diziendo esto arronjó [sic] el libro por ay y respondiole otra vez toda su gente: Ansí es, solo señor.",401
40414,"Ynga / Yngas",4,"T44614","Y como el Marqués uviese oydo al frai Viçente de aquella buelta, hizo su seña a los del artillería y como la viesen dispararon los tiros y alcabuzes y luego salieron todos de golpe y dieron en la gente del Ynga, alançeando los de cavallos en ellos y los de a pie cortando con sus espadas sin que los del Ynga los resistiesen en cossa ninguna.",401
40414,"Ynga / Yngas",4,"T44615","Y llegaron çiertos de a cavallo a las andas do el Ynga estava y con las espadas cortaban los braços y manos de los señores y prinçipales que las andas tenían a cuestas, por derribar las andas y que el Ynga saliese dellas; y, aunque les cortavan los braços y manos, ellos forsejavan a sustentar las andas con los troncones que les quedavan hasta que mataron çiertos dellos y las andas estuvieron medio derribadas.",402
40414,"Ynga / Yngas",4,"T44616","Y estando ansí llegó uno de cavallo y puniendo las piernas al cavallo hizo que pusiese las manos el cavallo en las andas, pensando que el Ynga uviera algún favor; y como el Ynga estava enbriagado y uviesse visto lo que pasava, aunque vio venir el cavallo y poner las manos en las andas no hizo mudamiento ninguno.",402
40414,"Ynga / Yngas",4,"T44617","Y luego los de cavallo fueron de allí a otra parte do vieron que avía gran cantidad de gente e ansí quedó el Ynga asentado en sus andas.",402
40414,"Ynga / Yngas",4,"T44618","Y luego cargó allí mucha gente de los suyos a ponerse delante del Ynga para que los matasen a ellos antes que al Ynga porque los peones venían matando y haziendo grande estrago en ellos.",402
40414,"Ynga / Yngas",4,"T44619","Y como el Ynga estuviese de la manera que avéis oydo, entró por entre los yndios y los demás españoles el marqués don Françisco Piçarro y llegó donde el Ynga estava y sacole de las andas al Ynga y de entre tanta multitud de yndios y españoles que ya yban sobre él y llevole consigo a su alojamiento.",402
40414,"Ynga / Yngas",4,"T44620","Y al tienpo que llegó el Marqués a do el Ynga estava, llegaron otros muchos de los suyos al Ynga y queríanle matar, y el Marqués por el defender hiriosse en una mano en las espadas que sobre el Ynga yban y ansí se lo defendió y desta manera fue preso el Ynga Atagualpa en Caxamalca.",402
40414,"Ynga / Yngas",4,"T44621","Y el Cuxi Yupangue dijo a Quizquiz que se quedase él en el Cuzco y que mirase por él y que enbiase de aquella gente de Quito que consigo tenía por todas las provinçias para que mirasen los depósitos y tierras de coca y maíz y todo el serviçio de las provinçias hasta que el Ynga Atagualpa, su señor, proveyese en ello lo que se deviese de hazer; y que luego que él saliesse enbiase tras él todos los yndios que avía mandado que se despoblasen los que les avían de poblar en el Quito  y que mirase que todos truxesen sus mugeres y hijos y cosas de sus casas. Y luego Quizquiz proveyó lo que ansí le dijo Cuxi Yupangue.",405
40414,"Ynga / Yngas",4,"T44622","Después que Atagualpa murió, paresçiéndole al Marqués que para mejor poderse entender con todos los caçiques de toda la tierra, porque heran muchos y la tierra larga y grande, que hera bien nombrar el otro Ynga allí en Caxamalca; y luego hizo paresçer ante sí todos los caçiques y señores yndios que allí en Caxamalca avía, en presençia de los quales nombró por Ynga a un hijo de Guaina Capac que allí hera en Caxamalca, que se dezía Topagualpa.",413
40414,"Ynga / Yngas",4,"T44623","Y esto hecho hizo juntar los orejones y naturales señores del Cuzco y preguntoles que a quién le pertenesçía el señorío y estado de Ynga y que lo viesen ellos entre sí a quién se devía de nombrar por Ynga y señor porque lo quería él nombrar. E ansí fueron de allí y ellos allá en la junta que hizieron paresçioles que lo devía de ser Mango Capac; e ansí vinieron al Marqués y le dieron razón dello.",414
40414,"Ynga / Yngas",4,"T44624","Luego que los señores bolvieron al Marqués a le dar razon de lo que ansí les avía mandado, dijéronle que al presente no avía en el Cuzco a quién se deviese de nombrar por Ynga si no hera a Mango Capac, que allí estava presente, que hera hijo de Guainacapac; e aunque no hera hijo de madre que fuese de las señoras del Cuzco, que hera hijo de una señora prinçipal del pueblo de Anta, que es tres leguas de la çiudad del Cuzco.",415
40414,"Ynga / Yngas",4,"T44625","Y luego el Marqués le nombró por Ynga y los señores orejones y caçiques que allí estavan le resçibieron por tal.",415
40414,"Ynga / Yngas",4,"T44626","Y siendo todo esto acavado, pensose el Mango Ynga y los demás orejones que se avía de quedar hecho Ynga y Capac como lo avían sido sus pasados y que los españoles todos se avían de yr de la tierra y bolverse a Castilla.",415
40414,"Ynga / Yngas",4,"T44627","Y como llegase al Cuzco vio el Marqués que andava en compañía de Mango Ynga un Marticote, el qual mirava por él y entendía en sus cosas y ansí se andava este Marticote con el Ynga.",416
40414,"Ynga / Yngas",4,"T44628","Y en aquella saçón tenía el [testado: Ynga] Marqués un muchacho, hijo de Guaina Capac, que le servía en su cámara; y como Mango Ynga viese que el Ma[r]qués amava aquel su hermano, sospechó que le amava y se servía dél a fin de le hazer Ynga y quitarle a él el Estado y hordenó de buscar manera cómo matar a este su hermano y díjolo a Marticote y a Paulo, que al presente el Paulo hera su mayordomo y hera su hermano, y el Paulo y el Marticote le dijeron que lo enbiase a llamar y que [lo] matarían ellos dos.",416
40414,"Ynga / Yngas",4,"T44629","Y ansí el Ynga lo enbió a llamar y como entrasse el muchacho al aposento do estava su hermano Mango Ynga, salió el otro su hermano Paulo y Marticote y matáronle; y, como le uviesen muerto, escondiéronse el Marticote y el Paulo.",416
40414,"Ynga / Yngas",4,"T44630","El Mango Ynga le dijo que se avía atravesado con Paulo el muchacho y que llegó a aquella sazón el Marticote y ansimismo el muchacho se avía atravesado con el Marticote y el Paulo y el Marticote le avían muerto y que él dello no avía sabido cossa ninguna. El Marqués le dijo que por qué no los avía presso y el Ynga le respondió que avía sido tan en breve que no los pudo él ber y que quando salió él a ellos que ya heran huidos y teníalos él escondidos.",416
40414,"Ynga / Yngas",4,"T44631","Como Mango Ynga se viese señor y biesse que el Marqués avía repartido la tierra y que la tenía poblada y hechos pueblos de españoles en ella y que siendo ansí que él tenía el nombre de Ynga y que no lo hera; y paresçiéndole que los españoles heran pocos y quesos que heran derramados en la tierra en los pueblos que heran poblados; y que ansimismo como Almagro yva a Chile llevaría consigo alguna cantidad dellos, por donde quedarían menos con quien él pudiese tener guerra y que alçándosse los mataría a todos y que le sería fáçil de hazer esto porque los tomaría divididos en los pueblos que ansí estavan poblados.",417
40414,"Ynga / Yngas",4,"T44632","Dicho esto por Bilaoma, paresçiole al Ynga y a los demás que allí heran que lo que Vilaoma avía dicho que hera lo que se devía de hazer; y ansí conçertaron que se tuviese desto secreto y que se diesse en ello la mejor orden que ser pudiese.",418
40414,"Ynga / Yngas",4,"T44633","Y como estava dada horden por Mango Ynga y los suyos en la horden que avían de tener en su alçamiento, bolviose Bilaoma del camino como estava consultado entre el Ynga y él, aviendo caminado en compañía de Almagro casi çien leguas; y como el Vilaoma bolviesse, venía alçando todo el Collao; y unos yndios que están junto a una guaca que se dize Hancocagua mataron a su amo y hiziéronse fuertes en la misma guaca de Hancocaguas.",419
40414,"Ynga / Yngas",4,"T44634","Y como se tuviesse nueba desta revelaçión déstos de Hancocagua y que le avían muerto a su amo, Juan Piçarro prendió al Ynga e hizo que se juntasen los amigos que en el Cuzco avía yndios y tomando çiertos españoles consigo fue a castigar éstos de Hancocagua y dejó la çiudad encomendada a Gavriel de Rojas y que tuviese el Ynga a buen recaudo.",419
40414,"Ynga / Yngas",4,"T44635","Y como se tuviesse nueba desta revelaçión déstos de Hancocagua y que le avían muerto a su amo, Juan Piçarro prendió al Ynga e hizo que se juntasen los amigos que en el Cuzco avía yndios y tomando çiertos españoles consigo fue a castigar éstos de Hancocagua y dejó la çiudad encomendada a Gavriel de Rojas y que tuviese el Ynga a buen recaudo.",419
40414,"Ynga / Yngas",4,"T44636","Y como viese esto Juan Piçarro resçibió gran pena y al fin preguntó a çiertos orejones que cómo conquistavan los Yngas pasados aquella guaca quando se les revelava; y ellos le dijeron",419-420
40414,"Ynga / Yngas",4,"T44637","Y como Gavriel de Rojas avía quedado por Juan Piçarro en el Cuzco, soltó al Ynga de la prisión en que le avía dejado Juan Piçarro.",420
40414,"Ynga / Yngas",4,"T44638","Y en este tienpo Hernando Piçarro venía a la çiudad del Cuzco por tiniente del Marqués y como supiese que el Ynga estava preso, escrivió a Gavriel de Rojas que no le soltasse  hasta que él llegase; y después supo el Hernando Piçarro que el Ynga hera suelto y tornó a escrevir del camino que lo tornase a prender Rojas y ansí le prendió otra vez.",420
40414,"Ynga / Yngas",4,"T44639","Y como Hernando Piçarro llegasse al Cuzco soltó al Ynga de la prisión en que estava y hízole todo el buen tratamiento que pudo; y el Ynga, como Hernando Piçarro le tratase bien, diole çierto bulto de oro.",420
40414,"Ynga / Yngas",4,"T44640","A dende a çiertos días el Bilaoma dijo al Ynga que ya hera tienpo de se alçar, que Almagro hera ya lejos y que el Macho Apo estava en Lima con poca gente y que al presente avía muy pocos españoles allí en el Cuzco; que como se alçasen, que en breve los matarían a todos y que esto hecho que deçenderían sobre el Marqués y que ansí los acabarían a todos.",420
40414,"Ynga / Yngas",4,"T44641","Tenía ya en esta sazón Mango Ynga mucha gente de guerra palabreada para çierto día, la qual fuese juntamente con él en aquel sitio do él yba y, como Hernando Piçarro viesse que el Ynga le mostrava que le amava, diole liçençia para se yr a holgar y a le traer el yndio con tripas.",420
40414,"Ynga / Yngas",4,"T44642","Y como algunas yndias y yanaconas de los españoles y bezinos del Cuzco supiesen del alçamiento, dijéronlo a sus amos y ellos fueron a Hernando Piçarro y dijéronle cómo el Ynga se alçava y él reyase y dezía que hera mentira lo que sus yndios y yndias le dezían.",420
40414,"Ynga / Yngas",4,"T44643","Y como viesen aquello los españoles y bezinos del Cuzco, hiziéronle çierto requerimiento al Hernando Piçarro que prendiese al Ynga y que no le dejase yr; el Hernando Piçarro dezía esto que pasava al Ynga y dezíale que no tuviese themor que no le hecharí[a] preso y que se fuese a holgar y le trujese el yndio con tripas y ansí se salió el Ynga.",420
40414,"Ynga / Yngas",4,"T44644","Y como saliese encomençó a matar çiertos españoles que halló en los alrededores de la çiudad, por donde el Hernando Piçarro conoçió que el Ynga hera alçado y escrivió al Marqués cómo hera alçado el Ynga, que estuviesse sobre el avisso. Y dejarle hemos aquí al Ynga alçado y hablaremos del Marqués.",421
40414,"Ynga / Yngas",4,"T44645","Y dende a dos meses que llegó, vinieron çiertos yndios del Cuzco con cartas de Hernando Piçarro, por las quales avisava al Marqués cómo el Ynga hera alçado y que estuviesse sobre el avisso y que le enbiase alguna gente y socorro.",423
40414,"Ynga / Yngas",4,"T44646","Y como Mango Ynga se viese desposeído de su muger y que le avían tratado mal, pensando hazer alguna burla al Marqués enbió sus mensajeros a Gonçalo Piçarro y dijéronle que al Ynga quería venir de paz; y como Gonçalo Piçarro esto oyesse, hízolo saber al Marqués, que estava en aquella sazón poblando el pueblo de Ariquipa.",430
40414,"Ynga / Yngas",4,"T44647","Y como el Marqués esto supiese, vino por la posta al Cuzco y fuese al balle del Yucay, y como allí estuviese el Marqués tenía consigo çierta cantidad de españoles y tenía allí ansimismo a la muger de Mango Ynga.",430
40414,"Ynga / Yngas",4,"T44648","Y enbiole a dezir el Ynga al Marqués que enbiase aquella gente que consigo tenía al Cuzco, porque como estuviese con tanta gente, que tenía themor que le quería hazer algún mal y que se temía y que él no tenía yndios que le trujesen y que por aquello no venía y porque ansimismo estava mal dispuesto de çiertos granos.",430
40414,"Ynga / Yngas",4,"T44649","Y como el Marqués oyesse esto, mandó a los más que con él estavan que se bolviesen a la çiudad del Cuzco y enbió a dezir al liçençiado de la Gama, que hera su theniente general, que no dejase venir a ninguno al Yucay, donde él estava, y enbió al Ynga una haca [hamaca?] para que viniesse y enbió con ella a un español criado suyo y a un mulato. Y como llegasen a Tanbo, tres leguas de allí, do Mango Ynga estava, luego como llegó este español y el mulato mandolos matar.",430
40414,"Ynga / Yngas",4,"T44650","Y después desto fuéronse a Mango Ynga otros seis o siete españoles, todos los quales heran de los del don Diego de Almagro y el Ynga los resçibió bien ansí como avía hecho el Diego Méndez y ansí los proveyó y hazía proveher de lo que avían menester; y los españoles, el tienpo que allí estuvieron jugavan al herrón y cavalgavan en cavallos y regozijávanse con el Ynga.",430
40414,"Ynga / Yngas",4,"T44651","Estando en esto tubo nueba el Ynga que hera venido el visorrey Blasco Nuñez Vela y que benía favorable a los caçiques y yndios; y como esto supiese díjolo al Diego Méndez y a los demás cristianos.",431
