"id_palabra","Palabra","id_cronista","id_texto","cita","pagina"
18226,"Membilla  ",18,"T18696","La segunda <italic>guaca</italic> se llamaba <italic>Mamacolca</italic>. Eran ciertas piedras que estaban en el pueblo de <strong>Membilla</strong>.",30
18226,"Membilla  ",18,"T18697","La tercera era una casa dicha <italic>Acoyguaci</italic>, que estaba en <strong>Membilla</strong>, en la cual se guardaba el cuerpo del <italic>Inca</italic> <italic>Cinchiroca</italic>.",30
18226,"Membilla  ",18,"T18698","La tercera se decia <italic>Mudca</italic>. Era un pilar de piedra que esta en un cerrillo cerca de <strong>Membilla</strong>.",33
18226,"Membilla  ",18,"T18699","La cuarta se decia <italic>Quicapúquiu</italic>. Es un manantial que está más acá de <strong>Membilla</strong>.",34
18226,"Membilla  ",18,"T18700","La quinta se nombraba <italic>Tampuvilca</italic>. Era un cerro redondo que está junto a <strong>Membilla</strong>, encima del cual estaban cinco piedras que cuentan haber aparecido allí.",34
18226,"Membilla  ",18,"T18701","La sexta se llamaba <italic>Chacapa</italic>. Es un llano de aquel cabo de <strong>Membilla</strong>.",34
18226,"Membilla  ",18,"T18702","La sexta, <italic>Curipaxapúquiu</italic>, es otra quebrada, junto á la de arriba, en el camino de <strong>Membilla</strong>.",35
18227,"Membillapúquiu",18,"T18703","La segunda era una fuente llamada <strong>Membillapúquiu</strong> de donde habian los del pueblo de <italic>Membilla</italic>.",29_30
18228,"Micayapúquiu",18,"T18704","La quinta se decia <strong>Micayapúquiu</strong>. Es una fuente que está en la ladera del cerro de <italic>Guanacauri</italic>.",26
18229,"Micaypúquiu",18,"T18705","La octava <italic>guaca</italic> era una fuente, llamada <strong>Micaypúquiu</strong>, en el camino de <italic>Tambo</italic>.",32
18230,"Micayurco",18,"T18706","La segunda se llamaba <strong>Micaycuro</strong>. Es un cerro grande que está encima de <italic>Puquin</italic>.",40
18231,"Michosamaro",18,"T18707","La primera se llamaba <strong>Michosamaro</strong>. Estaba arrimado a la falda del cerro <italic>Totocache</italic>, y decían ser uno de aquellos que fingieron haber salido con el primer <italic>Inca</italic> <italic>Manco cápac</italic> de la cueva <italic>Pacaritampu</italic>. ",3
18232,"Mojón / Mojones",18,"T18708","La postrera <italic>guaca</italic> deste <italic>ceque</italic> se decia <italic>Collana Sayba</italic>: era un <strong>mojón</strong> que esta en un cerro al principio de <italic>Sicllabamba</italic> por fin y termino de las <italic>guacas</italic> deste [sic] <italic>ceque</italic>.",14
18232,"Mojón / Mojones",18,"T18709","La postrera guaca deste <italic>ceque</italic> se decia <italic>Quiscourco</italic>: era una piedra redonda no muyu grande, que servía de término y <strong>mojón</strong> destas <italic>guacas</italic>.",17
18232,"Mojón / Mojones",18,"T18710","La séptima se decía <italic>Curavacaja</italic>: es un altozano, camino de <italic>Chila</italic>, donde se pierde de vista la ciudad, y estaba señalado por fin y <strong>mojón</strong> de las <italic>guacas</italic> deste <italic>ceque</italic>.",23
18232,"Mojón / Mojones",18,"T18711","La novena <italic>guaca</italic> era un cerro llamado <italic>Qiangalla</italic>, que esta en el camino de <italic>Yucay</italic>, donde estan dos <strong>mojones</strong> o pilares que tenían por señales que, llegando allí el Sol, era el principio del verano.",11
18232,"Mojón / Mojones",18,"T18712","La séptima se decia <italic>Sucanca</italic>. Era un cerro por donde viene la asequia de <italic>Chinchero</italic>, en la que habian <strong>mojones</strong> por señal que cuando llegaba allí el sol, habian de comenzar á sembrar el Maíz.",13_14
18233,"Molloguanca",18,"T18713","La sexta <italic>guaca</italic> se llamaba <strong>Molloguanca</strong>: era  cierta piedra que estaba en medio de un llano que llamaban <italic>Calispuquio</italic>, la cual mandó poner allí y tenerla por adoratorio <italic>Inca Yupanqui</italic>.",7
18234,"Muchaylla Puquio",18,"T18714","La octava <italic>guaca</italic> deste <italic>seque</italic> era una fuente llamada <strong>Muchaylla puquio</strong>, que está cerca de <italic>Guarguailla</italic>.  ",12_13
18235,"Mudca",18,"T18715","La tercera se decia <strong>Mudca</strong>. Era un pilar de piedra que esta en un cerrillo cerca de <italic>Membilla</italic>.",33
18236,"Nina",18,"T18716","El tercer <italic>ceque</italic> deste camino se decía <italic>Collana</italic> tenía diez <italic>guacas</italic>, y la primera se llamaba <strong>Nina</strong>, que era un brasero hecho de una piedra donde se encendía el fuego para los <italic>sacrificios</italic>.",6
18237,"Ñan",18,"T18717","La tercera <italic>guaca</italic> se decía <strong>Ñan</strong>que quiere decir camino: estaba en la plaza donde se tomaba el camino para <italic>Chinchaysuyo</italic>: haciase en ella sacrificio universal por los caminantes y porque aquel camino estuviese siempre entero.",10
18238,"Ocropacha",18,"T18718","La tercera, <strong>Ocropacha</strong>, eran unas piedras de los <italic>Pururáucas</italic> que estaban en <italic>Cayaocache</italic>.",38
18239,"Omanaman",18,"T18719","El sétimo <italic>ceque</italic> se decía <italic>Callao</italic>, y era del <italic>ayllo</italic> de <italic>Capacayllo</italic>: tenía las ocho <italic>guacas</italic> que se siguen: La primera se llamaba <strong>Omanaman</strong>, y era una piedra larga que decían ser de los <italic>Pururaucas</italic>, la cual estaba a la puerta de la casa que fue de Figueroa. ",11
18240,"Omatalispacha",18,"T18720","La cuarta era una <italic>chácara</italic> que se decia <strong>Omatalispacha</strong>, que después fue de Francisco Moreno.",27
18241,"Omotourco",18,"T18721","La décima y última era un cerro pequeño llamado <strong>Omotourco</strong>, que está en frente de <italic>Quispicanche</italic> en la puna o páramo.",30
18242,"orejones",18,"T18722","La octava <italic>guaca</italic> era una fuente que se decía <italic>Calispúquio</italic>, que estaba debajo de la dicha casa de <italic>Tupa Inca</italic>, y se iban a lavar en ella todos los que hacían <strong>orejones</strong> en la fiesta del <italic>Raymi</italic>.",7
18242,"orejones",18,"T18723","La quinta <italic>guaca</italic> se decía <italic>Guamancancha</italic>, la cual estaba cabe [sic] la <italic>fortaleza</italic> en un cerrillo deste nombre , era un cercado dentro del cual había dos <italic>Buhios</italic> pequeños diputados para ayunar cuando se hacian <strong>orejones</strong>.",8
18242,"orejones",18,"T18724","La sétima <italic>guaca</italic> se llamaba  <italic>Chacaguanacauri</italic>; la cual es un cerrillo que esta camino a <italic>Yucay</italic>, a donde iban los mancebos que se armaban <strong>orejones<strong> por cierta paja que llevaban en las lanzas.",9
18242,"orejones",18,"T18725","La tercera era un cerro llamado <italic>Quinoacalla</italic>, que estaba en <italic>Carmenga</italic>, a donde se estatuyó que en la fiesta del <italic>Raymi</italic> reposasen los <strong>orejones</strong>.",15
18242,"orejones",18,"T18726","El quinto <italic>ceque</italic> tenía por nombre <italic>Payan</italic>, en que habia diez <italic>guacas</italic>. La primera era una piedra llamada <italic>Usno</italic>, que estaba en la plaza de <italic>Hurinaucaypata</italic>: era ésta la primera <italic>guaca</italic> á quien ofrecian los que se hacían <strong>orejones</strong>.",21
18243,"Orocotopúquio ",18,"T18727","La sexta era un manantial llamado <strong>Orocotopúquio</strong>, que estaba en <italic>Carmenga</italic> al cual se daban conchas molidas.",13
18244,"Oscollo",18,"T18728","La quinta era un llano dicho <strong>Oscollo</strong>, que fue de Garcilaso.",27
18245,"Otcuropúquiu",18,"T18729","La segunda <italic>guaca</italic> deste <italic>ceque</italic> se decía <strong>Otcoropúquiu</strong>. Era una fuente cerca de <italic>Picho</italic>, heredad de la Compañía de Jesús.",41
18246,"Oyaraypúquiu",18,"T18730","La quinta <italic>guaca</italic> se decia <strong>Oyaraypúquiu</strong>: era una fontezuela que está algo mas arriba.",21_22
18247,"Oznuro",18,"T18731","La primera era una piedra no muy grande, llamada <strong>Oznuro</strong>, que estaba en la <italic>chácara</italic> de los <italic>Gualparocas</italic>.",41
18248,"Pacaritampu",18,"T18732","La primera se llamaba <italic>Michosamaro</italic>. Estaba arrimado a la falda del cerro <italic>Totocache</italic>, y decían ser uno de aquellos que fingieron haber salido con el primer <italic>Inca</italic> <italic>Manco cápac</italic> de la cueva <strong>Pacaritampu</strong>. ",3
18248,"Pacaritampu",18,"T18733","La séptima se llamaba <italic>Huanacauri</italic>, la cual era de los más principales <italic>adoratorios</italic> de todo el reino, el más antiguo que tenian los <italic>Incas</italic> después de la ventana de <strong>Pacaritampu</strong> y donde más <italic>sacrificios</italic> se hicieron. Esta es un cerro que dista del <italic>Cuzco</italic> como dos leguas y media por este camino en que vamos de <italic>Collasuyu</italic>, en el cual dicen que uno de los hermanos del primer Inca se volvió piedra, por razones que éllos dan, y tenian guardada la dicha piedra, la cual era mediana, sin figura, y algo ahusada. Estuvo encima del dicho cerro hasta la venida de los españoles, y hacianle muchas fiestas.",31
18249,"Pacaypúquiu",18,"T18734","La tercera era otra fuente nombrada <strong>Pacaypúquiu</strong>, que está un poco mas debajo de la sobredicha.",23
18250,"Pacha",18,"T18735","La quinta era una fuente llamada <strong>Pacha</strong>, que está en la quebrada de <italic>Patallacta</italic>, en que el Inca se lavaba cierto tiempo.",17
18251,"Pachachiri",18,"T18736","La Duodécima, <strong>Pachachiri</strong>, es una fuente que está en la puna de <italic>Cachona</italic>.",39
18252,"Pachamama",18,"T18737","En el séptimo <italic>ceque</italic> llamado <italic>Yacanora</italic>, habia otras siete <italic>guacas</italic>. La primera se decía <italic>Ayllipampa</italic>: era un llano donde está la <italic>chácra</italic> que fue de Mesa. Decian que era la diosa Tierra llamada <strong>Pachamama</strong>.",23
18253,"Pachatosa",18,"T18738","La segunda <italic>guaca</italic> se llamaba <strong>Pachatosa</strong> era una piedra grande que estaba junto á la casa de <italic>Cayo</italic>. ",17_18
18254,"Pachapúquiu",18,"T18739","La cuarta, <strong>Pachapúquiu</strong>, era una fuente que esta hacia <italic>Pomapampa</italic>.",38
18255,"Pachayachachic",18,"T18740","La octava y última <italic>guaca</italic> desde <italic>ceque</italic> era un cerro alto llamado <italic>Chuquipalpa</italic>, que esta junto a la <italic>fortaleza</italic>, en el cual estaban puestas tres piedras en representación del <strong>Pachayachachic</strong>, <italic>Intiillapa</italic> y <italic>Punchao</italic>; y en este cerro se hacia sacrificio universal de niños y niñas y figuras pequeñas de lo mismo hechas de oro.",8
18255,"Pachayachachic",18,"T18741","La segunda <italic>guaca</italic> se llamaba <italic>Pucamarca</italic>: era una casa o templo diputado para los <italic>sacrificios</italic> del <strong>Pachayachachic</strong>, en el cual se sacrificaban niños y todo lo demás.",10
18256,"Pachayaconora",18,"T18742","La cuarta era una fuente dicha <strong>Pachayaconora</strong>, que estaba en el dicho pueblo de <italic>Yaconora</italic>.",21
18257,"Pactaguañui",18,"T18743","La tercera era un llano dicho <strong>Pactaguañui</strong>, que fue de Alonso de Toro. Era lugar muy venerado.",34
18258,"Palpancaypúquiu",18,"T18744","La séptima era un manantial por nombre <strong>Palpancaypúquiu</strong>, que está en un cerro junto á <italic>Cacra</italic>.",27
18259,"Pampasona",18,"T18745","La segunda <italic>guaca</italic> era una piedra llamada <strong>Pampasona</strong>, que estaba junto a la sobre dicha casa.",27_28
18260,"Pantanaya",18,"T18746","La cuarta, <strong>Pantanaya</strong>, es un cerro grande partido por medio, que divide los caminos de <italic>Chincha</italic> y <italic>Condesuyo</italic> ó <italic>Contisuyo</italic>.",41
18261,"Parcialidad / Parcialidades",18,"T18747","Del templo del Sol salían, como de centro, ciertas líneas, que los indios llaman <italic>ceques</italic>.  Y en cada uno de aquellos ceques estaban por su orden las <italic>guacas</italic> y adoratorios que había en el <italic>Cuzco</italic> y su comarca, como estaciones de lugares píos, cuya veneración era general a todos. Y cada <italic>ceque</italic> estaba a cargo de las <strong>parcialidades</strong> y familias de dicha ciudad del <italic>Cuzco</italic>. ",3
18261,"Parcialidad / Parcialidades",18,"T18748","El primer <italic>ceque</italic> se decía <italic>Cayao</italic>; estaba a cargo de la <strong>parcialidad</strong> y <italic>ayllo</italic> de <italic>Goacaytaqui</italic>.",3
18261,"Parcialidad / Parcialidades",18,"T18749","El postrero <italic>ceque</italic> deste camino de <italic>Antisuyu</italic> se decia <italic>Cayao</italic>; era del ayllo y <strong>parcialidad</strong> de <italic>Cari</italic> y tenia las cinco <italic>guacas</italic>. ",25
18261,"Parcialidad / Parcialidades",18,"T18750","<strong>Parcialidad</strong> de <italic>Cari</italic> y tenia las cinco <italic>guacas</italic> siguientes. La primera se decía <italic>Lampapuquiu</italic>: era una fuente que estaba en <italic>Nudamarca</italic>. Sacrificábanle conchas de dos colores.",25
18262,"Patallacta",18,"T18751","La segunda <italic>guaca</italic> deste <italic>ceque</italic> se decía <strong>Patallacta</strong>, era una casa que diputó <italic>Inca Yupanqui</italic> para sus <italic>sacrificios</italic> y murió en ella; y los <italic>Incas</italic> que después sucedieron hicieron aquí sacrificio ordinario. ",4
18263,"Payllallauto",18,"T18752","La  tercera, <strong>Payllallauto</strong>, era cierta cueva en el cual tenían creído que se entró una <italic>señora</italic> deste nombre, madre de un gran <italic>señor</italic> por nombre <italic>Apucurimaya</italic>, la cual nunca más pareció.",36
18264,"Payan",18,"T18753","El segundo <italic>ceque</italic> desde mismo camino de <italic>Chinchaysuyu</italic> se decía <strong>Payan</strong>; en cual había ocho <italic>guacas</italic> del <italic>ayllo</italic> y familia de <italic>Vicaquirao</italic>. ",4
18264,"Payan",18,"T18754","El segundo <italic>ceque</italic> deste camino se llamaba <strong>Payan</strong> estaba a cargo del <italic>ayllu</italic> de <italic>Haguayni</italic> y tenia ocho <italic>guacas</italic>.",26_27
18265,"Payan ",18,"T18755","El quinto <italic>ceque</italic> se llamaba <strong>Payan</strong>, y tenia diez <italic>guacas</italic>.",29
18266,"Payan",18,"T18756","El octavo <italic>ceque</italic> se decia <strong>Payan</strong> y tenia ocho <italic>guacas</italic>.",33
18266,"Payan",18,"T18757","El tercer <italic>ceque</italic> se nombraba <strong>Payan</strong>, y tenia otras cuatro <italic>guacas</italic>.",36
18266,"Payan",18,"T18758","El sexto <italic>ceque</italic> deste mismo camino se llamaba <strong>Payan</strong>, y tenia cinco <italic>guacas</italic>.",38
18267,"Payan ",18,"T18759","Al décimo <italic>ceque</italic> llamaban <strong>Payan</strong>, y tenia cuatro <italic>guacas</italic>.",40
18267,"Payan ",18,"T18760","el octavo <italic>seque</italic> deste camino [sic] se decia <strong>Payan</strong> como el segundo, y habia en el trece <italic>guacas</italic>. La primera era una casa pequeña junto al templo del sol, llamada <italic>Illanguarque</italic>, en que se guardaban ciertas armas que decian haberlas dado el Sola á <italic>Inca-Yupanqui</italic>, con que venció a sus enemigos. ",13
18267,"Payan ",18,"T18761","El segundo <italic>ceque</italic> del dicho camino de <italic>Antisuyu</italic> se decia <strong>Payan</strong>, y tenia diez <italic>guacas</italic>. La primera era un lugar llamado <italic>Vilcacona</italic>, donde se edificó la casa que fue de Juan Salas.",17
18267,"Payan ",18,"T18762","El quinto <italic>ceque</italic> tenía por nombre <strong>Payan</strong>, en que habia diez <italic>guacas</italic>. La primera era una piedra llamada <italic>Usno</italic>, que estaba en la plaza de <italic>Hurinaucaypata</italic>: era ésta la primera <italic>guaca</italic> á quien ofrecian los que se hacían <italic>orejones</italic>.",21
18267,"Payan ",18,"T18763","El segundo <italic>ceque</italic> deste camino se llamaba <strong>Payan</strong> estaba a cargo del <italic>ayllu</italic> de <italic>Haguayni</italic> y tenia ocho <italic>guacas</italic>. La primera era un llano dicho <italic>Limapampa</italic>, donde se hizo la <italic>chácara</italic> de Diego Gil.",27
18267,"Payan ",18,"T18764","El quinto <italic>ceque</italic> se llamaba <strong>Payan</strong>, y tenia diez <italic>guacas</italic>, y tenia diez <italic>guacas</italic>. A la primera nombraban <italic>Catonge</italic>. Era una piedra que estaba cabe la casa de Juan Soria. Adorábanla como á <italic>guaca</italic>.",29
18268,"Payao",18,"T18765","Al cuarto <italic>ceque</italic> llamaban <strong>Payao</strong>; tenía ocho <italic>guacas</italic>, de las cuales la primera se decía <italic>Araytampu</italic>; era una piedra grande con otras cuatro pequeñas, que estaban junto a la casa que fue de Benito de la Peña, y eran de los <italic>Pururaucas</italic>.",7
18269,"Picas",18,"T18766","La décima se decía <strong>Picas</strong>: era una pedrezuela pequeña que estaba en un cerro encima de <italic>Larapa</italic>, á la cual tenian por abogada del granizo.",24
18270,"Piccho",18,"T18767","La segunda era una casa pequeña que estaba en <strong>Piccho</strong>, heredad que ahora es de la Compañía de Jesús en la cual mandó <italic>Guayna-Cápac</italic> que hiciesen sacrificio, porque solia dormir allí su madre <italic>Mama-Ocllo</italic>.",14_15
18270,"Piccho",18,"T18768","La quinta se decía <italic>Vicaribi</italic>; era una sepultura bien librada, que estaba en <strong>Piccho</strong>, que fue de un Señor principal así llamado, del <italic>ayllu</italic> de <italic>Maras</italic>.",15
18270,"Piccho",18,"T18769","La sexta <italic>guaca</italic> era una piedra llamada <italic>Apuyovira</italic> que estaba sobre el cerro de <strong>Piccho</strong>: teniendo creido que era uno de aquellos que salieron de la tierra con <italic>Huanacauri</italic>, y que después de haber vivido mucho tiempo, se subio alli y se volvió piedra; á la cual iban á adorar todos los <italic>ayllus</italic> en la fiesta del <italic>Raymi</italic>.",15
18271,"Picho",18,"T18770","La segunda <italic>guaca</italic> deste <italic>ceque</italic> se decía <italic>Otcoropúquiu</italic>. Era una fuente cerca de <strong>Picho</strong>, heredad de la Compañía de Jesús.",41
18272,"Pilcopuquio / Pilcopúquiu",18,"T18771","La tercera <italic>guaca</italic> se llamaba <strong>Pilcopuquio</strong>: es una  fuete junto a la casa sobredicha, de la cual sale una acequia; y cuentan los indios, que habiendo hecho <italic>Inca-Yupanqui</italic> aquella casa para los <italic>sacrificios</italic>, mandó que saliese de allí aquel agua. ",4
18272,"Pilcopuquio / Pilcopúquiu",18,"T18772","La sétima era una fuente dicha <strong>Pilcopúquiu</strong>, que estaba cerca del pueblo dicha <italic>Pilcopúquiu</italic>, que estaba cerca del pueblo de <italic>Corcora</italic>.",24
18272,"Pilcopuquio / Pilcopúquiu",18,"T18773","La primera era una fuente dicha <strong>Pilcopúquiu</strong>, que está en la guerta de Santo Domingo.",40
18273,"Pilcourco",18,"T18774","La undécima y última <italic>guaca</italic> deste <italic>ceque</italic> se llama <strong>Pilcourco</strong>: era otra piedra á quien hacian gran veneración, la cual estaba en un cerro grande cerca de <italic>Larapa</italic>. Cuando había Inca nuevo le sacrificaban demás de lo ordinario.",24_25
18274,"Pillochuri",18,"T18775","La segunda se decia <strong>Pillochuri</strong>. Era una quebrada camino de <italic>Tambo</italic>, en que habia una piedra mediana y larga tenida en veneración.",36
18275,"Pillolliri",18,"T18776","La undécima era una piedra dicha <strong>Pillolliri</strong>, que cuentan los indios haber saltado de otro cerro á aquel que se llama así, y por esta imaginación que tuvieron la adoraron.",15
18276,"Pitopúquiu",18,"T18777","La décima tercia, <strong>pitopúquiu</strong>, es otra fontezuela que estaba junto a la sobre dicha.",40
18277,"Pirpoyopacha",18,"T18778","la tercera era una fuente nombrada <strong>Pirpoyopacha</strong>, que está en la chácara de Diego Maldonado, en la cual se lavaban los <italic>Incas</italic> ciertos dias.",28
18278,"Pirquipúqiu",18,"T18779","La segunda <italic>guaca</italic> era otro manantial llamado <strong>Pirquipúqiu</strong>, que esta en una quebrada mas abajo. Ofrecianle corderillos pequeños hechos de plata.",24
18279,"Plazuela",18,"T18780","A la primera nombrada <italic>Caritampucancha</italic>. Era una <strong>plazuela</strong> que está ahora dentro del convento de Santo Domingo, la cual tenian por opinión que era el lugar donde se asentó <italic>Manco Capac</italic> en el sitio del <italic>Cuzco</italic>.",37
18280,"Pomaurco",18,"T18781","La décima y última <italic>guaca</italic> deste <italic>ceque</italic> era otra piedra llamada <strong>Pomaurco</strong>, que estaba puesta por fin y término de las <italic>guacas</italic> deste <italic>ceque</italic>.",22
18281,"Pomacorco",18,"T18782","La quinta <italic>guaca</italic> era otra casa dicha <strong>Pomacorco</strong> y no dan otra razón de sacrificar en ella más que haber sido de <italic>Guaynacápac</italic>.",6
18282,"Pomacucho",18,"T18783","La cuarta <italic>guaca</italic> era una fuente llamada <strong>Pomacucho<strong> que estaba algo apartada deste <italic>ceque</italic>: ofrecianle conchas.",15
18283,"Pomachupa",18,"T18784","La tercera se decia <strong>Pomachupa</strong> (suena cola de León). Era un llano que estaba en el barrio asi llamado.",35
18284,"Pomaguaci",18,"T18785","La cuarta, <strong>Pomaguaci</strong>, es un cerrillo al cabo deste <italic>ceque</italic>, que estaba por fin y término  de las <italic>guacas</italic> dél.",41
18285,"Pomamarca",18,"T18786","La sexta era una casa dicha <strong>Pomamarca</strong>, la cual estaba en el dicho llano. En ella se guardaba el cuerpo de la mujer de <italic>Inca-Yupanqui</italic>. ",22_23
18286," Pomapacha",18,"T18787","El cuarto <italic>ceque</italic> deste dicho camino se decia <italic>Cayao</italic>, y era del <italic>ayllu</italic> de <italic>Apomayta</italic>, y tenia diez <italic>guacas</italic>.  A la primera llamaban <strong>Pomapacha</strong>. Era una fuente donde se bañaban los <italic>Incas</italic>, con una casa junto á ella en que se recogian en saliendo del baño. Estaban donde fueron despues las casas de Sotelo.",28
18287,"Poroypúquiu",18,"T18788","La duodécima <italic>guaca</italic> era otra fuente  llamada <strong>Poroypúquiu</strong> que ésta junto al molino que fue de Juan Julio.",14
18288,"Pucamarca",18,"T18789","La segunda <italic>guaca</italic> era un templo llamado <strong>Pucamarca</strong>, que estaba en las casas que fueron del licenciado de la Gama; en la cual estaba un <italic>ídolo</italic> del Trueno, dicho <italic>Chucuylla</italic>.",9
18288,"Pucamarca",18,"T18790","La segunda <italic>guaca</italic> se llamaba <strong>Pucamarca</strong>: era una casa o templo diputado para los <italic>sacrificios</italic> del <italic>Pachayachachic</italic>, en el cual se sacrificaban niños y todo lo demás.",10
18289,"Puna",18,"T18791","La tercera se decia <italic>Corcorpuquiu</italic>; era otro manantial que está en la <strong>puna</strong> encima de la Angostura.",25
18289,"Puna",18,"T18792","La décima y última era un cerro pequeño llamado <italic>Omotourco</italic>, que está en frente de <italic>Quispicanche</italic> en la <strong>puna</strong> o páramo.",30
18289,"Puna",18,"T18793","La quinta, <italic>Chinchaypúquiu</italic>, era otra fuente que está en una ladera de la <strong>puna</strong>.",39
18289,"Puna",18,"T18794","La Duodécima, <italic>Pachachiri</italic>, es una fuente que está en la <strong>puna</strong> de <italic>Cachona</italic>.",39
18290,"Puncu",18,"T18795","La postrera <italic>guaca</italic> deste camino era un cerro llamado <strong>Puncu</strong>, a donde ofrecian lo que sobraba de las <italic>guacas</italic> deste <italic>ceque</italic>.",34
18291,"Punchao",18,"T18796","La octava y última <italic>guaca</italic> desde <italic>ceque</italic> era un cerro alto llamado <italic>Chuquipalpa</italic>, que esta junto a la <italic>fortaleza</italic>, en el cual estaban puestas tres piedras en representación del <italic>Pachayachachic</italic>, <italic>Intiillapa</italic> y <strong>Punchao</strong>; y en este cerro se hacia sacrificio universal de niños y niñas y figuras pequeñas de lo mismo hechas de oro.",8
18292,"Puntuguanca",18,"T18797","La décima cuarta era cierta piedra llamada <strong>Puntuguanca</strong>, que estaba encima de un cerro deste nombre cerca del cerro de <italic>Anaguarque</italic>.",36
18293,"Puñui",18,"T18798","La segunda <italic>guaca</italic> se llamaba <strong>Puñui</strong>: estaba en un llano pequeño junto a la casa de Diego Maldonado. Fue adoratorio muy solemne, porque era tenido por causa del sueño; ofrecíanle todo género de <italic>sacrificios</italic>. ",7
18294,"Púquio / Púquiu",18,"T18799","La octava <italic>guaca</italic> se decía <strong>Púquio</strong>: era una fuente que está de ese cabo de <italic>Tambomachay</italic>.",19
18294,"Púquio / Púquiu",18,"T18800","La séptima era otra fuente dicha<strong> Púquiu</strong>, junto a la de arriba.",33
18294,"Púquio / Púquiu",18,"T18801","La primera era un <strong>púquiu</strong> ó fuente llamada <italic>Chilquichaca</italic>.",41
