"id_palabra","Palabra","id_cronista","id_texto","cita","pagina"
2001,"Abancay",2,"T20001","Estando las cosas del Cuzco desta manera, los <italic>chancas</italic> -como atras conte- avian vençido a los <italic>quichuas</italic> y ocupado la mayor parte de la <italic>provinçia</italic> de <italic>Andavaylas</italic> ; y como estuviesen vitoriosos, oyendo lo que se dezia de la grandeza del <italic>Cuzco</italic> e su riqueza e la magestad de los <italic>Yngas</italic> , desearon de no estarse encojidos ni dexar de pasar adelante, ganando con las armas todo lo a ellos posible. Y luego hizieron grandes plegarias a sus dioses o demonios y dexando en <italic>Andavaylas</italic> , ques la que los españoles llaman <italic>Andaguaylas</italic> , questa encomendada a Diego Maldonado el rico, jente bastante para la defensa della, y con la que estava junta para la guerra, salio <italic>Hastu Guaraca</italic> y un hermano suyo muy vatiente, llamado <italic>Oma Guaraca</italic> , y partieron de su <italic>provinçia</italic> con muy gran sobervia camino del <italic>Cuzco</italic> , y anduvieron hasta llegar a <italic>Curanba</italic> , donde asentaron su real y hizieron gran daño en los naturales de la comarca. Mas como en aquellos tienpos muchos de los pueblos estuviesen en los altos y <italic>collados</italic> de las sierras, con grandes sercas, que llaman <italic>‘pucaraes’</italic> , no se podia hazer muchas muertes ni querian cativos ni mas que robar los canpos. Y salieron de <italic>Curanba</italic> y fueron al aposento de <italic>Cochacaxa</italic> y al rio de <strong>Abancay</strong> destruyendo todo lo que hallavan; y asi se açercaron al <italic>Cuzco</italic> , adonde ya avia ydo la nueva de los enemigos que venian contra la çibdad...",130
2002,"Achi Oclo",2,"T20002","La una de sus mugeres fue estéril, que nunca se empreñó; en la otra ovo tres hijos varones y una hija: el mayor fue nonbrado <italic>ÇincheRoca Ynga</italic> y la hija <strong>Achi Oclo</strong> ;",22
2003,"Acos",2,"T20003","[Y como se hobiesen holgado los] dias que le pareçio a <italic>Ynga Yupangue</italic>, / les hablo; como queria que fuesen a los <italic>Guancas</italic> y a los <italic>Yayos</italic> e sus vezinos a procurar de los traer en su amistad y serviçio sin guerra, y quando no, que dandosela, se diesen malla de los vençer y forçar que lo hiziesen. Respondieron todos que harian lo que mandava con gran boluntad. Fueron señalados capitanes de cada naçion y sobre todos fue por general <italic>Lloque Yupangue</italic> y con el, para consejo, <italic>Copa Yupangue</italic>; y avisandoles de lo que avian de hazer, salieron del <italic>Cuzco</italic> y caminaron hasta la <italic>provinçia</italic> de <italic>Andaguailas</italic>, adonde fueron bien reçibidos por los <italic>chancas</italic>; y salio con ellos un capitan, llamado <italic>Anco Allo</italic>, con copia de jente de aquella tierra para servir en la guerra del <italic>Ynga</italic>. De <italic>Andaguaylas</italic> fueron a <italic>Vilcas</italic>, adonde se estavan los aposentos y tenplo del Sol que <italic>Ynga Yupangue</italic> avia mandado hazer, y hablaron con todo amor a los que entendian en aquellas hobras. De <italic>Vilcas</italic> fueron por los pueblos de <italic>Guamanga</italic>, <italic>Açangaro</italic>, <italic>Parcos</italic>, <italic>Picoy</italic>, <strong>Acos</strong> y otros, los quales ya avian dado la obedençia al <italic>Ynga</italic> y proveian de bastimentos y de lo que mas tenian en sus pueblos y hazian el camino real que les hera mandado grande y muy ancho.",143
2004,"Açua",2,"T20004","Llegados los enbaxadores de los <italic>canas</italic>, fueron bien reçibidos por <italic>Ynga Viracoche</italic> y les respondio que fuesen los prençipales y mas viejos de los canas a <italic>Ayavire</italic>, adonde se verian,y que como oviese estado algunos dias en el tenplo de <italic>Vilcanota</italic> se daria prieça a verse con ellos. Y dio a los mensajeros algunas joyas y ropa de lana fina y mando a su jente de guerra que no fuesen osados de entrar en las casas de los <italic>canas</italic> ni robar nada de lo que tuviesen ni hazelles daño ninguno porque el buen coraçon que tenian no se les turvase y tomasen otro pensamiento. Los <italic>canas</italic>, oyda la respuesta, mandaron poner mucho mantenimiento por los caminos y abaxavan de los pueblos a servir al <italic>Ynga</italic>, que con mucha justiçia entendio en que no fuesen agraviados en cosa alguna: y eran proveydos de ganado y de <strong>açua</strong>, ques su vino. Y como ovo llegado al vano tenplo, hizieron sacrifiçios conforne a su jentilidad, matando muchos corderos para el sacrefiçio. De alli caninaron para <italic>Ayavire</italic>, donde los <italic>canas</italic> estavan con mucho proveymiento de bastimento.",125
2005,"Alaya",2,"T20005","Esto hecho, salio de aquel lugar con su jente el rey y no paro hasta el valle de <italic>Xauxa</italic>, adonde avia alguna controverçia y division sobre los limites y canpos del valle entre los mismos que del hera señor. Como <italic>Guaynacapa</italic> lo entendio, despues de aver hecho sacrifiçios como en <italic>Bilcas</italic>, mando juntar los señores <strong>Alaya</strong> , <italic>Cuçichuca</italic>, <italic>Guacoropora</italic> y entre ellos con yquidad repartio los canpos de la manera que oy /dia lo tienen.",187
2006,"Alcaviquiça",2,"T20006","Hechas las vodas, estava un varrlo çerca de la çibdad donde bivian un linaje de jente a quien llamavan <strong>Alcaviquiça</strong> , y estos no avian querido tener amistad con los del <italic>Cuzco</italic> ninguna. Y estando llenos de sospechas unos de otros, dizen que, yendo a tomar agua una muger del <italic>Cuzco</italic> a çierta fuente que por alli estava, salio un muchacho del otro varrio y le quebro el cantaro y hablo no se que palabras; la qual, dando gritos, bolvio al <italic>Cuzco</italic>. Y como estos yndios son tan alharaquientos, salieron luego con sus armas contra los otros, que tanvien avian tomado las suyas al ruydo que oyan, para ver en lo que parava el negoçio; y llegando el <italic>Ynga</italic> çerca con su jente se pusieron en horden de pelear, aviendo tomado por achaque cosa tan liviana como entre la yndia y [el] muchacho avia pasado, para querer sojuzgar los de aquel linaje o que la memoria dellos se perdiese. Y esto por los de <strong>Alcaviquiça</strong> bien era entendido; y como honbres de valor salieron a la batalla con gran denuedo, que fue la primera que se dio en aquellos tienpos; y pelearon gran rato asi los unos como los otros...",100
2006,"Alcaviquiça",2,"T20007","... porque aviendo sido el caso tan supito no avian podido allegar fabores ni buscar ayudas los de <strong>Alcaviquiça</strong> , los quales aunque mucho / pelearon, fueron vençidos despues de ser muertos todos los mas, que casi no escaparon çinquenta con la vida. Y luego el rey <italic>Mayta Capa</italic>, tomando poseçion en los canpos y eredades de los muertos, usando de vençedor, lo repartio todo por los vezinos del <italic>Cuzco</italic>; y se hizieron grandes fiestas por la vitoria, yendo todos a sacrificar a los oraculos que tenian por sagrados.",101
2007,"Anaconas",2,"T20008","Y quando no avia guerra, lo mas de todo lo comian y gastavan los proves, porque estando los reyes en el <italic>Cuzco</italic>, ellos tenian sus <strong>anaconas</strong> -que es nonbre de criado perpetuo-, y tantos que bastavan a labrar sus heredades y <italic>chacaras</italic> y senbrar tanto mantenimiento que bastase, sin lo qual para su plato se traya de las comarcas sienpre, muchos corderos y aves, y pescado, y <italic>mayz</italic>, <italic>coca</italic>, rayces con todas las frutas que se cojen. Y tal horden avia en estos tributos que los naturales los pagaban, y los <italic>Yncas</italic> se hallavan tan poderosos / que no tenian guerra ninguna que se recreciese[n].",52
2007,"Anaconas",2,"T20009","... Las mugeres que sacrificavan yvan vestidas asimismo ricamente con sus ropas finas de colores y de pluma y sus topos de oro y sus cucharas y escudillas y platos, todo de oro, y <italic>chuspas</italic> de <italic>coca</italic> de avisca: y asi adereçadas, despues de que an bien vevido, les ahogavan y enterravan creyendo, ellas y los que las matavan, que yvan a servir a su diablo o <italic>Guanacaure</italic>. Y hazianse grandes va[i]les y cantares quando se hazian semejantes sacrifiçios questos. Y tenia este ydolo, donde estava el oraculo, sus <italic>chacaras</italic> y <strong>anaconas</strong> y ganados y <italic>mamaconas</italic> y çaçerdotes que se aprovechan de lo mas dello.",84
2007,"Anaconas",2,"T20010","Sin estos tenplos se tuvo otro por tan estimado y frequentado como ellos, y mas, que avia por nonbre la <italic>Coropona</italic>, ques en la <italic>provinçia</italic> de <italic>Condesuyo</italic>, en un çerro muy grande, cubierto a la contina de nieve que ynvierno y verano no se quita jamas. Y los reyes del <italic>Peru</italic> con los mas prençipales del visitavan / este tenplo haziendo presentes y ofrendas como a los ya dichos. Y tienese por muy çierto que de los dones y capacocha que a este tenplo se le hizo, avia mucha suma de cargas de oro y plata y pedreria enterrado en partes que dello no se save y los yndios escondieron otra suma grande questava para serviçio del ydolo y de los çaçerdotes y <italic>mamaconas</italic>, que tanbien tenia muchos este tenplo y como avia tan grandes nieves no suven a lo alto ni saben atinar adonde estan tan grandes tesoros. Mucho ganado tenia este tenplo y <italic>chacaras</italic> y serviçio de yndios y <strong>anaconas</strong>.",85
2007,"Anaconas",2,"T20011","El fue caminando hazia <italic>Chile</italic> con toda su jente, acavando de domar, par donde pasava, las jentes que avia. Paso gran travajo par los despoblados y fue mucha la nieve que sobre ellos cayo; lleva[va]n toldos con que se guareçer y muchos <strong>anaconas</strong> e mugeres de serviçio. Por todas estas nieves se yva haziendo el camino o a ya estava hecho y bien linpio y postas puestas par todo el.",183
2007,"Anaconas",2,"T20012","Hizose llamamiento general / en todas las <italic>provinçias</italic> de su señorio y vinieron de todas partes tanta jente que henchian los canpos. Y despues de aver hecho vanquetes y borracheras generales y puesto en horden las cosas de la çibdad, salio de alli <italic>Guaynacapa</italic> con ‘yscaypachaguaranga lunas’, que quiere dezir con dozientos mill honbres de guerra, sin los <strong>anaconas</strong> y mujeres de serviçio, que no tenia quento el numero dello[s]. Llevava consigo dos mill mugeres y dexava en el <italic>Cuzco</italic> mas de quatro mill.",186
2008,"Anaguar",2,"T20013","...e vestido una de aquellas ropas, salen del <italic>Cuzco</italic> ques donde se haze esta fiesta y van a çerro de <italic>Guanacaure</italic>, donde dezimos questavan los hermanos; y hechas algunas çirimonias y sacrefiçio, se buelven a donde está aparejado en vino, donde lo beven. Y luego sale el <italic>Ynga</italic> a un çerro nombrado <strong>Anaguar</strong> ...",18
2009,"Anbato",2,"T20014","Capitulo [LXXIII] 'de como <italic>Atabalipa</italic> salio del <italic>Quito</italic> con su jente y capitanes y de como dio vatalla a <italic>Atoco</italic> en los pueblos de <strong>Anbato</strong> .",209
2009,"Anbato",2,"T20015","Y quentan que encomendo la guerra a su capitan general <italic>Chalaquchima</italic> y a otros dos capitanes, llamados el <italic>Quizquiz</italic> el unos y el otro <italic>Ocumare</italic>. Y como <italic>Atoco</italic> no parase con la jente, pudieron encontrarse çerca del pueblo llamado <strong>Anbato</strong> , adonde a la usança suya començaron la batalla y la riñeron entre ellos bien. Y aviendo tomado un <italic>collado</italic> <italic>Chalaquchima</italic> salio a tienpo convenible con çinco mill honbres holgados y dando en los que estavan cançados, los apretaron tanto que, despues de ser muertos los mas dellos, bolvieron los que no lo eran las espaldas con gran espanto, y el alcançe se siguio y fueron muchos los presos / y <italic>Atoco</italic> entre ellos; el qual, quentan los que desto me ynformaron, que lo ataron a un palo donde con gran crueldad aviltadamente le mataron y que del casco de su cabeça hizo un bazo <italic>Chalaquchima</italic>, para vever, engastonado en oro. La opinion mayor y que deve des ser mas çierta, a mi juyzio, de los que murieron en esta vatalla de anbas partes fueron quinze o dies y seys mill yndios y los que se prendieron fueron los mas dellos muertos sin piedad ninguna por mandado de <italic>Atabalipa</italic>.",210
2009,"Anbato",2,"T20016","Pocos dias se tardaron despues que en el pueblo de <strong>Anbato</strong> el capitan <italic>Atoco</italic> fue vençido y desbaratado, quando no solamente en el <italic>Cuzco</italic> se supo la nueva, mas en toda la tierra se entendio y reçibio <italic>Guascar</italic> grande espanto y temio mas el negoçio que hasta alli; mas sus consejeros le amonestaron que no desanparase al <italic>Cuzco</italic> sino que enbiase de nuevo jente y capitanes. Y fueron hechos grandes lloros por los muertos y en los tenplos y oraculos hizieron sacrifiçios conforme a lo que ellos usan. Y enbio a llamar <italic>Guascar</italic> a muchos señores de los naturales del <italic>Colla[o]</italic>, de los <italic>Canches</italic>, <italic>Canas</italic>, <italic>Charcas</italic>, <italic>Carangues</italic> y a los de <italic>Condesuyo</italic> y muchos de los de <italic>Chinchasuyo</italic>; y como estuviesen juntos, les hablo sobre lo que su hermano hazia y les pidio en todo le quisiesen ser buenos amigos y conpañeros.",211
2009,"Anbato",2,"T20017","Y alguna de la jente que escapo de la vatalla que se dio en <strong>Anbato</strong> se avia juntado con el. Afirman todos que trayria mas de ochenta mill honhres de guerra y <italic>Atabalipa</italic> llevaria pocos menos de <italic>Tomebanba</italic>, donde luego salio afirmando que no avia de parar hasta el <italic>Cuzco</italic>. Mas en la <italic>provinçia</italic> de los <italic>Paltas</italic>, serca de <italic>Coxebanba</italic>, se encontraron unos con otros; y despues de aver esforçado y hablado cada capitan a su jente, se dieron vatalla, en la qual afirman que <italic>Atabalipa</italic> no se hallo, antes se puso en un çerrillo a la ver. Y siendo Dios dello servido, no enbargante que en la jente de <italic>Guascar</italic> avia muchos <italic>orejones</italic> y capitanes que para entre ellos entendian bien la guerra y que <italic>Guancauque</italic> hizo el dever como leal y buen servidor a su rey, <italic>Atabalipa</italic> quedo vençedor con muerte de muchos contrarios, tanto que afirman que murieron entre unos y otros mas de treynta y çinco mill honhres y heridos quedaron muchos.",213
2010,"Anco Allo",2,"T20018","[Y como se hobiesen holgado los] dias que le pareçio a <italic>Ynga Yupangue</italic>, / les hablo; como queria que fuesen a los <italic>Guancas</italic> y a los <italic>Yayos</italic> e sus vezinos a procurar de los traer en su amistad y serviçio sin guerra, y quando no, que dandosela, se diesen malla de los vençer y forçar que lo hiziesen. Respondieron todos que harian lo que mandava con gran boluntad. Fueron señalados capitanes de cada naçion y sobre todos fue por general <italic>Lloque Yupangue</italic> y con el, para consejo, <italic>Copa Yupangue</italic>; y avisandoles de lo que avian de hazer, salieron del <italic>Cuzco</italic> y caminaron hasta la <italic>provinçia</italic> de <italic>Andaguailas</italic>, adonde fueron bien reçibidos por los <italic>chancas</italic>; y salio con ellos un capitan, llamado <strong>Anco Allo</strong> , con copia de jente de aquella tierra para servir en la guerra del <italic>Ynga</italic>.",143
2010,"Anco Allo",2,"T20019","Capitulo [L] de como salieron de <italic>Xauxa</italic> los capitanes del <italic>Ynga</italic> y lo que les çusedio y como se salio de entre ellos <strong>Anco Allo</strong> ",144
2010,"Anco Allo",2,"T20020","Quentan los yndios <italic>chancas</italic> que, como los yndios que salieron de su <italic>provinçia</italic> de <italic>Andaguaylas</italic> con el capitan <strong>Anco Allo</strong> oviesen hecho grandes hechos en estas guerras, enbidiosos dellos y con rencor que tenian contra el capitan <strong>Anco Allo</strong> de mas atras, quando el <italic>Cuzco</italic> fue çercado, determinaron de los matar. Y asi los mandaron llamar; y como fuesen muchos juntos con su capitan entendieron la yntençion que tenian y puestos en arena se defendieron de los del <italic>Cuzco</italic>,...",144
2010,"Anco Allo",2,"T20021","... [y] aunque murieron algunos, pudieron los otros con el fabor y esfuerço de <strong>Anco Allo</strong> de salir de alli, el qual se quexava a sus dioses de la maldad de los <italic>orejones</italic> e yngratitud, afirmando que por no los ver mas ni seguir, se yria con los suyos en boluntario destierro. Y echando delante las mugeres, camino y atrabeço las <italic>provinçias</italic> de los <italic>Chachapoyas</italic> e <italic>Guanuco</italic> y pasando por la montaña de los <italic>Andes</italic> caminaron por aquellas sierras hasta que llegaron, segund tanbien dizen, a una laguna muy grande, que yo creo deve ser lo que quentan del Dorado, adonde hizieron sus pueblos y se an multiplicado / mucha jente. Y quentan todos los yndios grandes cosas de aquella tierra y del capitan <strong>Anco Allo</strong> . Los capitanes del <italic>Ynga</italic>, pasado lo que se a escrito, dieron la buelta al valle de <italic>Xauxa</italic>, donde ya se avian allegado grandes presentes y muchas mujeres para llevar al <italic>Cuzco</italic> y lo mismo hizieron los de <italic>Tarama</italic>. La nueva de todo fue al <italic>Cuzco</italic> y como fue savido por el <italic>Ynga</italic> holgose por el buen çuseso de sus capitanes, aunque hizo muestra [de] averle pesado lo que avian hecho con <strong>Anco Allo</strong>; mas era, segund se cre[e], yndustria porque algunos afirman que por su mando lo hizieron sus capitanes. Y como <italic>Topa Guasco</italic> y los otros <italic>chancas</italic> oviesen ydo a dar guerra a la <italic>provinçia</italic> de <italic>Collao</italic> y oviesen avido vitoria de algunos pueblos, reçelandose el <italic>Ynga</italic> que, savida la nueva de lo que avia pasado con <strong>Anco Allo</strong>, se bolverian contra el y le harian trayçion, les enbio mensajeros para que luego viniesen para el; e mando, so pena de muerte, que ninguno le[s] avisase de lo pasado. Los <italic>chancas</italic>, como vieron el mandado del <italic>Ynga</italic>, vinieron luego al <italic>Cuzco</italic> y, como llegaron, el <italic>Ynga</italic> les hablo con gran disimulaçion, amorosamente, encubriendo la maldad que se uso con el capitan <strong>Anco Allo</strong> y dava por sus palabras muestra de averle dello pesado. Los <italic>chancas</italic>, como lo entendieron, no dexaron de sentir el afrenta, mas viendo quan poca parte eran para satisfacerse, pasaron por ello pidiendo liçençia a <italic>Ynga Yupangue</italic> para bolver a su <italic>provinçia</italic>, y siendoles conçedida, se partieron dando previllejo al señor prençipal para que se pudiese sentar en el duho engastonado en oro y otras preeminencias.",145
2011,"Ancocagua",2,"T20022","El quarto tenplo estimado y frequentado por los <italic>Yngas</italic> y naturales de las <italic>provinçias</italic> fue la <italic>guaca</italic> de <strong>Ancocagua</strong> , donde tanbien avia oraculo muy antiguo y tenido en gran veneraçion. Estava pegado con la <italic>provinçia</italic> de <italic>Hatun Cana</italic> y a tienpos yvan de muchas partes con gran devoçion a este demonio [a] oyr sus vanas respuestas; y avia en el gran suma de tesoros porque los <italic>Yngas</italic> y todos los demas los ponian alli.",88
2011,"Ancocagua",2,"T20023","Los <italic>canas</italic> avianse juntado numero grande dellos en el pueblo que llaman <italic>Luracache</italic>; y como entendieron el daño que avian reçibido los <italic>canches</italic> y como el <italic>Ynga</italic> no hazia injuria a los que se davan por sus amigos ni consentian hazerles agravio, determinaron de tomar amistad con e1. A esto, el rey Ynga venia caminando açercandose a <italic>Lurucache</italic> y entendio la boluntad que los <italic>canas</italic> tenian, de que mostro holgarse mucho; y como estuviese en aquella comarca el tenplo de <strong>Ancocagua</strong> , enbio grandes presentes a los ydolos y çaçerdotes.",125
2012,"Andaguailas",2,"T20024","Y es publico entre todos los yndios ser este tenplo tan antiguo como la misma çibdad del <italic>Cuzco</italic>, mas que <italic>Ynga Yupangue</italic>, hijo de <italic>Viracoche Ynga</italic>, lo acreçento en riquezas y paro tal como estava quando los cristianos entraron en el <italic>Peru</italic> y lo mas del tesoro fue llevado a <italic>Caxamalca</italic> por el rescate de <italic>Atavalipa</italic>, como en su lugar contaremos. Y dizen los <italic>orejones</italic> que despues de aver pasado la dudosa guerra que tuvieron los vezinos del <italic>Cuzco</italic> con los <italic>chancas</italic>, que agora son señores de la <italic>provinçia</italic> de <strong>Andaguaylas</strong> , que como de aquella vitoria que dellos tuvieron quedase <italic>Ynga Yupangue</italic> tan estimado y nonbrado, de todas partes acudian señores a le servir haziendole las <italic>provinçias</italic> grandes serviçios de metales de oro y plata,...",79
2012,"Andaguailas",2,"T20025","Y en aquellos tienpos [los] que tenian su señorio a la parte del Poniente de la çibdad del <italic>Cuzco</italic> y se estendia hasta donde agora es <strong>Andaguaylas</strong> , como lo oyesen, enbiaron a <italic>Capa Inga Yupangue</italic> sus enbaxadores con grandes dones y presentes, enbiandole a rogar los quisiese tener por amigos y confederados suyos; a lo qual respondio el <italic>Ynga</italic> mui bien, dandoles ricas pieças de oro y de plata que diesen a los que los enviaban.",104
2012,"Andaguailas",2,"T20026","Y dizen mas los yndios que en este tienpo heran señores de la <italic>provinçia</italic> que llamavan <strong>Andaguaylas</strong> los <italic>quichuas</italic> y que de junto a un lago que avia por nonbre <italic>Choclococha</italic> salieron cantidad de jente con sus capitanes llamados <italic>Guaraca</italic> y <italic>Basco</italic>, los quales vinieron conquistando por donde venian, hasta que llegaron a la <italic>provinçia</italic> dicha.",111
2012,"Andaguailas",2,"T20027","Estando las cosas del <italic>Cuzco</italic> desta manera, los <italic>chancas</italic> -como atras conte- avian vençido a los <italic>quichuas</italic> y ocupado la mayor parte de la <italic>provinçia</italic> de <strong>Andavaylas</strong> ; y como estuviesen vitoriosos, oyendo lo que se dezia de la grandeza del <italic>Cuzco<italic> e su riqueza e la magestad de los <italic>Yngas</italic>, desearon de no estarse encojidos ni dexar de pasar adelante, ganando con las armas todo lo a ellos posible. Y luego hizieron grandes plegarias a sus dioses o demonios y dexando en Andavaylas, ques la que los españoles llaman <strong>Andaguaylas</strong>, questa encomendada a Diego Maldonado el rico, jente bastante para la defensa della, y con la que estava junta para la guerra, salio <italic>Hastu Guaraca</italic> y un hermano suyo muy vatiente, llamado <italic>Oma Guaraca</italic>, y partieron de su <italic>provinçia</italic> con muy gran sobervia camino del <italic>Cuzco</italic>;...",130
2012,"Andaguailas",2,"T20028","Y dizen los <italic>orejones</italic> que avia en este tienpo gran vezindad en el <italic>Cuzco</italic> y que sienpre yva en creçimiento; y de muchas partes vinieron mensajeros a congratularse con el nuevo rey, el qual respondia a todos con buenas palabras, y deseava salir a hazer guerra a lo que llaman <italic>Condesuyo</italic>. Y como por ysperençia oviese conoçido quan valiente y animoso era <italic>Astu Guaraca</italic>, el señor de <strong>Andaguaylas</strong> , penso de lo atraer a su serviçio; y asi quentan que le enbio mensajeros, rogandole con sus hermanos y amigos se viniese a holgar con el; y entendido que le seria provecho allegarse a la amistad de <italic>Ynga Yupangue</italic> fue al <italic>Cuzco</italic>, donde fue bien reçibido. Y como se oviese hecho llamamiento de jente, se determino de yr a <italic>Condesuyo</italic>.",136
2012,"Andaguailas",2,"T20029","Ordenado esto con gran prudençia, el rey salio de alli y anduvo hasta la <italic>provinçia</italic> de <strong>Andaguaylas</strong> , adonde le fue hecho solene reçibimiento y estuvo alli algunos dias / determinando si yria a conquistar a los naturales de <italic>Guamanga</italic> e <italic>Xauxa</italic> o a los <italic>Soras</italic> y <italic>Lucanes</italic> lo mas despues de avei pensadolo con acuerdo de los suyos deterrnino de yr a los <italic>Soras</italic>. Y saliendo de alli, anduvo por un despoblado que yva a salir a los <italic>Soras</italic>, los quales supieron su venida y se juntaron para se defender",138
