"id_palabra","Palabra","id_cronista","id_texto","cita","pagina"
18075,"Ceque / Ceques",18,"T18190","Al sexto <strong>ceque</strong> llamaban <italic>Collana</italic>, y había en él diez  <italic>guacas</italic>. La primera era un <italic>buhio</italic> dicho <italic>Tampucancha</italic>, que estaba en el sitio de la  casa de Manso Sierra, el cual fue morada de  <italic>Manco-Cápac Inca</italic>.",30
18075,"Ceque / Ceques",18,"T18191","La postrera <italic>guaca</italic> deste <strong>ceque</strong> era una fontezuela llamada <italic>Quizquipúquiu</italic>, que estaba en un llano cabe <italic>Cacra</italic>.",32
18075,"Ceque / Ceques",18,"T18192","El séptimo <strong>ceque</strong> tenia por nombre <italic>Cayao</italic> y habia en él ocho <italic>guacas</italic> á cargo del <italic>ayllu</italic> de <italic>Uscamayta</italic>. ",32
18075,"Ceque / Ceques",18,"T18193","La octava y última deste <strong>ceque</strong> era una fuente llamada <italic>Guamancapúquiu</italic>, que está en una quebrada.",32
18075,"Ceque / Ceques",18,"T18194","El octavo <strong>ceque</strong> se decia <italic>Payan</italic> y tenia ocho <italic>guacas</italic>.",33
18075,"Ceque / Ceques",18,"T18195","El noveno y último <strong>ceque</strong> deste camino que traemos se llamaba <italic>Collana</italic>, y tenia trece <italic>guacas</italic>.",33
18075,"Ceque / Ceques",18,"T18196","La postrera <italic>guaca</italic> deste camino era un cerro llamado <italic>Puncu</italic>, a donde ofrecian lo que sobraba de las <italic>guacas</italic> deste <strong>ceque</strong>.",34
18075,"Ceque / Ceques",18,"T18197","El camino de <italic>Contisuyu</italic>, que nosotros llamamos <italic>Condesuyo</italic>, tenia catorce <strong>ceques</strong> y ochenta <italic>guacas</italic>.",35
18075,"Ceque / Ceques",18,"T18198","Al primer <strong>ceque</strong> llamaban <italic>Anaguarque</italic>, y tenia quince <italic>guacas</italic>.",35
18075,"Ceque / Ceques",18,"T18199","El segundo <strong>ceque</strong> deste dicho camino de <italic>Cuntisuyu</italic> era del <italic>ayllu</italic> de <italic>Quisco</italic>. Llámase <italic>Cayao</italic> y tenia cuatro <italic>guacas</italic>.",36
18075,"Ceque / Ceques",18,"T18200","El tercer <strong>ceque</strong> se nombraba <italic>Payan</italic>, y tenia otras cuatro <italic>guacas</italic>.",36
18075,"Ceque / Ceques",18,"T18201","Al cuarto <strong>ceque</strong> llamaban <italic>Collana</italic> y tenia cinco <italic>guacas</italic>.",37
18075,"Ceque / Ceques",18,"T18202","La quinta se llamaba <italic>Cuipancalla</italic>. Es una quebrada que está camino de <italic>Tambo</italic>, donde echaban lo que sobraba de las ofrendas deste <strong>ceque</strong>.",37
18075,"Ceque / Ceques",18,"T18203","El quinto <strong>ceque</strong> se decia <italic>Cayao</italic>. Estaba á cargo del <italic>ayllu</italic> de <italic>Chimapanaca<italic>, tenia oras tantas <italic>guacas</italic> como el pasado.",37
18075,"Ceque / Ceques",18,"T18204","El sexto <strong>ceque</strong> deste mismo camino se llamaba <italic>Payan</italic>, y tenia cinco <italic>guacas</italic>.",38
18075,"Ceque / Ceques",18,"T18205","El séptimo <strong>ceque</strong> se llamaba <italic>Coyana</italic>, y tenia otras cinco <italic>guacas</italic>.",38
18075,"Ceque / Ceques",18,"T18206","El octavo <strong>ceque</strong> se llamaba la mitad, <italic>Callao</italic>, y la otra mitad, <italic>Collana</italic>, y todo él tenia quince <italic>guacas</italic>.",39
18075,"Ceque / Ceques",18,"T18207","La sexta, <italic>Mascataurco</italic>, es un cerro donde se pierde la vista del <italic>Cuzco</italic> por este <strong>ceque</strong>.",39
18075,"Ceque / Ceques",18,"T18208","La última <italic>guaca</italic> deste <strong>ceque</strong> se decia <italic>Lluquiriví</italic>. Es un cerro grande junto á la quebrada de arriba.",40
18075,"Ceque / Ceques",18,"T18209","El noveno <strong>ceque</strong> tenía por nombre <italic>Callao</italic>, y abrazaba tres <italic>guacas</italic>.",40
18075,"Ceque / Ceques",18,"T18210","Al décimo <strong>ceque</strong> llamaban <italic>Payan</italic>, y tenia cuatro <italic>guacas</italic>.",40
18075,"Ceque / Ceques",18,"T18211","El undécimo <strong>ceque</strong> llamaba <italic>Collana</italic>, y en él había cuatro <italic>guacas</italic>.",40
18075,"Ceque / Ceques",18,"T18212","El duodécimo <strong>ceque</strong> se llamaba <italic>Cayao</italic>, y tenia tres <italic>guacas</italic>.",41
18075,"Ceque / Ceques",18,"T18213","El décimo tercio <strong>ceque</strong> se nombra <italic>Cayao</italic>, y tenia cuatro <italic>guacas</italic>.",41
18075,"Ceque / Ceques",18,"T18214","La cuarta, <italic>Pomaguaci</italic>, es un cerrillo al cabo deste <strong>ceque</strong>, que estaba por fin y término  de las <italic>guacas</italic> dél.",41
18075,"Ceque / Ceques",18,"T18215","El último <strong>ceque</strong> deste camino de <italic>Cuntisuyu</italic> se decia <italic>Collana</italic> y tenia cuatro <italic>guacas</italic>.",41
18075,"Ceque / Ceques",18,"T18216","La segunda <italic>guaca</italic> deste <strong>ceque</strong> se decía <italic>Otcoropúquiu</italic>. Era una fuente cerca de <italic>Picho</italic>, heredad de la Compañía de Jesús.",41
18075,"Ceque / Ceques",18,"T18217","Las cuatro <italic>guacas</italic> siguientes pertenecen a diversos <strong>ceques</strong> no se pusieron por el orden que las demas, cuando se hizo la averiguación. La primera se decía <italic>Mamacocha</italic>. Es una lagunilla pequeña más arriba de la <italic>fortaleza</italic>.",42
18076,"Chacaguanacauri",18,"T18218","La sétima <italic>guaca</italic> se llamaba  <strong>Chacaguanacauri</strong>; la cual es un cerrillo que esta camino a <italic>Yucay</italic>, a donde iban los mancebos que se armaban <italic>orejones</italic> por cierta paja que llevaban en las lanzas.",9
18077,"Chacapa",18,"T18219","La sexta se llamaba <strong>Chacapa</strong>. Es un llano de aquel cabo de <italic>Membilla</italic>.",34
18078,"Chachapoyas",18,"T18220","La cuarta era un llano que llamaban <italic>Vircaypay</italic>, donde se poblaron después de los indios <strong>Chachapoyas</strong>.",32
18079,"Chachacomacaja",18,"T18221","La sétima <italic>guaca</italic> se decía <strong>Chachacomacaja</strong>: eran ciertos árboles puestos a mano, junto a los cuales estaba una piedra a quien hacían sacrificio porque el <italic>Inca</italic> no tuviese ira.",8
18080,"Chácra / Chácara",18,"T18222","La quinta <italic>guaca</italic> era una <strong>Chácra</strong> llamada <italic>Chaguaytapra</italic>, que estaba en <italic>Carmenga</italic> y que fué de <italic>Amaro-Tupa Inca</italic>.",13
18080,"Chácra / Chácara",18,"T18223","La segunda <italic>guaca</italic> era una Pared que estaba junto á la <strong>Chácra</strong> de <italic>Bachicao</italic>, que tenía una barriga hacia afuera, cuyo origen decían haber sido que, pasando por allí el <italic>Inca</italic>, había salido á hacerle reverencia.",19
18080,"Chácra / Chácara",18,"T18224","La tercera llamada <italic>Ayacho</italic>, que está en la misma <strong>Chácra</strong>. Ofrecianle conchas de todos colores.",19
18080,"Chácra / Chácara",18,"T18225","En el séptimo <italic>ceque</italic> llamado <italic>Yacanora</italic>, habia otras siete <italic>guacas</italic>. La primera se decía <italic>Ayllipampa</italic>: era un llano donde está la <strong>Chácra</strong> que fue de Mesa. Decian que era la diosa Tierra llamada <italic>Pachamama</italic>.",23
18080,"Chácra / Chácara",18,"T18226","La segunda <italic>guaca</italic> era una fontezuela junto á esta <strong>Chácra</strong>, llamada <italic>Guamantanta</italic>: ofrecíase en ella lo ordinario.",23
18080,"Chácra / Chácara",18,"T18227","La cuarta se llamaba <italic>Guanipata</italic>, Era una <strong>Chácara</strong> más abajo, donde estaba un paredón que decián habia hecho allí el Sol.",28
18080,"Chácra / Chácara",18,"T18228","La primera se llamaba <italic>Santocollo</italic>. Era un llano más debajo de la <strong>Chácra</strong> de Francisco Moreno.",32
18080,"Chácra / Chácara",18,"T18229","La segunda se decia <italic>Mancochuqui</italic>: era <strong>Chácara</strong> de <italic>Huanacáuri</italic>, y lo que della se cogia le sacrificaban.",13
18080,"Chácra / Chácara",18,"T18230","El segundo <italic>ceque</italic> deste camino se llamaba <italic>Payan</italic> estaba a cargo del <italic>ayllu</italic> de <italic>Haguayni</italic> y tenia ocho <italic>guacas</italic>. La primera era un llano dicho <italic>Limapampa</italic>, donde se hizo la <strong>Chácara</strong> de Diego Gil.",27
18080,"Chácra / Chácara",18,"T18231","La segunda <italic>guaca</italic> se decía <italic>Raquiancalla</italic>. Es un cerrillo que está en aquella <strong>Chácara</strong>, en el cual estaban muchos <italic>ídolos</italic> de todos cuatro <italic>suyus<italic>.",27
18080,"Chácra / Chácara",18,"T18232","La tercera se llamaba <italic>Saucero</italic>. Es una <strong>Chácara</strong> de los descendientes de <italic>Paullu-Inca</italic>, á la cual, en tiempo de sembrar, iba el mismo Rey y araba un poco. Lo que se cogia de ella era para <italic>sacrificios</italic> del Sol.",27
18080,"Chácra / Chácara",18,"T18233","La cuarta era una <strong>Chácara</strong> que se decia <italic>Omatalispacha</italic>, que después fue de Francisco Moreno.",27
18080,"Chácra / Chácara",18,"T18234","la tercera era una fuente nombrada <italic>Pirpoyopacha</italic>, que está en la <strong>Chácara</strong> de Diego Maldonado, en la cual se lavaban los Incas ciertos dias.",28
18080,"Chácra / Chácara",18,"T18235","La cuarta se llamaba <italic>Guanipata</italic>, Era una <strong>Chácara</strong> más abajo, donde estaba un paredón que decián habia hecho allí el Sol.",28
18080,"Chácra / Chácara",18,"T18236","La quinta se nombraba <italic>Anaypampa</italic>,  Era una <strong>Chácara</strong> de la <italic>Coya</italic>-<italic>Mama-Ocllo</italic>.",28
18080,"Chácra / Chácara",18,"T18237","La segunda <italic>guaca</italic> se llamaba <italic>Tancaracay</italic>. Era una sepultura que estaba en un <strong>Chácara</strong> de Diego Maldonado, donde tenian creido que se juntaban en cierto tiempo todos los muertos.",29
18080,"Chácra / Chácara",18,"T18238","La segunda <italic>guaca</italic> era una <strong>Chácara</strong>, dicha <italic>Guachapacha</italic>, que fue después de Diego Maldonado.",33
18080,"Chácra / Chácara",18,"T18239","La primera era una piedra no muy grande, llamada <italic>Oznuro</italic>, que estaba en la <strong>Chácara</strong> de los <italic>Gualparocas</italic>.",41
18081,"Chachaquiray",18,"T18240","La tercera era otra piedra llamada <strong>Chachaquiray</strong>, que estaba lejos de la de arriba.",32
18082,"Chaguaytapara",18,"T18241","La quinta <italic>guaca</italic> era una <italic>chácra</italic> llamada <strong>Chaguaytapra</strong>, que estaba en <italic>Carmenga</italic> y que fué de <italic>Amaro-Tupa Inca</italic>.",13
18083,"Chataguarque",18,"T18242","La octava, <strong>Chataguarque</strong>, era cierta piedra pequeña que estaba en un cerrillo junto á esotra.",35
18084,"Chaquira",18,"T18243","La tercera, <strong>Chaquira</strong>, es un cerro que está cerca del camino de <italic>Calca<italic>, encima del cual habian diez piedras tenidas por <italic>ídolos</italic>.",40
18085,"Chicapúquiu",18,"T18244","La duodécima era otra fuente dicha <strong>Chicapúquiu</strong> que sale cerca de la de arriba.",36
18086,"Chila",18,"T18245","La novena <italic>guaca</italic> se nombraba <italic>Yuncaycalla</italic>: es como puerta donde se ve el llano de <strong>Chila</strong> y se pierde la vista del <italic>Cuzco</italic>.",20
18086,"Chila",18,"T18246","La última <italic>guaca</italic> deste <italic>ceque</italic> era una fuente dicha <italic>Urcomilpo</italic>, que está en el llano grande de <strong>Chila</strong>. ",20
18086,"Chila",18,"T18247","La quinta se decia <italic>Viracochapúquiu</italic>: era una fuente que está en un llano camino de <strong>Chila</strong>.",22
18086,"Chila",18,"T18248","La séptima se decía <italic>Curavacaja</italic>: es un altozano, camino de <strong>Chila</strong>, donde se pierde de vista la ciudad, y estaba señalado por fin y mojón de las <italic>guacas</italic> deste <italic>ceque</italic>.",23
18087,"Chilquichaca",18,"T18249","La primera era un <italic>púquiu</italic> ó fuente llamada <strong>Chilquichaca</strong>.",41
18087,"Chilquichaca",18,"T18250","La segunda se decia <italic>Colcapúquiu</italic>. Era otra fuente que esta en una quebrada que baja de <strong>Chilquichaca</strong>.",41
18088,"Chinchaypúquiu",18,"T18251","La séptima era dicha <strong>Chinchaypúquiu</strong>. Es una fuente que estaba en un  pueblo deste nombre.",34
18088,"Chinchaypúquiu",18,"T18252","La quinta, <strong>Chinchaypúquiu</strong>, era otra fuente que está en una ladera de la puna.",39
18089,"Chinchaysuyu",18,"T18253","Comenzando, pues, por el camino del <strong>Chinchaysuyu</strong>  que sale por el barrio de <italic>Carmenga</italic>, había en el nueve <italic>ceques</italic>, en que se comprehendían ochenta y cinco <italic>guacas</italic>. ",3
18089,"Chinchaysuyu",18,"T18254","El segundo <italic>ceque</italic> desde mismo camino de <strong>Chinchaysuyu</strong> se decía <italic>Payan</italic>; en cual había ocho <italic>guacas</italic> del <italic>ayllo</italic> y familia de <italic>Vicaquirao</italic>. ",4
18089,"Chinchaysuyu",18,"T18255","El quinto <italic>ceque</italic> deste mismo camino y rumbo de <strong>Chinchaysuyu</strong> se decia <italic>Cayao</italic>; contenía diez <italic>guacas</italic>: la primera, llamada <italic>Cusicancha</italic>, era el lugar donde nació <italic>Inca- Yupanqui</italic>, frontero del templo de <italic>Coricancha</italic>; y por esta razón ofrecían allí los del <italic>ayllu</italic> <italic>Inacapanaca</italic>.",8_9
18089,"Chinchaysuyu",18,"T18256","La novena <italic>guaca</italic> se decia <italic>Urcoscalla</italic>. Era el lugar donde perdian de vista la ciudad del <italic>Cuzco</italic> los que caminaban a <strong>Chinchaysuyu</strong>.",14
18089,"Chinchaysuyu",18,"T18257","La décima <italic>guaca</italic> se decia <italic>Catachillay</italic>. Es una fuente que está en el primer llano que abaja al camino de <strong>Chinchaysuyu</strong>.",14
18089,"Chinchaysuyu",18,"T18258","El noveno y último <italic>ceque</italic> de este dicho camino de <strong>Chinchaysuyu</strong> se llamaba <italic>Cápac</italic>, y tenía doce <italic>guacas</italic>. La primera era una fuente dicha <italic>Aypanospacha</italic>, que estaba en la calle de Pedro Alonso Carrasco.",14
18089,"Chinchaysuyu",18,"T18259","La duodécima y postrero <italic>guaca</italic> deste <italic>ceque</italic> era una fuente llamada <italic>Totorgo aylla</italic>: aquí se acababan las <italic>guacas</italic> de los nueve <italic>ceques</italic> del camino de <strong>Chinchaysuyu</strong>, que por todas venian á ser ochenta y cinco.",15_16
18090,"Chinchincalla",18,"T18260","La tercera, <strong>Chinchincalla</strong>, es un cerro grande donde estaban dos  <italic>mojones<italic>, a los cuales, cuando llegaba el Sol, era tiempo de sembrar.",41
18090,"Chinchincalla",18,"T18261","La tercera se llamaba <italic>Ravaypampa</italic>. Era un terrado donde se aposentaba el <italic>Inca</italic>, el cual estaba en la falda del cerro de <strong>Chinchincalla</strong>.",41
18091,"Chinchacuay",18,"T18262","La tercera se llamaba <strong>Chinchacuay</strong>. Es un cerro que está frontero de la <italic>fortaleza</italic>.",42
18092,"Chimapanaca",18,"T18263","El quinto <italic>ceque</italic> se decia <italic>Cayao</italic>. Estaba á cargo del <italic>ayllu</italic> de <strong>Chimapanaca</strong>, tenia oras tantas <italic>guacas</italic> como el pasado.",37
18093,"Chiquinapampa",18,"T18264","La primera <italic>guaca</italic> se decía <strong>Chiquinopampa</strong>: era un cercado que estaba junto al templo del sol, en el cual se hacia el sacrificio por la salud universal de los indios.",16
18094,"Chiripacha",18,"T18265","La tercera <italic>guaca</italic> era una piedra grande llamada <strong>Chiripacha</strong>, que estaba en el principio del camino de <italic>Collasuyu</italic>.",16
18095,"Choco",18,"T18266","La tercera, <italic>Cayallacta</italic>, eran ciertas piedras que estaban en un cerro cabe <strong>Choco</strong> que fue de Hernando Pizarro.",37_38
18095,"Choco",18,"T18267","La cuarta, <italic>Churupúquiu</italic>, es una fuente que está encima de dicho pueblo de <strong>Choco</strong>.",38
18095,"Choco",18,"T18268","La quinta se decia <italic>Cumpuguanacáuri</italic>. Es un cerro en derecho de <strong>Choco</strong>, encima del cual habia diez piedras que tenian creido habia enviado allí el cerro de <italic>Guanacauri</italic>.",38
18095,"Choco",18,"T18269","La quinta se decia <italic>Intirpucancha</italic>. Era un buhio, que estaba en medio del pueblo de <strong>Choco</strong> y habia sido del primer <italic>señor</italic>.",38
18095,"Choco",18,"T18270","La quinta, <italic>Cotacotabamba</italic>, era un llano entre <strong>Choco</strong> y <italic>Cachona</italic>, a donde hacia fiesta en ciertos dias del año, en la cual se apedreaban.",39
18095,"Choco",18,"T18271","La tercera, <italic>Llipiquiliscacho</italic>, era otra sepultura que estaba detrás de <strong>Choco</strong>.",41
18096,"Chora",18,"T18272","La nona era un manantial que llamaban <strong>Chora</strong>, el cual estaba cabe <italic>Andamarca</italic>.",24
18097,"Chuquibamba ",18,"T18273","La quinta <italic>guaca</italic> era un llano llamado <strong>Chuquibamba</strong> que esta junto a la <italic>fortaleza</italic>. ",5
18098,"Chuquipalpa",18,"T18274","La octava y última <italic>guaca</italic> desde <italic>ceque</italic> era un cerro alto llamado <strong>Chuquipalpa</strong>, que esta junto a la <italic>fortaleza</italic>, en el cual estaban puestas tres piedras en representación del <italic>Pachayachachic</italic>, <italic>Intiillapa</italic> y <italic>Punchao</italic>; y en este cerro se hacia sacrificio universal de niños y niñas y figuras pequeñas de lo mismo hechas de oro.",8
18099,"Churuncana",18,"T18275","La séptima <italic>guaca</italic> se decía <strong>Churuncana</strong>; es un cerro redondo que está encima de <italic>Carmenga</italic>, donde se parte el camino Real de chinchero del de <italic>Yucay</italic>. Desde este cerro se hacian <italic>sacrificios</italic> a <italic>Ticciviracocha</italic>.",12
18100,"Chuquimarca",18,"T18276","La cuarta se decia <strong>Chuquimarca</strong>: era un templo del sol en el cerro de <italic>Mantocalla</italic>, en la cual decían que bajaba á dormir el Sol muchas veces.",19_20
18100,"Chuquimarca",18,"T18277","La cuarta era un cerrillo llamado <strong>Chuquimarca</strong>, que está junto á <italic>Guanacáuri</italic>.",33
18101,"Chuquimatero",18,"T18278","La primera era una fuente llamada <strong>Chuquimatero</strong>, de donde beben los indios de <italic>Cayocache</italic>.",36
18102,"Chuquiquirao púquio",18,"T18279","La décima <italic>guaca</italic> se llamaba <strong>Chuquiquirao Púquio</strong>: era una fuente que nace en una quebrada en la falda del cerro sobredicho.",21
18103,"Chuquicancha",18,"T18280","La tercera se llamaba <strong>Chuquicancha</strong>: es un cerro muy conocido, el cual tuvieron que era casa del Sol.",22
18103,"Chuquicancha",18,"T18281","La sexta se llamaba <italic>Unugualpa</italic>; ésta era una piedra que estaba en <strong>Chuquicancha</strong>, la cual cuentan que sacando piedra la hallaron como en figura humana.",23
18104,"Churucana",18,"T18282","La cuarta <italic>guaca</italic> eran unas piedras llamadas <strong>Churucana</strong>, que estaban encima de un cerro, más abajo.",25
18104,"Churucana",18,"T18283","La tercera <italic>guaca</italic> se decía <strong>Churucana</strong>. Es un cerro pequeño y redondo que esta junto a San Lázaro, encima del cual estaban tres piedras tenidas por <italic>ídolos</italic>.",26
18104,"Churucana",18,"T18284","La cuarta, <strong>Churucana</strong>, era cierta piedra grande que estaba en un cerro junto á el de <italic>Anaguarque</italic>.",37
18105,"Chucuracaypúquiu",18,"T18285","La cuarta <strong>Chucuracaypúquiu</strong>, es una quebrada que está camino de <italic>Tambo</italic>, donde se pierde la vista el valle del <italic>Cuzco</italic>.",37
18106,"Churupúquiu",18,"T18286","La cuarta, <strong>Churupúquiu</strong>, es una fuente que está encima de dicho pueblo de <italic>Choco</italic>.",38
18107,"Chusacachi",18,"T18287","La tercera <italic>guaca</italic> se decia <strong>Chusacachi</strong>: es un cerro grande, camino de los <italic>Andes</italic>, encima del cual estaban las piedras que eran adoradas",18
18108,"Cicacalla",18,"T18288","La cuarta se decia <strong>Cicacalla</strong>. Eran dos piedras que estaban en el mismo pueblo de arriba [Quijalla]. Ofrecianle conchas pequeñas y topa quemada.",30
18109,"Cicui",18,"T18289","La décima, <strong>Cicui</strong>, era una sepultura que estaba en la aldera de <italic>Cachona</italic>.",39
18110,"Cinca",18,"T18290","La novena <italic>guaca</italic> era un cerro que esta camino del valle de <italic>Yucay</italic>, llamado <strong>Cinca</strong>, en que habia una piedra que adoraban los indios de <italic>Ayamarca</italic>, teniendo opinión que procedian della [sic].",10
18111,"Cinchiroca",18,"T18291","La tercera era una casa dicha <italic>Acoyguaci</italic>, que estaba en <italic>Membilla</italic>, en la cual se guardaba el cuerpo del <italic>Inca</italic> <strong>Cinchiroca</strong>.",30
18112,"Cirocaya",18,"T18292","La cuarta guaca se decía <strong>Cirocaya</strong>: es una cueva de piedra, de la cual tenía creído que salía el granizo.",4
18113,"Coapapúquiu",18,"T18293","La sexta era cierta fuente llamada <strong>Coapapúquiu</strong>, que está junto al mismo cerro de <italic>Guanacáuri</italic>.",33
18114,"Colacalla",18,"T18294","La segunda <italic>guaca</italic> era una piedra dicha <strong>Colacalla</strong>, que estaba en el camino Real cerca del pueblo de <italic>Quicalla</italic>, la cual era de los <italic>Pururaucas</italic>.",32
18115,"Colcapata",18,"T18295","La cuarta <italic>guaca</italic> se llamaba <strong>Colcapata</strong>; y era la casa de <italic>Paullo</italic> <italic>Inca</italic>, donde estaba una piedra por <italic>ídolo</italic>, que adoraba el <italic>ayllo</italic> de <italic>Andasaya</italic>; y el origen que tuvo fue haberla mandado adorar <italic>Pachacutic Inca</italic>.",8
18116,"Colcapampa",18,"T18296","La cuarta era una plaza grande llamada <strong>Colcapampa</strong>, donde se hizo la parroquia de los Mártires, al cabo del cual estaba una piedra que era un <italic>ídolo</italic> principal.",23
18117,"Colcapúquiu",18,"T18297","La segunda se decia <strong>Colcapúquiu</strong>. Era otra fuente que esta en una quebrada que baja de <italic>Chilquichaca</italic>.",41
18118,"Colquemachacuay",18,"T18298","La primera se decia <strong>Colquemachacuay</strong> (suena culebra de plata). Es una fuente de buen agua muy conocida, que está en la falda del cerro de <italic>Puquin</italic>, junto á la ciudad del <italic>Cuzco</italic>.",40
18119,"Collaconcho",18,"T18299","La sexta <italic>guaca</italic> era una piedra grande llamada <strong>Collaconcho</strong>, que estaba en la <italic>fortaleza</italic>, la cual afirman que, trayéndola para aquel edificio, se les cayó tres veces y mató algunos indios; y los <italic>hechiceros</italic>, en preguntas que le hicieron, dijeron haber respondido, que, si porfiaban en querella poner en el edificio todos habrian mal fin, allende de que no serían parte para ello; y desde aquel tiempo fue tenida por <italic>guaca</italic> General. ",8
18120,"Collana",18,"T18300","El tercer <italic>ceque</italic> deste camino se decía <strong>Collana</strong> tenía diez <italic>guacas</italic>.",6
18120,"Collana",18,"T18301","El sexto <italic>seque</italic> se decia <strong>Collana</strong>, como el tercero y tenía once <italic>guacas</italic>.",10
18120,"Collana",18,"T18302","Tenía el camino de <italic>Antisuyu</italic> nueve <italic>ceques</italic> y en ellos setenta y ocho <italic>guacas</italic>, por este-orden. El primer <italic>ceque</italic> se llamaba <strong>Collana</strong>, y estaba á cargo del <italic>ayllu</italic> de <italic>Cubcupañacaayllu</italic>.",16
18120,"Collana",18,"T18303","El cuarto <italic>ceque</italic> deste dicho camino se decia <strong>Collana</strong>: era del <italic>ayllu</italic> y familia de <italic>Aucailli</italic> <italic>panaca</italic>, y tenia siete <italic>guacas</italic>. La primera se llamaba <italic>Cariurco</italic>, y era un cerro que está cerca de <italic>Mantocalla</italic>, encima del cual había ciertas piedras que eran veneradas y les ofrecían ropa y carneros manchados.",20
18120,"Collana",18,"T18304","El tercer <italic>ceque</italic> tenia por nombre <strong>Collana</strong>, y en él habia nueve <italic>guacas</italic>. La primera se llamaba <italic>Tampucancha</italic>. Era parte de la casa de Manso Sierra, en que habia tres piedras adoradas por ídolos.",27
18120,"Collana",18,"T18305","Al sexto <italic>ceque</italic> llamaban <strong>Collana</strong>, y había en él diez <italic>guacas</italic>. La primera era un buhio dicho <italic>Tampucancha</italic>, que estaba en el sitio de la  casa de Manso Sierra, el cual fue morada de  <italic>Manco-Cápac Inca</italic>.",30
18120,"Collana",18,"T18306","El noveno y último <italic>ceque</italic> deste camino que traemos se llamaba <strong>Collana</strong>, y tenia trece <italic>guacas</italic>.",33
18120,"Collana",18,"T18307","Al cuarto <italic>ceque</italic> llamaban <strong>Collana</strong> y tenia cinco <italic>guacas</italic>.",37
